job_id,job_title,job_date,job_loc,job_city,job_lng,job_lat,job_summary,job_salary,job_url,company_name,company_type,search_time,search_position,source,search_qualified
41d0c8ab737d141d,Lead Auditor – Beverwijk,2022-11-05,Beverwijk,Beverwijk,4.6572,52.4864,"Voor onze opdrachtgever uit Beverwijk zijn wij op zoek naar een Lead Auditor.
Bestuderen van directie beoordeling, uitkomsten van de recente interne audits en…","['4.000', '4.500']",https://www.indeed.nl/rc/clk?jk=41d0c8ab737d141d&fccid=2a3bf5154a444eea&vjs=3,Loopbaan.nu,recruiter,2022-10-06 15:46:48,auditor,indeed.nl,True
4303a9f9f1ba1636,IT- Auditor,2022-11-05,Randstad+2 plaatsen,,,,"Een salaris dat oploopt tot €6,000, ingeschaald op basis van kennis en kunde;
Flexibele werktijden, jij plant je dag in;","['3.000', '6.000']",https://www.indeed.nl/pagead/clk?mo=r&ad=-6NYlbfkN0Dbl-ni-BlMHqJ_l-VMw5y_nHHvo3hHZpGW61s_iaK1PeDy_M8OMs4BWYPQzIdI7JXraHO0OjJF7XM-Kype0X0Zxc2O83q83ftGalCtgEW6PtDj7xiuBjmhzUe7iHQI2biSvR41L5hwRQONOgb_rxOsMYu9kA54G_FlBUzowxsvnZo3YA47csMn4T7cPWCWOfDlTj5siNesCGBNODuKBhu0KobhGxOP38jzbTAQvIR9hk4wT4T2wxmo9yf0aIsH4CwPqeq7AMprpWcplrC1nQ7LKA1rh079CgJjJXHWQEjLfJ_HPuHw7Md9ebmaJPtVkKQ9FNLOUAnVt-zj-_hB2vs5_Ho4VELQWGjP57-L23iWfj76rL89k1OjlMuIEYUQDvis0IyKbNCEKR39Ey-hpWYIzYwMsvR3_F5RyyJLXRgKQcFR6heRmaYSbAeM8d6CQZIilmK0wuvhGLtZbrsjRpHO4qMODTrPYoY=&p=5&fvj=0&vjs=3,StackOps,recruiter,2022-10-06 15:46:48,auditor,indeed.nl,True
435ca234cce8cf03,Accounting Officer,2022-05-20,Amsterdam,Amsterdam,4.8833,52.3667,"Maintain contact with auditors, tax advisors, lawyers, notaries and other involved parties in order to obtain the required information for reporting purposes.",[],https://www.indeed.nl/rc/clk?jk=435ca234cce8cf03&fccid=407208a60bfc4c49&vjs=3,TMF Group,employer,2022-10-06 15:45:48,auditor,indeed.nl,True
43f12e7fc7d2a833,Compliance Model Validator (Freelance/ZZP),2022-07-06,Utrecht,Utrecht,5.1222,52.0908,"6 month project (with the possibility to extend).
As a gatekeeper to the financial system, the bank crucially relies on the quality of its models to prevent and…",[],https://www.indeed.nl/pagead/clk?mo=r&ad=-6NYlbfkN0CDloe_lQNlRWV8BKR31y3a0MYthPWEmP5E88ckPB8SmA4Qze--ln8yF2sFL5FCGNjoXoQxKLckQOqopIBQQeNpoRQsFQ4C2mrCESwbB1evx0Bh8wT5wp6TUxlldufkbVPfVmHCqO_xewFNVSOZTSwHtlriT6ksL34-YZAbZhartEjZYoQTgRnuZ6WHurX6WhmlulYBK3LsYri-Bj_6IpTIWYDrXLSoujMszRRJtsZTvyAvr47Ck4-0z2V1hYPSxLx7KV8X5PVY2_S35x5S5K0dWbN9eMkftIAEZOv3mNdPgW_1MahKewH6-Hm_49A2IjIDpa0DwCvhvbWdOsKNjoEiR1GmGKbz7XZAq-LIln7BfQ_9zaEFc5yCW6mvbYcWakQz7-ir-2SlHSJcUkiGauEI-BuNfJMRFvs_PI3xRHOwdSWR70wi5QMf-NlsjpAA4ZgPJEst1kJC4ky17DDcDI70uT5ocPfoA0qK6V97GB2_8gje1zj8CuCI_dRu73ZUPp6uB29k1Ghr8kx11KxG6S4iRbXOr5Hq6siPyRF605L9YVNwkZLGYRMO8OkDfpXE959ngxACZ5kaf4MIGGz_ppa7&p=2&fvj=0&vjs=3,itprojects,recruiter,2022-10-06 15:46:48,auditor,indeed.nl,True
4405d416d86c9c06,CFO,2022-11-05,Amsterdam,Amsterdam,4.8833,52.3667,"Liaise/interact with shareholders, external auditors, tax, and banks.
Provides analytical decision support and performance tracking across a range of strategic…",[],https://www.indeed.nl/rc/clk?jk=4405d416d86c9c06&fccid=7f127ae86a5f5452&vjs=3,Bridgewell,recruiter,2022-10-06 15:46:48,auditor,indeed.nl,True
445572f3b779c4fd,"Property Services Audit Program, Netherlands",2022-11-05,Amsterdam,Amsterdam,4.8833,52.3667,Property Services Audit Program (part-time- 0.5 FTE ) Roles: We are looking for 8-11 auditors to join our Property Services Audit Program including 3 roles…,[],https://www.indeed.nl/rc/clk?jk=445572f3b779c4fd&fccid=526dc61714868c28&vjs=3,IWG,employer,2022-10-06 15:45:48,auditor,indeed.nl,True
447ac8b4472a4068,Information Security Compliance Manager,2022-11-05,Postcode 3013 in Rotterdam,Rotterdam,4.4792,51.9225,"Participate in internal and external audits and guide/translate between auditor and personnel.
In the role of Information Security Compliance Manager, you will…",[],https://www.indeed.nl/rc/clk?jk=447ac8b4472a4068&fccid=2e9bbb37fdefc225&vjs=3,Signicat,employer,2022-10-06 15:45:48,auditor,indeed.nl,True
453c9a83b6890d04,Kwaliteitsmanager,2022-11-05,Gorinchem,Gorinchem,4.9742,51.8306,"Contacten onderhouden met surveyors en extern auditors.
Op het gebied van product kwaliteit zorg je dat de klant de beste kwaliteit ontvangt door het proces van…","['3.300', '4.500']",https://www.indeed.nl/rc/clk?jk=453c9a83b6890d04&fccid=78256299f3693a4c&vjs=3,Fideel Recruitment,recruiter,2022-10-06 15:46:48,auditor,indeed.nl,True
453fb47c3e4ed52b,Manager Financial Control,2022-11-05,Noord-Brabant,,,,Sinds enkele tientallen jaren helpt onze opdrachtgever organisaties met het managen én verbeteren van hun totale facilitaire diensten.,[],https://www.indeed.nl/rc/clk?jk=453fb47c3e4ed52b&fccid=af136c4992d9560c&vjs=3,Impactsearch,recruiter,2022-10-06 15:46:48,auditor,indeed.nl,True
45cd5fac58176173,QA Coordinator,2022-11-05,Noord-Holland,,,,"Guide external auditors, support in customer questionnaires, customer requests and questions (internal and external);",[],https://www.indeed.nl/rc/clk?jk=45cd5fac58176173&fccid=a46683ec51ead49e&vjs=3,Archer Daniels Midland Company,employer,2022-10-06 15:45:48,auditor,indeed.nl,True
461ad93a85e8ee6d,IT Supportspecialist,2022-11-05,Hoenderloo,,,,"Onze partner ondersteunt controllers, accountants en auditors met softwareoplossingen en is een ambitieus en innovatief bedrijf van ± 70 man.",[],https://www.indeed.nl/rc/clk?jk=461ad93a85e8ee6d&fccid=d109ac65bbf0c6fd&vjs=3,Kunneman & Vandenbroek Recruitment Solutions,recruiter,2022-10-06 15:46:48,auditor,indeed.nl,True
46a7e64844dc3d4f,Assurance Manager | Register Accountants (RA),2022-11-05,Utrecht,Utrecht,5.1222,52.0908,Heel belangrijk; je challenget en ontwikkelt consultants en supervisors in teams van drie tot vier performance experts (auditors) en zorgt voor een steile…,"['4.600', '6.000']",https://www.indeed.nl/company/Conclude-Accountants/jobs/Assurance-Manager-Register-Accountants-46a7e64844dc3d4f?fccid=fe2c1f6cb4118ce5&vjs=3,Risklane - Conclude Accountants,employer,2022-10-06 15:45:48,auditor,indeed.nl,True
474e0d360332ac62,Ethical Hacker en pentester,2022-11-05,Flevoland+1 plaats,,,,"Zij versterkt deze organisaties op het gebied van efficiëntie, continuïteit en digitale beveiliging.
De organisatie legt voornamelijk haar focus op het…",[],https://www.indeed.nl/pagead/clk?mo=r&ad=-6NYlbfkN0A4kN9jc6Mz-RNFdI9vcsCazqXW0kmXrcW3oUYVY72RkmJWlDHgfub8f-wx8CeIg5iAa2hmdc3L6PJw2x65b4UTe6ykDiaeQ4WeGu937PVl1lf8OvTyOjZxAH0l874W5dpzhKybRTuY6zcL-Ju1QkphjGHYW4yN0Hu3bgSxUzlku1x0eq_avd89nH7gz30CUvPe6tdmg5e5mH5Ztw7jZjmMmuNgyu2ghrwVhXshdSBm8rAU6LzR7Ane9i1lLuK4f1xONucA0O2PfTz3KR0OnEbvTycoEwYAxaPiv-L5Jbw9_NTUGYi9E8cwh45fp7G_KVh8B9zgZgD4_arUZjvUOxKeq0UEZkmdkPHYvazaE8SCGyteYfrJxPsLoHNp0M46ZMFmRQF5blPzKtppRNu_3QlySWBCR_M9UtKGXsZCpKYTRdIO5vgTdk2f0j-1KKAYnvRf43Ka3jJSU2tMlMtw1PA6zX_6Ct_QqZyWIj9o45XrJAWovrFBTabtbwoZh97MTkr_2F-rEC1HKQ==&p=4&fvj=0&vjs=3,CareerValue,recruiter,2022-10-06 15:46:48,auditor,indeed.nl,True
4762b6539466c4f5,Contractbeheerder,2022-11-05,Nederland,,,,"Voor specifieke deskundigheid maak je gebruik van externe specialisten.
De gecontracteerde service niveaus dienen als uitgangspunt.",['3.738'],https://www.indeed.nl/rc/clk?jk=4762b6539466c4f5&fccid=f3eb76b3254d4583&vjs=3,Visio,employer,2022-10-06 15:45:48,auditor,indeed.nl,True
478156865939eadb,Junior Manager IT Audit,2022-11-05,Apeldoorn+6 plaatsen,Apeldoorn,5.97,52.21,"Deze visie loopt als een rode draad door onze gehele dienstverlening.
Als IT-Auditor/ Junior Manager IT Audit houd je je bezig met uiteenlopende opdrachten bij…",[],https://www.indeed.nl/rc/clk?jk=478156865939eadb&fccid=cf80abde47d3bd81&vjs=3,Mazars,employer,2022-10-06 15:45:48,auditor,indeed.nl,True
478eb093201f3196,Auditor Horizontaal Toezicht,2022-11-05,Zeist,Zeist,5.2333,52.0833,"Die kosten besparen en waardoor processen efficiënter worden.
Dat stelt zorgaanbieders in staat goedkoper zorg te leveren die van een hogere kwaliteit is.","['3.993', '5.557']",https://www.indeed.nl/rc/clk?jk=478eb093201f3196&fccid=7ca46013dc607bed&vjs=3,Zilveren Kruis,employer,2022-10-06 15:45:48,auditor,indeed.nl,True
47e87c3a4329efc8,Internal Auditor,2022-10-06,Rotterdam,Rotterdam,4.4792,51.9225,"Our customer is a Dutch Market leader in the field of telecommunications and is dedicated to ensuring safe, reliable and future-proof networks and services.",[],https://www.indeed.nl/pagead/clk?mo=r&ad=-6NYlbfkN0AIvxgfZlZPhMMof6OESzYg65rUk49dxrmsodbKew5kKQ7VcDltUh9HhZI1Q72YKeYib7W8hUvQLtXdAjPZ86Z7viGyy2-B5O4Gr89Auhi7LbX1pU9IhnlbPzb31xIJiieptVlbgsVx_T_nWFYfVKJ651X8dMH0rv3R2rn8ZkC6q8WEcdCWWporOGYTBXe8dIwlu7N22gb62G1nfAiY1l7uFio0RcnJguZyQS775XM0h-ANpKZWmD60hkwCzvTQGKBDk0ZcO4-TVDnXjF5vWULhwEKZIfAuyLIoy883qW4zj2W2GnZPGpUvCfENaye7zkUkFzrzzo5DveJ3ntzXiiVZeQHksAd-jXl2KdOz7QacSLnPw71fsOBD-ytoRXYDZuIpkAUH8ORv4ocdVkEstCnNcqIX0LyGiNcAT4xa_gLl_ejQHGLMywxAkq3TN9JyeLHqIXKN_KRxw4ATylk4RZM4eZZmtdqRP6o=&p=1&fvj=0&vjs=3,HAYS,recruiter,2022-10-06 15:46:48,auditor,indeed.nl,True
47e9e738ac43ac0d,Senior Internal Auditor,2022-05-13,Rotterdam,Rotterdam,4.4792,51.9225,You will work directly with the Internal Audit Manager to manage the entire audit process in line with both internal and external legislation.,"['60.000', '70.000']",https://www.indeed.nl/rc/clk?jk=47e9e738ac43ac0d&fccid=0b29387857fb8b9a&vjs=3,Apollo Solutions,recruiter,2022-10-06 15:46:48,auditor,indeed.nl,True
49e689944ab7b333,(Financial) Controller,2022-11-05,Postcode 2314 in Leiden,Leiden,4.4931,52.1583,"Prepare relevant information to the external auditors to facilitate the annual audit, and manage the audit process for several Group entities;",[],https://www.indeed.nl/rc/clk?jk=49e689944ab7b333&fccid=0e3d40e35a80a9ce&vjs=3,Nomios,employer,2022-10-06 15:45:48,auditor,indeed.nl,True
49ead6d0b13af431,Business Analyst Credit Risk,2022-11-05,Amsterdam,Amsterdam,4.8833,52.3667,"Prepares responses to ad-hoc requests from stakeholders (e.g. ECB, DNB, Internal and external auditors).
The practice has positioned itself as a valuable and…",[],https://www.indeed.nl/rc/clk?jk=49ead6d0b13af431&fccid=2df6a1e69a70a1e7&vjs=3,Cognizant,employer,2022-10-06 15:45:48,auditor,indeed.nl,True
49f333a7953bdbd9,Financial Controller – Suitsupply,2022-11-05,Amsterdam,Amsterdam,4.8833,52.3667,"Act as a sparring partner for the finance team, management team operational department and external auditors;
Contribute to the monthly/quarterly/annual closing…",[],https://www.indeed.nl/rc/clk?jk=49f333a7953bdbd9&fccid=5d1cd7991a8d6b8c&vjs=3,Greenberg Nielsen,recruiter,2022-10-06 15:46:48,auditor,indeed.nl,True
4a220dc9500b37e4,Junior Manager IT Assurance – Landelijk,2022-11-05,Nederland,,,,Samen met andere collega’s mag je onze Junior IT Auditors begeleiden in hun ontwikkeling binnen het vakgebied en onze klanten voorzien van diverse audits binnen…,[],https://www.indeed.nl/rc/clk?jk=4a220dc9500b37e4&fccid=3639654bd4055c70&vjs=3,BDO,employer,2022-10-06 15:45:48,auditor,indeed.nl,True
4a3652c83d780d11,Junior Financial Controller,2022-11-05,Hybride werken in Heerlen,Heerlen,5.9833,50.8833,"Je bent sparringpartner voor second line, interne/externe auditors alsmede toezichthouders.
Voor APG AM en haar klanten (Pensioenfondsen) is betrouwbare data,…","['3.091', '4.415']",https://www.indeed.nl/rc/clk?jk=4a3652c83d780d11&fccid=113bb7f6362ec380&vjs=3,APG,employer,2022-10-06 15:45:48,auditor,indeed.nl,True
4a65c41193edd461,Auditor Horizontaal Toezicht,2022-01-06,Hybride werken in Postcode 6881 in Velp,Velp,5.9758,51.9947,"Die kosten besparen en waardoor processen efficiënter worden.
Dat stelt zorgaanbieders in staat goedkoper zorg te leveren die van een hogere kwaliteit is.",[],https://www.indeed.nl/rc/clk?jk=4a65c41193edd461&fccid=a8a68a6af6128187&vjs=3,Gezond Know How,employer,2022-10-06 15:45:48,auditor,indeed.nl,True
4a9935fc8b0de630,"Assistant VP, Fund Accounting",2022-11-05,Willemstad Curaçao,Willemstad,4.4378,51.6919,"Assisting auditors and other fund participants and advisers;
Maintaining relationships with investors, investment advisors/managers, banks, brokers and auditors…",[],https://www.indeed.nl/rc/clk?jk=4a9935fc8b0de630&fccid=58a0b6e7b7d51d7e&vjs=3,Citco,employer,2022-10-06 15:45:48,auditor,indeed.nl,True
4b04bac793f95c9f,"Manager, Supply Chain Certification",2022-03-06,Amsterdam,Amsterdam,4.8833,52.3667,"Managing the quality of implementation activities for our region including communication with auditors, monitoring our license review process, and supporting…",[],https://www.indeed.nl/rc/clk?jk=4b04bac793f95c9f&fccid=eb834e82fc139249&vjs=3,Rainforest Alliance,employer,2022-10-06 15:45:48,auditor,indeed.nl,True
4b4bdff950d43dfa,Night Auditor,2022-05-13,Postcode 7160 in Neede,Neede,6.6167,52.1333,"A Night Auditor maintains the professional financial standards of the hotel by managing end-of-day reports, ensuring accuracy, and reporting anomalies.",[],https://www.indeed.nl/rc/clk?jk=4b4bdff950d43dfa&fccid=6f47211b0637a52d&vjs=3,Hilton,employer,2022-10-06 15:45:48,auditor,indeed.nl,False
4b4d5f6227427b7c,IT Auditor,2022-11-05,Thuiswerken in Gouda,Gouda,4.7056,52.0181,"Voor onze afdeling Audit, Risk & Compliance zijn wij op dit moment op zoek naar een IT Auditor.
Je houdt je bezig met het uitvoeren van interne audits op onze…",[],https://www.indeed.nl/pagead/clk?mo=r&ad=-6NYlbfkN0AuKbZOEW-E7A2haJyAoyjjxWQehSfLgZhuNRC-akG-tE9xkKdU7Du6cwoGgfeT-WZSlJlY76naRkis83-0WDVdhGIl0U7gi8pNTz5QNs0U473U2zTRT-VvkCu9Dvi5TApZ9ZWYfl_rLiKgs4ei3t_dMpki7IaQp5S6FYDBHJ2afYBn36Ne-zVcmjuqXMbU7BcZbv9md5DEN58ncc0f9NS0rz6qrsCXaVuW5VhLYYoi0XMkL_svhqflhDpySSCdJU70uUc6a4nOAH67Xw6N2ADW1PlXz0etFBBpStn68wNq_KjoGoD1mPZBnRjxcWGBL3rmQjI66o7_3xUePI5H_pPESNDgQQYynWj8fOocD2Ogk0cKgjwYFN3PLeDwqMiwNhMfOGj4gNAIjV-dBDRu-ix50FTBZa319QOdJFPkfEbF9a0X8BGMJtqvGrd-4IcBUtrdbIOXBIRZ9m_TmrFEO_y67HxJfSY2inRiMTw-0QUrKr3MJneFdhr8jSKd0iR2aV07hHhHP5BpCcpsXycndcqJ6bIpybNXKpFp7gBtpSOYgfwj9ntGEv5nTBlVNFXBF03XOurpPB-8Wa5eF0JF4fnFFcWGtssmm0g5stuR4ztKRy_mgLPwLnFXxGpp74OZoZyyvG5nCNXPXeWUMv4ZXQDHF6Bmj-xEIb7F-FdXkfwdu4SbK_FttxaZBqqdqrpCBxrnZ6pA2GwCCtSUsZCgxwibnsE2uZfoVxIeZjkNTbqTvghORh03yiuUmcDSRRawN3yEln2siPIeAt0r8uhsubuJsh7_jCi4wUo=&p=0&fvj=0&vjs=3,Centric,recruiter,2022-10-06 15:46:48,auditor,indeed.nl,True
4b620735486ef900,International Accountant,2022-05-13,Amsterdam,Amsterdam,4.8833,52.3667,Be the main point of contact for the statutory audits and ensure smooth collaboration with the auditors for successful closing.,[],https://www.indeed.nl/rc/clk?jk=4b620735486ef900&fccid=f3a36f726f745c17&vjs=3,Faire,employer,2022-10-06 15:45:48,auditor,indeed.nl,True
4bbff38c99424689,Security Analyst (Remote),2022-11-05,Thuiswerken in Amsterdam,Amsterdam,4.8833,52.3667,"Act as a point of contact for security related queries from internal staff and auditors.
We are looking for a talented Security Analyst to play a key role in…",[],https://www.indeed.nl/rc/clk?jk=4bbff38c99424689&fccid=affdf1e411b75152&vjs=3,Currencycloud,employer,2022-10-06 15:45:48,auditor,indeed.nl,True
4bcd457d26054d05,Talent Acquisition Manager,2022-05-24,Postcode 1017 in Amsterdam Centrum+1 plaats,Amsterdam,4.8833,52.3667,"In this role, you will be responsible for creating the best recruitment and onboarding experience; Your days will be a combination of spotting the right talent,…",[],https://www.indeed.nl/rc/clk?jk=4bcd457d26054d05&fccid=827d82146a6b8d9b&vjs=3,DataSnipper,employer,2022-10-06 15:45:48,auditor,indeed.nl,True
4c1667b9e90a6565,Senior Auditor,2022-05-24,Den Haag,Den Haag,4.2986,52.0767,"Active coaching of auditors during engagement.
The senior auditor is capable and responsible for executing more complex engagements from planning to reporting…",[],https://www.indeed.nl/rc/clk?jk=4c1667b9e90a6565&fccid=817dbf75ac000d11&vjs=3,Aegon,employer,2022-10-06 15:45:48,auditor,indeed.nl,True
4c55801faf55be13,ZZP Receptionist / receptioniste (nacht) Amsterdam,2022-11-05,Amsterdam,Amsterdam,4.8833,52.3667,"Tijdens jouw werk als night auditor doe je waardevolle ervaring op en geef je een boost aan je cv.
Je bent in bezit van eigen vervoer en staat graag op…",[],https://www.indeed.nl/rc/clk?jk=4c55801faf55be13&fccid=ab7ef510f8695154&vjs=3,Ivoren Wachters,recruiter,2022-10-06 15:46:48,auditor,indeed.nl,True
4c59d199b1af9476,"IT Risk Officer, Risk & Control",2022-11-05,Amsterdam,Amsterdam,4.8833,52.3667,"Familiarity with SOX and auditor testing methodology.
Strong stakeholder management skills (control/process owners, auditors).",[],https://www.indeed.nl/rc/clk?jk=4c59d199b1af9476&fccid=62ee2fabbf8c93c5&vjs=3,Booking.Com,employer,2022-10-06 15:45:48,auditor,indeed.nl,True
4c8005c59159d7e6,Junior volmacht auditor,2022-11-05,Amstelveen,Amstelveen,4.8639,52.3008,"Als dossier auditor Volmachten speel je, samen met jouw directe collega’s, een belangrijke rol in de risicobeheersing van deze uitbestede werkzaamheden.",[],https://www.indeed.nl/rc/clk?jk=4c8005c59159d7e6&fccid=fd16eab711fd6d32&vjs=3,MS Amlin,employer,2022-10-06 15:45:48,auditor,indeed.nl,True
4d5f655f2c7945e6,Supervisor Audit Den Bosch,2022-11-05,Den Bosch+1 plaats,,,,Als Supervisor Audit verricht je in samenwerking met de (junior) manager en/of partner uiteenlopende accountancywerkzaamheden.,[],https://www.indeed.nl/rc/clk?jk=4d5f655f2c7945e6&fccid=1bfec2a2f61dd5c2&vjs=3,Baker Tilly,employer,2022-10-06 15:45:48,auditor,indeed.nl,True
4de59c7db859b7c6,Auditor feed en food,2022-05-20,Giessen,Giessen,5.0328,51.7886,"Werken bij Schouten Certification brengt een hoge mate van vrijheid, eigen initiatief en verantwoordelijkheid met zich mee.
In het bezit van een rijbewijs;",[],https://www.indeed.nl/rc/clk?jk=4de59c7db859b7c6&fccid=6b0bb000c61d4f98&vjs=3,Schouten Certification,employer,2022-10-06 15:45:48,auditor,indeed.nl,True
4e1e8e960e3ce8a5,Audit Manager IT,2022-05-24,Den Haag,Den Haag,4.2986,52.0767,"As Senior IT Auditor you are responsible and accountable for planning, execution and reporting of audit activity accordance with internal standards,…",[],https://www.indeed.nl/rc/clk?jk=4e1e8e960e3ce8a5&fccid=817dbf75ac000d11&vjs=3,Aegon,employer,2022-10-06 15:45:48,auditor,indeed.nl,True
4e3863986d6f8843,Merchandiser/ Marktonderzoeker Nielsen,2022-11-05,Hilversum,Hilversum,5.18,52.23,Door het land heeft Askell meerdere merchandisers/ field auditors zitten die onderzoek verrichten in supermarkten en non-food discounters.,[],https://www.indeed.nl/rc/clk?jk=4e3863986d6f8843&fccid=237b531756e8f375&vjs=3,Beryl Personeel,recruiter,2022-10-06 15:46:48,auditor,indeed.nl,False
4e3ce2e8e02294fa,Corporate Tax Accounting & Compliance Analyst,2022-11-05,Amsterdam,Amsterdam,4.8833,52.3667,"This person will be assisting with our ever-growing corporate tax accounting & compliance obligations globally for our EMEA entities, including:",[],https://www.indeed.nl/rc/clk?jk=4e3ce2e8e02294fa&fccid=66403b30a2c0d89c&vjs=3,Netflix,employer,2022-10-06 15:45:48,auditor,indeed.nl,True
4e830dee78bea2a7,Inventarisatie medewerker,2022-03-06,Postcode 5018 in Tilburg,Tilburg,5.0911,51.5572,"Je dag begint op het kantoor in Tilburg waar iedereen zich verzamelt.
Het is de bedoeling dat iedereen om 07:00 uur start dus om 05:30 uur moeten jullie bij het…",[],https://www.indeed.nl/pagead/clk?mo=r&ad=-6NYlbfkN0B9Ak2qbULfxxbbmiAFOKi1mKNqDlx_OqjJbgVKyWtRnCq7XdmyWaCUoQL5rAZ-dSJG8XKLaqNTMcgGky6Gzez7WXQGPPbegc7KYl1DiQ_stSgahtvlKjGHYyhQx3RVgJQdSJrfliG15n8kicOjGiWviTGwVFSmdElLW2H_ZEonOFhtRdpaU1mfdkxrVdikO-6rmizt41jcLMriWmyIAUhb9FUbWjO0TOy79FFVXjo1lS4c4b7PTxfveYOse8bwm8Bs7Z_uiQsoS5-mkykVdGSGFUpVW7QPmqtFCB4uxNB2KcrKmmZWEfyT4ZCnA3WRt0YCeUHvPK55aErq_kkUxgmNaR3NkoTtjmOWB0Dxl06XTWJenwBwRHRlOSX6HSkUOS5JfF8dyLn6uQ3FitUdMxxVediiSTpXG0hCWlCD-DLw0YLZV5ZKMzodR-YkrTs3LSTAH6O96PJ6SLcs6CFuer6GBXu0O_mrzAzskJSWXF1HY3DkapqApJTNNunsvoveeZlHGHMq0MZRf3Uo8D_MboVC0hrzRb7niYHGI256oXCuI9rgwz5mAP0H6y_8aHDfQ4eNeZj-qXZMSCfBn1qseYiljC6q2OieeoLoUzx-Ar28GQ-1iV46pJEZc-y7KRnXplwUAM63evcdrlY8XcoCA2A5Yb45nVhzPubK2tbP4CzGTgwiXx0VpRbRIehJHcA9yp-TIsHiufjr8yiNS1MJxoiewPvAX4oTocZH92sLvO4LWA==&p=14&fvj=0&vjs=3,Carrière uitzendbureau,recruiter,2022-10-06 15:46:48,auditor,indeed.nl,True
4ec6b84a3024b930,Junior IT Auditor,2022-05-21,Waalre+2 plaatsen,Waalre,5.4456,51.3867,"Gestart of bereid om te starten met een IT-auditor opleiding, je staat aan de start van je carrière;
Je maakt bij ons een vliegende start.",[],https://www.indeed.nl/company/HLB-Witlox-Van-den-Boomen/jobs/Junior-IT-Auditor-4ec6b84a3024b930?fccid=59d84afc5d29b876&vjs=3,HLB Witlox Van den Boomen,employer,2022-10-06 15:45:48,auditor,indeed.nl,True
4ecaadffef2da5c3,GL Accountant,2022-11-05,Amsterdam,Amsterdam,4.8833,52.3667,"Support external audits by preparing documentation for the auditor in the financial year end process.
Nevertheless you will take part in a team that never stops…",[],https://www.indeed.nl/rc/clk?jk=4ecaadffef2da5c3&fccid=4fde3fdc7bfa1d1b&vjs=3,G-Star Raw,employer,2022-10-06 15:45:48,auditor,indeed.nl,True
4f423707d926c2e5,Finance Lead,2022-02-06,Postcode 1017 in Amsterdam Centrum,Amsterdam,4.8833,52.3667,"Good verbal and written (Dutch & English) communication skills, as you will be liaising with various parties such as inter-departments, external consultants and…",[],https://www.indeed.nl/rc/clk?jk=4f423707d926c2e5&fccid=4341c899dd3e56b9&vjs=3,Lepaya,employer,2022-10-06 15:45:48,auditor,indeed.nl,True
4f5d3201284f75f9,Certificatie Coördinator,2022-11-05,Utrecht,Utrecht,5.1222,52.0908,"Onze relatie is dé certificerende instelling op het gebied van kwaliteit, milieu en veiligheid.
Het succesvol laten verlopen van het certificatieproces, zie jij…",[],https://www.indeed.nl/rc/clk?jk=4f5d3201284f75f9&fccid=80156be90517a5bd&vjs=3,ISO-point,recruiter,2022-10-06 15:46:48,auditor,indeed.nl,True
4f5dd834a501269a,Financial Auditor,2022-05-24,Limburg,,,,Realiseren van strategische doelstellingen binnen de gestelde financiële- en beleidskaders (doeltreffend en doelmatig).,[],https://www.indeed.nl/pagead/clk?mo=r&ad=-6NYlbfkN0D6qONDQDgwWnI2D12XzD0gUZ0Zs13xWp799e-Cy_sKYPREJaC7cJxMmYshq1BSCaPMSmr8bjFrK77qcu6UHsCilFpFxKhHu1t4vXvX_pdWFJjNBsLwR1GlpPLGyTRgeps-wk2s4BW3sVqZyTjhqePUHus1V0MoE3W5sRnrriekjwq4yUyAlyVO0NuY-X3VLSO6OIG7_CjsVYC_I9N4yxWWoIt0ReOaf9iO7wni4jVgTRXO5c_3yJWIZSNsiuiBs8rtPcU5reRcAP0ECnScmEnQd9S8ZNT0svZHBFEE1I90HK0PPvDX01VDgIrmno_UsCGTaFRKRfNs33mOo5Lgx7mZbYwEQ-9w2ISFQM36gmweahQ_FIa0gUvY_PfsiLkbyuA5G4QvvjCU6yDS07IfKNPvxp06e8OAClyyI4aLCbymIX_sbc3XGweGZuQN6QTzVdgAadKZN509di6IOA89UldeCVUo62dN0LYT0ACJN3AAbV9bMAWfcV3AgEpnhI70w1TrX36PB2FzLZy5mP6PTrsWTfiK1D1_u4-s9o7hOhclFxEuwiH-Iz7ugc9LqiC5PJ2NXxevvSfhspDuCG7y_Xa7TSJa9RvEbXY6DJUQVgUBanSNLNRtYCJqYY783Z8mO6nl0vy-NQBzB9jSVzOeuO-F&p=2&fvj=0&vjs=3,BlueTrail,recruiter,2022-10-06 15:46:48,auditor,indeed.nl,True
507b84d44e5786f3,Contractmanager,2022-11-05,Zaltbommel,Zaltbommel,5.25,51.8,De contractmanager is verantwoordelijk voor het naleven c.q. beheersen van het contract in de fase vanaf het contracteren van een opdrachtnemer tot het einde…,[],https://www.indeed.nl/rc/clk?jk=507b84d44e5786f3&fccid=56979819241cfa0e&vjs=3,De Comme,employer,2022-10-06 15:45:48,auditor,indeed.nl,True
514f4045321bdca8,Internal Auditor,2022-11-05,Hybride werken in Eindhoven,Eindhoven,5.4778,51.4408,"Jouw functie valt binnen de afdeling Planning & Control.
De afdeling maakt onderdeel uit van de sector financiën.",[],https://www.indeed.nl/rc/clk?jk=514f4045321bdca8&fccid=9f1f9ad8e67560bb&vjs=3,Lunet,employer,2022-10-06 15:45:48,auditor,indeed.nl,True
517ef8f365c66a26,.NET Developer,2022-11-05,Amsterdam+1 plaats,Amsterdam,4.8833,52.3667,"Development of API, Data Streams and Web Dashboard to present patching states to users, auditors and customers.
NET and with all new developments in the .",[],https://www.indeed.nl/rc/clk?jk=517ef8f365c66a26&fccid=ee6a99db163236c2&vjs=3,Atos,employer,2022-10-06 15:45:48,auditor,indeed.nl,True
51bc110675394eef,Sr. IT Compliance Specialist (SOX),2022-11-05,Thuiswerken in Postcode 1077 in Amsterdam Zuid,Amsterdam,4.8833,52.3667,"The IT Compliance Analyst will provide support for initiatives in the IT Audit and Compliance group: subject matter expertise in IT technology and operations,…",[],https://www.indeed.nl/pagead/clk?mo=r&ad=-6NYlbfkN0DGLLS1Jc1k1t2mAx4Q-4jja7Q1ysspUeYmFGX_bcn7TWFz2iciXFboFN_by1Oez3KwL5OxAr-jT6-Kt5aJ_Lw4cOhYO-5VAf-j0__bCW43F3SBNX5B6cNKkpoSJctZCQ-0S3QjIaeccRdJFGYjQTkr0Ba-n2_Lpg6NJ4jEm1g5MfnR06gL3vOg4i_Jd9y0Y4TN8uaaTMqyqilL_KGGd5EDltcLVKlRrcN1OVueD_IkYi0-NfrO6zFyZknG399w0F-oVzuPtTLzO-YOpU-DZcJ9YaYweyqTSVzK9rtYFzXf5DzsuMofmdhRhKnolXvnf2XxPbrX2GkdYgfcAXgAUOeeWjPQ8JUQWHaRDVJ_xFNHsBRwdaitK-pnhFrKHpMwqODLsmoDn4VYJ-mSaFv6kLGCDWQ0HyswzhNcMjYGhaaRaaZ7dDsXFUvsrUeXSi2sACrqO2qpluFNdtmMQc_wIg2U0UF1Ehn6wFaCw8TT5oMK4CqOJUGSrHk1qlV53WpQAxJQcbuzsq5T19q14DdTAtBxP-kyelNPZ8dTxCVy-iayL7qna2lbxi0niOU4emdIn9gDD_A2iyLWqA==&p=12&fvj=0&vjs=3,Charles River Laboratories,employer,2022-10-06 15:45:48,auditor,indeed.nl,True
51d7bb6f16bc3085,Senior Accountant - External Reporting Specialist,2022-02-06,Postcode 2132 in Hoofddorp,Hoofddorp,4.6667,52.3,"You will be collaborating with colleagues from various finance, tax & treasury departments as well as act as contact for external parties such as local…",[],https://www.indeed.nl/rc/clk?jk=51d7bb6f16bc3085&fccid=0ad4c4a48e8d4d46&vjs=3,IDEXX,employer,2022-10-06 15:45:48,auditor,indeed.nl,True
51ec718a9819e354,VAT and Reporting Specialist,2022-11-05,Thuiswerken in Amsterdam,Amsterdam,4.8833,52.3667,"Supporting the audit of the Group and assisting in responding to auditor requests;
Candidates should understand how financial statements are prepared, how the…",[],https://www.indeed.nl/rc/clk?jk=51ec718a9819e354&fccid=6b656c4246c72ed9&vjs=3,EVBox,employer,2022-10-06 15:45:48,auditor,indeed.nl,True
527c537808e23c4d,Quality Assurance Officer,2022-05-18,Postcode 2288 in Rijswijk,Rijswijk,5.0236,51.7975,"The focus will be on implementation of proper quality standards and guidelines and meeting ISO15189, GCLP and GCP requirements.","['3.700', '4.200']",https://www.indeed.nl/rc/clk?jk=527c537808e23c4d&fccid=2ea13239c3ae9bf4&vjs=3,Viroclinics-DDL,employer,2022-10-06 15:45:48,auditor,indeed.nl,True
