job_id,job_title,job_date,job_loc,city_id,job_summary,job_salary,job_education,job_url,company_name,company_type,search_time,search_position,source,search_qualified
3a821168960628ac,Internal Auditor – Innovation and Technology,2022-05-24,Alphen aan den Rijn,18.0,"Interact with technical/infrastructure and application development/architecture teams to assess risks (including security, compliance and resiliency) arising…",[],master,https://www.indeed.nl/rc/clk?jk=3a821168960628ac&fccid=f46e2fd6ab3f5a72&vjs=3,Wolters Kluwer,recruiter,2022-06-23 00:39:30,auditor,indeed.nl,False
3a831c0a2bd12c4a,Strategic Finance Manager,2022-05-24,Postcode 1097 in Amsterdam,2.0,"Work with accounting to provide input on management reporting needs and better understand our actuals.
A combination of the following functional/financial…",[],master,https://www.indeed.nl/rc/clk?jk=3a831c0a2bd12c4a&fccid=f766f8bfbc3effb7&vjs=3,Uber,employer,2022-06-23 00:43:37,accountancy,indeed.nl,True
3a98b661d9195ce6,BOSC Finance Senior Reporting KPI Analyst,2022-06-23,Schiphol,253.0,"Experience using accounting technology applications.
The Accounting and Finance Analyst will deliver financial analysis input into business cases, costs and…",[],master,https://www.indeed.nl/rc/clk?jk=3a98b661d9195ce6&fccid=d7d9a8241ba2f3ec&vjs=3,Cargill,employer,2022-06-23 00:43:37,accountancy,indeed.nl,True
3ab3dfe2a1770b11,.Net Developer – Lease Operations & IT - Banking,2022-05-24,Amsterdam,2.0,What all our customers have in common is that they need to modernize and transform their services and Risk Management operations to keep up with what consumers…,[],master,https://www.indeed.nl/rc/clk?jk=3ab3dfe2a1770b11&fccid=43a69183767d4301&vjs=3,CGI Nederland,employer,2022-06-23 00:43:37,accountancy,indeed.nl,True
3b438702d0aef066,Financial Controller,2022-05-24,Utrecht+1 plaats,3.0,"Bij voorkeur een afgeronde HBO/WO opleiding, met financiële specialisatie.
Goede beheersing van Excel en Exact Online.",[4000],master,https://www.indeed.nl/rc/clk?jk=3b438702d0aef066&fccid=d109ac65bbf0c6fd&vjs=3,Kunneman & Vandenbroek Recruitment Solutions,recruiter,2022-06-23 00:44:40,accountancy,indeed.nl,True
3b734c3476a64f18,International Controlling Officer,2022-05-24,Nieuwkuijk,606.0,"Together with the Finance team you are responsible for the international administration, controlling and accounting and for providing management with insights…",[],master,https://www.indeed.nl/rc/clk?jk=3b734c3476a64f18&fccid=86e4fcc2d553a561&vjs=3,Boost Group,employer,2022-06-23 00:43:37,accountancy,indeed.nl,False
3c148ac90fed5b17,Financieel administratief medewerker,2022-06-21,Thuiswerken in Den Haag,1.0,"Je werkt minimaal drie jaar in een accountants- of administratiekantoor.
Ten behoeve van de jaarrekeningen verricht je de voorbereidende werkzaamheden voor de…","[2500, 3000]",master,https://www.indeed.nl/pagead/clk?mo=r&ad=-6NYlbfkN0Bgwjl9sSaTAhvoInkKYHNrP-tt0Ma8h62cNgPWax2iSnVYSapmWLZslXFr8TcTgPPwuoLV3k_VmAtKR83K2NCPtX7T1F3u193wkK0N5bCG-xQY0ljNcSk20COnO43KYOSsB1ZCsHVE5Tp2H77DyQaN5NOU77mdoLgryT-6XbhEmtemUpyfdRrGtLmQLPijmtGr8FaqdsbYdig2_b4tiq6tooT6K98CBESj0z4ZOvHu2JQXUhd2KQae0plcTHtMpsEuNEkBf8JhctFX_ZUQXCkgvvLi9L5sdac5WR5fqN3scHsvOIf1xSEDwgAvJ2ZlytspPsMFWOL5gpYUeF7nbzFV3jEmfvcA-1w652CeTmhU0zWaX1sMlrEn13ku6Fe0nMSmF3Q_OPRh9CfQTQVePP3bap5Bd4cnALKboHUxZqLt-JgL4EvUWsui8v5-PP7pjCh4flx6sJtVrRd-rj_oO27G6H-a5xrjqdMgEg90oOZhj69kYMfsEGiPIrsUgmFHIGAD1ue2iRmTU_3mMM5N-lJ_UPMikrJytT85qTJw9P2kftKIZTz2L-qQzh3piaPpOWI79JUkX486-SKPaXhKsJATEvK0LlaTcSn4ip-NCOeWsQPS-BMCX9vbpG3mtpjzZxxEr_gcRBlSG2GEmHCWZSl2J5ytFXrDD6Ox6djaVbOOaCzheTN8IqMI6bnu89Dq-NA=&xkcb=SoCb-_M3cG6d07-pip0IbzkdCdPP&p=4&fvj=0&vjs=3,Bollard Accountants v Belastingadviseurs,employer,2022-06-23 00:40:20,accountant,indeed.nl,False
3c9b931522a6bb55,FINANCE CONSULTANT PUBLIEKE SECTOR,2022-05-24,Randstad,,"Het werk van financials (Business Control, Financial Control, Subsidieverwerking, Data Analytics & Reporting) in de publieke sector is voortdurend in beweging.","[2750, 5200]",master,https://www.indeed.nl/rc/clk?jk=3c9b931522a6bb55&fccid=408db7a51345ce26&vjs=3,Bas Consultancy,employer,2022-06-23 00:45:45,RA,indeed.nl,True
3c9e1af6b594a3e5,Internal Control Specialist,2022-06-18,Postcode 2312 in Leiden,804.0,"In your job you will advise the Dutch OpCo’s on risk management, internal control and compliance and facilitate activities in these areas.",[],master,https://www.indeed.nl/rc/clk?jk=3c9e1af6b594a3e5&fccid=9d3fc2c7bbc80ecb&vjs=3,Heineken Nederland,employer,2022-06-23 00:45:45,RA,indeed.nl,False
3ca1d6c76233561f,Out of the box accountant,2022-05-24,Postcode 8472 in Wolvega,928.0,Je beschikt over een afgeronde hbo-opleiding Accountancy en/of Bedrijfseconomie en een afgeronde (post) master accountancy waarmee je staat ingeschreven in het…,[],master,https://www.indeed.nl/rc/clk?jk=3ca1d6c76233561f&fccid=8bf393945e946a6a&vjs=3,Maatman Adviseurs & Accountants,employer,2022-06-23 00:43:37,accountancy,indeed.nl,True
3cec523f4f6e09fd,Global Mobility Compliance Officer,2022-06-17,Thuiswerken in Postcode 1062 in Amsterdam Nieuw-West,2.0,"You lead and coordinate the entire process and work closely with colleagues in the Netherlands and abroad.
As part of the Global Mobility team, you will also be…",[],master,https://www.indeed.nl/rc/clk?jk=3cec523f4f6e09fd&fccid=cf80abde47d3bd81&vjs=3,Mazars,employer,2022-06-23 00:43:37,accountancy,indeed.nl,True
3d2ef40d78a426f6,Senior Business Consultant,2022-05-24,Utrecht,3.0,"Bachelor or Master education in business economics, financial accounting or similar area;
You have the skills required to be the lead consultant on a project…",[],master,https://www.indeed.nl/rc/clk?jk=3d2ef40d78a426f6&fccid=f43cd798aa8848d0&vjs=3,Unit4,employer,2022-06-23 00:43:37,accountancy,indeed.nl,True
3d3ae28786385f2a,Financieel administratief medewerker,2022-05-31,Postcode 1446 in Purmerend,24.0,"Ervaring in een administratieve/accountancy functie, bij voorkeur binnen een groothandel.
Ben je een administratieve duizendpoot die overzichtelijk en secuur…",[],master,https://www.indeed.nl/pagead/clk?mo=r&ad=-6NYlbfkN0BJ5-qWh19IJi0wJ7vEQTrsVBymHFWG2dk-KOmfbb4RMjpZsesjjus8rJYBZOLSJJNF240EeVbI_-CM1AjMMKdneOdJh73QfzOOSRYHxtV-sMlbBkPmpdfSz8-N5aHoNj9xxqiZOiGPZMPsPybsYUdH0rfhQnLMwJh6i2Q31WA0x8S5DT1yiClRJ2uYR0uAb2Wv3zNLGgFXxOLAcbMxqZaKhlfgs7csQoXm4WfT-amvYE7DjYZKXsFxvVh8MIgZ2fsXLXSLrNeU24Hjtn7z4yn3D677WMZwImy_Vbv-iNjPtEnh76L_ZPNEIa1VqT6zqbBL8XzaF0VCnQs6djw6S-Elh5WLHv06Z4R4kEOkuHNCr8P02W5Ldkh1eGJTCei76Z7XQLRnQMV38-JSUBmrHOAtelL8AYEEve6VJgu83KpG5fm4fYRb27QWjpaIN3txlKl3jkPWJYs5YOYEiaSxQjc887EmNEXlsRxINmJy6oGZaUrpxam2ocfl_630rn4d9mgkAUxw0GcDNIs9EePJgDHHGDm1CJ9H5XiV6yVYdsj9oPtsSst6g7RL2-4TP-OQ5GRc8ze0OPjKJSx78Bq81IOlw6-QCXPi-NNmlQoxMkbnB_7VVD0HyLfHTBrXLE9bqLz6Th_jNJcB3KDBzIDMYRKu3VjR5HK-sy6RiBK5eHeOdiysFj6JKjpZFedGRy3DumWaE8k88VXZtDUAXTDzdKCIHrdDZJ9XoGw4pFzRb7mWZGbOgVaewk1Po6BrH6MQH-a-ENbX3uhczA==&xkcb=SoCU-_M3cG6j7ix9Bh0LbzkdCdPP&p=11&fvj=0&vjs=3,Verdi Koffiegroep,employer,2022-06-23 00:43:37,accountancy,indeed.nl,False
3d4c677f6db3f612,Accounting Controller,2022-05-24,Postcode 5657 in Eindhoven,5.0,"You interact with key stakeholders in the respective entities, business units and division(s), Koch global and regional finance organizations, GPO (global…",[],master,https://www.indeed.nl/rc/clk?jk=3d4c677f6db3f612&fccid=de113fe345574782&vjs=3,Molex,employer,2022-06-23 00:39:13,auditor,indeed.nl,True
3d581b7dd26ccea6,Assistent Controle,2022-05-24,Venlo,76.0,"Voor onze opdrachtgever in Venlo zijn wij op zoek naar een assistent controle.
Een afwisselende functie met mogelijkheden om door te groeien.",[],master,https://www.indeed.nl/rc/clk?jk=3d581b7dd26ccea6&fccid=8aab23f9e1a9a865&vjs=3,Xelect,recruiter,2022-06-23 00:46:12,RA,indeed.nl,True
3d988a4b1556b9ff,Senior Consultant Finance Risk,2022-05-24,Amsterdam,2.0,You will help our clients by implementing an ecosystem that is robust and flexible enough to adapt to regulations or accounting standards and to economically…,[],master,https://www.indeed.nl/rc/clk?jk=3d988a4b1556b9ff&fccid=837edc3ec6c2367e&vjs=3,Synechron,employer,2022-06-23 00:43:37,accountancy,indeed.nl,True
3e488c39e4f3c21c,Senior Consultant FinancialForce - Enterprise Resource Planning,2022-05-24,Nederland,,"Experience with mid-market or enterprise accounting systems and financial management implementations.
The (Senior) Solution Consultant should be someone with…",[],master,https://www.indeed.nl/rc/clk?jk=3e488c39e4f3c21c&fccid=0d41a6a66621dcd6&vjs=3,Fluido,employer,2022-06-23 00:43:37,accountancy,indeed.nl,True
3e545a24fd301f8b,Cost Control Specialist,2022-05-24,Den Bosch,14.0,Supermicro Computer Inc. is seeking an experience Cost Control Analyst to provide accurate pricing for new and existing products by working closely with…,[],master,https://www.indeed.nl/rc/clk?jk=3e545a24fd301f8b&fccid=5fa113e7b40ec663&vjs=3,"Super Micro Computer, Inc.",employer,2022-06-23 00:43:37,accountancy,indeed.nl,True
3e6cd17cace76877,Junior Account Manager,2022-06-01,Postcode 6222 in Maastricht,16.0,"Je hebt bij voorkeur een HBO of universitaire studie met als specialisatie (ondernemings) recht, fiscaal recht of bedrijfseconomie / accountancy succesvol…",[],master,https://www.indeed.nl/company/Maprima-Management-B.V./jobs/Junior-Account-Manager-3e6cd17cace76877?fccid=fa37c97df17c1fa0&vjs=3,Maprima Management B.V.,employer,2022-06-23 00:43:37,accountancy,indeed.nl,False
3e7203273bae0708,"Research Associate, Protein X-Ray Crystallography",2022-06-09,Postcode 5612 in Eindhoven,5.0,"Bachelor or Master’s degree in Chemical Biology, (Bio)Chemistry, Biology, Medical Science, Life Sciences or related field.
32 to 40 hour working week.",[],master,https://www.indeed.nl/rc/clk?jk=3e7203273bae0708&fccid=4dace1fe3670c6ea&vjs=3,Ambagon Therapeutics,employer,2022-06-23 00:45:45,RA,indeed.nl,False
3e7e08dd302883c9,Manager Cybersecurity - Technology Risk,2022-05-24,Postcode 1083 in Amsterdam Zuid,2.0,"Je bent geregistreerd als Register EDP-auditor (RE) bij NOREA.
Als Manager Cybersecurity Technology Risk maak je onderdeel uit van een meer technisch team…",[],master,https://www.indeed.nl/rc/clk?jk=3e7e08dd302883c9&fccid=1544766d4c2915b0&vjs=3,EY,employer,2022-06-23 00:39:13,auditor,indeed.nl,True
3eb59ea158948e5a,Senior Associate | Audit & Assurance | Amstelveen/Amersfoort,2022-06-01,Postcode 3812 in Amersfoort,799.0,"Je hebt je bachelor of master Accountancy behaalt (HBO of WO), of rond deze op korte termijn af.
Je bent bereid een RA opleiding te volgen en af te ronden.","[3500, 5000]",master,https://www.indeed.nl/company/Auren-Nederland/jobs/Senior-Associate-Audit-Assurance-Amstelveen-3eb59ea158948e5a?fccid=779d66d75455e090&vjs=3,Auren Accounting Products B.V.,employer,2022-06-23 00:45:45,RA,indeed.nl,True
3ee212016daafd02,GL Accountant- Coffee Company- Arnhem,2022-05-24,Hybride werken in Gelderland,,"Manage daily closing and reporting activities and ensure books are maintained according with Dutch GAAP.
Prepare and/or review variance analysis on the balance…",[4400],master,https://www.indeed.nl/rc/clk?jk=3ee212016daafd02&fccid=4d587a8973f8db5e&vjs=3,Five Finance Recruitment,recruiter,2022-06-23 00:40:55,accountant,indeed.nl,True
3f01404c8c5379a3,Financial controller,2022-05-24,Nieuw-Vennep,,"You have direct contact with the internal customer or with external auditors to provide accurate information.
Handling / preparing the payroll tax, VAT and VPB.",[],master,https://www.indeed.nl/rc/clk?jk=3f01404c8c5379a3&fccid=45760e614a6eb614&vjs=3,Frendz Finance,recruiter,2022-06-23 00:39:30,auditor,indeed.nl,False
3f03a39d3a0348b2,Venture Analyst,2022-05-24,Postcode 3013 in Rotterdam,4.0,"You have 3+ years of working experience in at least two of the following: venture capital, accounting or research; in tech companies or startups;",[],master,https://www.indeed.nl/rc/clk?jk=3f03a39d3a0348b2&fccid=d732b4228d2d2aa0&vjs=3,Builders,employer,2022-06-23 00:43:37,accountancy,indeed.nl,True
3f3191a4e6518d90,Group IT Auditor,2022-05-24,Amsterdam,2.0,"Great opportunity for candidates with 2-5 yrs of IT Audit.
Good salary + bonus 10% + car.
A bachelor’s/Master's degree in technology, computer science or a…",[],master,https://www.indeed.nl/rc/clk?jk=3f3191a4e6518d90&fccid=831b1667b781d443&vjs=3,Tewes,recruiter,2022-06-23 00:39:30,auditor,indeed.nl,True
3f9599cea336b50b,Project Quality Manager,2022-05-24,Schiedam,790.0,"You are responsible for ensuring compliance with all standards, rules and other requirements imposed by Company, Regulators, Clients and other relevant…",[],master,https://www.indeed.nl/rc/clk?jk=3f9599cea336b50b&fccid=a9a5024d4b747148&vjs=3,SBM Offshore,employer,2022-06-23 00:39:13,auditor,indeed.nl,True
3fdaa1f33e8e4ba4,Gevorderd Assistent Accountant Audit,2022-06-23,Postcode 3931 in Woudenberg,219.0,"Je hebt de basis van de controlewerkzaamheden onder de knie en bent nu toe aan meer uitdaging.
Ook heb je contact met klanten voor het opvragen van informatie…",[],master,https://www.indeed.nl/company/Vallei-Accountants-Audit/jobs/Gevorderd-Assistent-Accountant-Audit-3fdaa1f33e8e4ba4?fccid=68efaf26ae1b2cf5&vjs=3,Vallei Accountants Audit,employer,2022-06-23 00:40:20,accountant,indeed.nl,True
3fe8db7be9353830,Principal Sales Consultant,2022-05-24,Nederland+1 plaats,,"Applicants are required to read, write, and speak the following languages: English, Spanish, Dutch, French, German.
Good command on SQL/PL SQL programming.",[],master,https://www.indeed.nl/rc/clk?jk=3fe8db7be9353830&fccid=a69a14d85af6a1a2&vjs=3,OFSS,employer,2022-06-23 00:43:37,accountancy,indeed.nl,True
402e0f2fe449291e,Financial Accountant,2022-05-24,Thuiswerken in Postcode 1101 in Amsterdam-Zuidoost,2.0,"Analyze accounting alternatives to suggest financial actions.
Coordinate activities and answers questions to guide accounting clerical staff.",[],master,https://www.indeed.nl/rc/clk?jk=402e0f2fe449291e&fccid=c543e118cd5ad005&vjs=3,SecuredNow,employer,2022-06-23 00:43:37,accountancy,indeed.nl,True
405f7a0997246804,Ervaren accountant,2022-05-24,Uden,65.0,"Als accountant bij OOvB heb je een zeer afwisselende functie.
Als accountant ken jij het financiële plaatje van onze MKB-ondernemers en denk je met hen mee…",[],master,https://www.indeed.nl/rc/clk?jk=405f7a0997246804&fccid=e6d84177643dc052&vjs=3,OOvB adviseurs en accountants,employer,2022-06-23 00:40:20,accountant,indeed.nl,True
40641e2566ab03b7,Design Verification Engineer,2022-06-17,Eindhoven,5.0,"Test program for our medical neurostimulation system, consisting of implantable and wearable devices.
Objectively demonstrating safety and performance is the…",[],master,https://www.indeed.nl/rc/clk?jk=40641e2566ab03b7&fccid=8462a95255fb3abf&vjs=3,Salvia BioElectronics,employer,2022-06-23 00:45:45,RA,indeed.nl,False
406be32d9a425c16,(junior) Business controller (24-32h),2022-06-15,Postcode 3861 in Nijkerk,836.0,"As a (junior) business controller, your primary responsibility is to monitor and control calculations, processing and checking data in our ERP system.",[],master,https://www.indeed.nl/rc/clk?cmp=vacature%40alcochem.com&ti=&jk=406be32d9a425c16&fccid=f5e925f1f178f065&vjs=3,Alcochem B.V.,employer,2022-06-23 00:43:37,accountancy,indeed.nl,False
40c9eaf3711514cd,Senior Financial Controller,2022-05-24,Amsterdam,2.0,"Als Senior Financial controller sta je in het hart van de organisatie.
Je schakelt met directie, managers, teamleiders en je financiële collega’s.",[],master,https://www.indeed.nl/rc/clk?jk=40c9eaf3711514cd&fccid=1e147d04043660f9&vjs=3,TriFinance,recruiter,2022-06-23 00:44:40,accountancy,indeed.nl,True
40ee9bef14f86517,Senior Consultant Enterprise Risk,2022-06-18,Postcode 1083 in Amsterdam Zuid,2.0,"You can expect to work with high level client personnel and drive high quality work products.
We are looking for a team player with excellent professional…",[],master,https://www.indeed.nl/rc/clk?jk=40ee9bef14f86517&fccid=1544766d4c2915b0&vjs=3,EY,employer,2022-06-23 00:44:59,CPA,indeed.nl,True
4195f2b882ea1181,Financial Controller,2022-05-24,Amsterdam,2.0,"5-6 years experience as a financial controller or as an auditor.
As Financial Controller you will be responsible for one or more legal entities/countries.",[],master,https://www.indeed.nl/rc/clk?jk=4195f2b882ea1181&fccid=af136c4992d9560c&vjs=3,Impactsearch,recruiter,2022-06-23 00:39:30,auditor,indeed.nl,True
41b6111cc40929cc,Senior Business Controller (Lead),2022-06-23,Rotterdam,4.0,"Business partnering; met als belangrijkste stakeholder de Operationeel Directeur;
Je bent de spin in het web tussen Finance en de Business (locaties);",[],master,https://www.indeed.nl/company/Bluefin-B.V./jobs/Senior-Business-Controller-41b6111cc40929cc?fccid=f46183755c9bde46&vjs=3,Bluefin B.V.,recruiter,2022-06-23 00:44:40,accountancy,indeed.nl,True
4204a473e89d6342,Financieel Administratief Medewerker (32 - 40 uur),2022-05-24,Gouda,29.0,Jij bent een gedreven collega die binnen de afdeling Finance zelfstandig de volledige inkoop- verkoop en bankboekingen verricht van de diverse BV’s die bij de…,"[2500, 3300]",master,https://www.indeed.nl/rc/clk?jk=4204a473e89d6342&fccid=7cdc822d524ce803&vjs=3,Sagius Werving & Selectie,recruiter,2022-06-23 00:40:55,accountant,indeed.nl,False
4298088db2c67a60,Senior Consultant Forensic Investigations,2022-05-24,Amstelveen,803.0,"Master in (bedrijfs)economie, bedrijfskunde of accountancy;
Het uitvoeren van diverse (complexe) forensische feitenonderzoeken;",[],master,https://www.indeed.nl/rc/clk?jk=4298088db2c67a60&fccid=2dd390c3a48a7ed0&vjs=3,KPMG,employer,2022-06-23 00:43:37,accountancy,indeed.nl,True
43173277ab3d7304,"Analyst, Portfolio Management",2022-05-24,Den Haag,1.0,"Complete various financial, accounting, narrative, administrative and other reports and analysis and duties as assigned or necessary for the successful…",[],master,https://www.indeed.nl/rc/clk?jk=43173277ab3d7304&fccid=2acd6fee0f6b700e&vjs=3,Greystar Real Estate Partners LLC,employer,2022-06-23 00:43:37,accountancy,indeed.nl,True
431fb6638bbe138a,Project Controller,2022-05-24,Rotterdam,4.0,"Opstellen en bijhouden van KPI’s per project.
Je hebt een Bachelor of Master in Finance, Accountancy of Economie.
Je hebt goede Excel kennis.","[70000, 75000]",master,https://www.indeed.nl/rc/clk?jk=431fb6638bbe138a&fccid=dc2a9f8c2c1b9b91&vjs=3,ScopeFinance,recruiter,2022-06-23 00:44:40,accountancy,indeed.nl,True
434f15e49e1f2172,Financial / Business Controller,2022-05-24,Hybride werken in Eindhoven,5.0,"Afgeronde bachelor of master opleiding, bij voorkeur in de richting van accountancy, bedrijfseconomie, bedrijfskunde of finance;
Uitvoeren van ad-hoc analyses;",[],master,https://www.indeed.nl/rc/clk?jk=434f15e49e1f2172&fccid=64b619e6dd19534c&vjs=3,TMC,employer,2022-06-23 00:43:37,accountancy,indeed.nl,True
436a81641e07129e,Associate-Audit Only,2022-05-24,Utrecht,3.0,"Ultimately you have 1 to 3 years relevant, preferably international, experience in auditing.",[],master,https://www.indeed.nl/rc/clk?jk=436a81641e07129e&fccid=c9fb654be213bbad&vjs=3,Capabla,recruiter,2022-06-23 00:46:12,RA,indeed.nl,False
43dfb2a74c006208,Senior Assistent Accountant Audit Interim,2022-06-17,Barneveld+2 plaatsen,39.0,Voor een accountantskantoor uit Ede zijn wij op zoek naar interim versterking op het niveau van senior assistent accountant audit.,[],master,https://www.indeed.nl/pagead/clk?mo=r&ad=-6NYlbfkN0B9ncCjVygRjlOeaYfNmTIisbUp_hi4QzA_-fBu-i6bXBVkEcX5-TNMfxX1ArRoHtlzxAN_8uTuQCF61_1yojFQDOXCf63xgZiGksZw1jXQx-wXVxnvVQjfAN2GH81-Mz253AJ771Um1KwXBaHG86KDHb9_yMqBAqhOgZ8Y-K7ybX4phf_fobsM1daryfJtd-VM7LVffVfxRh6jNpUGcn6kZaRma8CvKk8u5c_jzUvg82yRLQw3jw7ZVRyL5Qxa4qbd7heW_IdifL7SGgwnNfHL9lpuL5uU5c99Qqusf7Evg633ayA3HII7jCThm4wvVLg9zF9Zw9LoiB1GVvgAonG68sn2OQVaJZANiJvYmSu1FxYHcvjk6_P1Tgthoi74T8w6OZb1rj1UA_J_tkhQlxFmgeruIPntfkZdR3AgvY1qPAnaUvRO7CMi9XBYb5H6QZ_XHWvhz-o60N4w6kKZhxb7yLr4ImstPg7s0kJGbtif5Jcwul3cXfdY7N2KGIy0jfR4vPX96xZwiuPm65Ii4kKYQePb8VVdnH1OKZl7YtSEbfwWO90mo0VFnn9swQo8yVdTTP48wAHRqGbRXCUM8jtd8Ur2ubcmBijludmTnk_APDXqIh63IOrb5Gy2J4PA7VU0efKywsa9h3EXF5-4uxlBj2G1kEAUtwnAIfg88jNHfR0XQbpaLACI5OIedNfpBXjsIO4DUWAtBxI5c_w7HwfXYVk9ODzZoeQVi7RGFciEZ4lyofowd8cOC742lRW2jTY=&xkcb=SoDT-_M3cG65-kx9Bh0LbzkdCdPP&p=14&fvj=0&vjs=3,Headhuntersteam,recruiter,2022-06-23 00:44:40,accountancy,indeed.nl,True
43edeb0e31b527dc,(Junior) medewerker Tax Compliance,2022-06-21,Arnhem,12.0,Wie: Je zit in een afrondende fase van de hbo-opleiding fiscaal recht en economie of hebt deze net afgerond en gaat nog doorstuderen voor een w master master…,[],master,https://www.indeed.nl/rc/clk?jk=43edeb0e31b527dc&fccid=7ac82fceed64aa81&vjs=3,Grant Thornton,employer,2022-06-23 00:43:37,accountancy,indeed.nl,False
43f00046ea280903,Business Analyst,2022-06-03,Thuiswerken in Postcode 3013 in Rotterdam,4.0,"Analysts reviews the transactional invoice data, existing cost streams tied to this data and compare with cost streams coming in from the financial accounting…",[],master,https://www.indeed.nl/rc/clk?jk=43f00046ea280903&fccid=5938580c9c7de4d3&vjs=3,LyondellBasell Industries,employer,2022-06-23 00:43:37,accountancy,indeed.nl,False
4405d416d86c9c06,CFO,2022-05-24,Amsterdam,2.0,Provides analytical decision support and performance tracking across a range of strategic and operational excellence initiatives;,[],master,https://www.indeed.nl/rc/clk?jk=4405d416d86c9c06&fccid=7f127ae86a5f5452&vjs=3,Bridgewell,recruiter,2022-06-23 00:44:40,accountancy,indeed.nl,True
447ac8b4472a4068,Information Security Compliance Manager,2022-05-24,Postcode 3013 in Rotterdam,4.0,"Participate in internal and external audits and guide/translate between auditor and personnel.
In the role of Information Security Compliance Manager, you will…",[],master,https://www.indeed.nl/rc/clk?jk=447ac8b4472a4068&fccid=2e9bbb37fdefc225&vjs=3,Signicat,employer,2022-06-23 00:39:13,auditor,indeed.nl,False
44905a20e2704bf6,BUSINESS INTELLIGENCE CONSULTANT,2022-05-24,Randstad,,"Als BI-consultant help jij onze opdrachtgevers met het oplossen van vraagstukken op het gebied van BI en data-analyse.
Afgeronde hbo+ of wo-opleiding.","[3400, 4500]",master,https://www.indeed.nl/rc/clk?jk=44905a20e2704bf6&fccid=408db7a51345ce26&vjs=3,Bas Consultancy,employer,2022-06-23 00:45:45,RA,indeed.nl,True
44fb68c87daa726f,CFO,2022-05-24,Randstad,,"Aansturen van en hands-on betrokken bij accounting.
Vertegenwoordigen van de organisatie bij investeerders, bank en stakeholders.",[],master,https://www.indeed.nl/rc/clk?jk=44fb68c87daa726f&fccid=7f127ae86a5f5452&vjs=3,Bridgewell,recruiter,2022-06-23 00:44:40,accountancy,indeed.nl,True
450aef6418cb28e7,Global Process Manager,2022-06-22,Amsterdam,2.0,The Global Process Manager O2C will be responsible for driving the Towers enterprise strategy by assisting the O2C Global Process Owner to ensure that assigned…,[],master,https://www.indeed.nl/rc/clk?jk=450aef6418cb28e7&fccid=35d653c09c2712b6&vjs=3,NBCUniversal,employer,2022-06-23 00:44:59,CPA,indeed.nl,True
45369ccabea55170,Data Scientist,2022-06-02,Postcode 1083 in Amsterdam Zuid,2.0,"Met behulp van onze expertise, systemen en financiële diensten dragen wij bij aan een betere werkomgeving.
Onze consultants adviseren onder ander op het gebied…",[],master,https://www.indeed.nl/rc/clk?jk=45369ccabea55170&fccid=1544766d4c2915b0&vjs=3,EY,employer,2022-06-23 00:43:37,accountancy,indeed.nl,True
45378877c96ea318,Financial Reporting Officer,2022-06-22,Den Haag,1.0,Audit process - Work closely with the groups’ external auditor performing audit procedures on consolidated financial information and facilitate their processes…,[],master,https://www.indeed.nl/rc/clk?jk=45378877c96ea318&fccid=817dbf75ac000d11&vjs=3,Aegon,employer,2022-06-23 00:39:13,auditor,indeed.nl,True
454026cdde06c2a3,Backend Engineer,2022-06-16,Postcode 1101 in Amsterdam-Zuidoost+1 plaats,2.0,"Our mission Building Europe’s most valuable open data money platform. Our Yolt Platform YOLT Group BV is the leading open banking provider in Europe, building…",[],master,https://www.indeed.nl/rc/clk?jk=454026cdde06c2a3&fccid=3f56872a8b26fee4&vjs=3,YOLT,employer,2022-06-23 00:43:37,accountancy,indeed.nl,True
4635613e7ec54abe,Product Lifecycle and Implementation Project Manager,2022-05-25,Breda,8.0,Our client is an ambitious player within the biotechnology industry and has been revolutionary in their approach of combatting life interrupting illnesses since…,[5500],master,https://www.indeed.nl/rc/clk?jk=4635613e7ec54abe&fccid=26a0583287ba1940&vjs=3,Kelly Services,recruiter,2022-06-23 00:46:12,RA,indeed.nl,True
469347c0d16cf30b,Industrial Cost Auditor,2022-06-14,Noordwijk,63.0,This is a non-renewable post for a limited duration of 4 years and is classified A2-A4 on the Coordinated Organisations’ salary scale.,[],master,https://www.indeed.nl/rc/clk?jk=469347c0d16cf30b&fccid=16c630b5b4ff1f50&vjs=3,European Space Agency (ESA),employer,2022-06-23 00:39:13,auditor,indeed.nl,True
46c4fc094e994a22,Traineeship - Finance October 2022,2022-06-22,Tijdelijk thuiswerken in Amsterdam,2.0,"Has experience within the Finance domain (i.e. accountancy, audit or tax) either through internship or work experience;
NS business card or travel allowance;",[],master,https://www.indeed.nl/rc/clk?jk=46c4fc094e994a22&fccid=5b16841c3468a10d&vjs=3,ING,employer,2022-06-23 00:43:37,accountancy,indeed.nl,False
46c510c1a257962d,Senior Assistent Accountant,2022-05-24,Amsterdam Zuid,2.0,"Je hebt je bachelor afgerond of zit in de laatste fase van je bachelor of master accountancy.
Tijdens je werkzaamheden hier is er veel ruimte voor…","[34000, 50000]",master,https://www.indeed.nl/rc/clk?jk=46c510c1a257962d&fccid=3f646f570bd24702&vjs=3,Brown & McCrow,recruiter,2022-06-23 00:44:40,accountancy,indeed.nl,True
