job_id,job_title,job_date,job_loc,job_city,job_lng,job_lat,job_summary,salary,job_url,company_name,company_type,search_time,search_position,source,search_qualified
c3f5fb69081365e6,Internal Auditor Automotive,2022-05-31,Den Bosch,,,,"Het bedrijf is groeiende zowel in Nederland als in ander Europese landen, wat het een uitdagende functie maakt.
Dan kom ik graag met jou in contact.",,https://www.indeed.nl/rc/clk?jk=c3f5fb69081365e6&fccid=5b5d5a4463a5ac7c&vjs=3,Independent Recruiters,recruiter,2022-10-06 01:02:30,auditor,indeed.nl,True
c4b37e5b13e19bb4,Senior Quality Auditor - CDD/KYC (Dutch),2022-11-05,Amsterdam,Amsterdam,4.8833,52.3667,"Reporting to our Quality Team Lead, you will spend time examining low/medium and high risk assessments, determining the root causes of any points of failure and…",,https://www.indeed.nl/rc/clk?jk=c4b37e5b13e19bb4&fccid=c923e739678abf07&vjs=3,Mollie,employer,2022-10-06 01:01:30,auditor,indeed.nl,True
c4bb74ed6141155b,Lead Quality Control (Materials) - Resource Center Schiedam,2022-11-05,Schiedam,Schiedam,4.3889,51.9192,The QC Lead (QCL) would be primary responsible to critically assess the current processes and procedures to define the gaps in the status-quo.,,https://www.indeed.nl/rc/clk?jk=c4bb74ed6141155b&fccid=a9a5024d4b747148&vjs=3,SBM Offshore,employer,2022-10-06 01:01:30,auditor,indeed.nl,True
c56589bcc9fe4827,Night Auditor,2022-11-05,Utrecht,Utrecht,5.1222,52.0908,"Confident communicator comfortable in a fast-paced service focused role.
Running the night audit and balancing the days accounts.",,https://www.indeed.nl/pagead/clk?mo=r&ad=-6NYlbfkN0Dm9f9_H_6B78vZJe_e3e_BvMa-x4z1y2V7QSCwSUhpnz9CmkMbTLa1IBibZ-VySy8K6919u0SosYp1uSfZEe2xydeBAMwOqzLnYmuYd8kzLndaPfpMOHbFn8MKgXGHvx-JpC5PemHq3JB8boZABlCAUE98BxdIk0oMrcFJR-yjmfpMwak4uCtfz21jHEqDq88Jg2miZ1pQdL3T0yxRM0FW3Ukm5sALUvoQ5uCkW00lEi1GJ29RvbsEzoaCmkhuT0gIRshZWJVBnlG1E1oN3_6wJLtMjI-X9Oc6BDqyIdrAlnOs_Vk2dLFfVO0GDQ_-HHxLNEKBlGBIq4c8hzV_W10m56Xb62sgfd1YaM1VDSQXi1qq2ynB8SXLW5gw0xFdKmH2SpcYycQm3zZnf01o9lxAQQ9Ds28NLX9zz7VpGhzLQ1CncfwFkW8l2hSV8tMYNvwfbJ0xQyLeA5LiOg2kGz1Tpo8UQ4fFmUpA5VGRf0HyI_LgTGPEFG_Bo8hJiIhCe55w4HJ5saOkaWyL35YdWs6wWcWnmO8y2M5qLc6XHYzjLENnCIacoBvtcLo86-BRQljRLt-scJsSrhiOgZNVHUOMuEoRIYIpZeBhz0fWDQNXyzseYERBY0b1Nc079l1hxBY=&p=1&fvj=0&vjs=3,MOXY Utrecht,employer,2022-10-06 01:01:30,auditor,indeed.nl,True
c5d06666c2d2cb4e,Administratief Medewerker Certificatie,2022-05-14,Culemborg,Culemborg,5.2333,51.95,"SGS INTRON biedt duurzame praktische oplossingen bij alle bouw gerelateerde vragen.
Met ruim vijftig jaar ervaring op het gebied van materiaalkundig onderzoek,…",,https://www.indeed.nl/pagead/clk?mo=r&ad=-6NYlbfkN0APe9drEwi-Kbywdygab2dl8_doSw5EZ11Olc7PrDx106wLX4lixki6J_uwC8-JU9AJie-dHyF1el6SfgXGGu58jFjAll-U8Dl9CFGlaa0TvC5eTe_YVNYRJDoyryQajfrk0jQr30Iqq5orYqT0xP1z0la4VZJAaUU4YZzlC_OvUkE0sGUjV8fzbhleWYeEXR2UUvj3c7RSoYWZ-lsp613TtTF3lfLT6aw87oo_IjAO1pxch1BFLCEz5K3rUw_BwgIYgSJZkZXWxxDnzR2HaDD3okB-hv78W1UOpcp49fApyvqynRfKTSwZMCWxgC2Duyxavp8KKtxjywd6SbplTwpzDfhJTAbAh-4ajcTB0LdDWtj20i8Ba3kGqhjwx7wQHlxXdhGh18Oh7vNfDtOmybrQ9Coi1TbasBH3jHdJXnDp7JWHcY-dDOOY_AdnSB_gywdEnN2tk8jUxB8iNwrfZCVheP4DNlFzaHY=&p=0&fvj=0&vjs=3,SGS INTRON,employer,2022-10-06 01:01:30,auditor,indeed.nl,True
c67898e3d9c2cb2f,Internal auditor (32-36 uur per week),2022-05-26,"Postcode 3151 in Hoek van Holland, ZH",Hoek van Holland,4.1323,51.9763,"Voor de afdeling Audit en Risk in Hoek van Holland zoeken wij een internal auditor.
De Internal auditor geeft interne en externe stakeholders extra zekerheid en…","['4.717', '6.790']",https://www.indeed.nl/rc/clk?jk=c67898e3d9c2cb2f&fccid=3aacffae2bd15d00&vjs=3,Nederlands Loodswezen BV,employer,2022-10-06 01:01:30,auditor,indeed.nl,True
c6a63da71fe8cfdf,+ (ERVAREN) ASSISTENT ACCOUNTANT (M/V),2022-11-05,Hilversum,Hilversum,5.18,52.23,"Wij zoeken iemand met zelfstandigheid, nauwkeurigheid, goede communicatieve vaardigheden en (als pre) ervaring met Unit4 Audition, Unit4 Auditor en Reeleezee…",,https://www.indeed.nl/rc/clk?jk=c6a63da71fe8cfdf&fccid=533c3df7b2ea6e88&vjs=3,Koeleman,employer,2022-10-06 01:01:30,auditor,indeed.nl,True
c72ba1536554c582,Internal auditor,2022-11-05,Postcode 1213 in Hilversum,Hilversum,5.18,52.23,"Je hebt voldoende ervaring om als zelfstandig auditor je rol in projecten te spelen.
Je hebt een academische- of hbo-opleiding afgerond, bij voorkeur op gebied…",,https://www.indeed.nl/rc/clk?jk=c72ba1536554c582&fccid=b8ec1fe5beafce64&vjs=3,EBBEN Partners,employer,2022-10-06 01:01:30,auditor,indeed.nl,True
c7ac3e4fb547a0e0,Audit Manager Compliance,2022-08-06,Amsterdam,Amsterdam,4.8833,52.3667,"The Compliance Audit Specialist, together with a team of auditors and compliance specialists, plays an important role in providing assurance within this area…",,https://www.indeed.nl/rc/clk?jk=c7ac3e4fb547a0e0&fccid=f9e878a529d07726&vjs=3,Oliver James Associates,recruiter,2022-10-06 01:02:30,auditor,indeed.nl,True
c7c0fd6fafd53f40,HSE specialist,2022-11-05,Leeuwarden+1 plaats,Leeuwarden,5.7833,53.2,"Realisatie van ondernemingsdoelstellingen en naleving van wet- en regelgeving;
Signaleren van ontwikkelingen, hiaten, doen van voorstellen en uitvoering geven…",,https://www.indeed.nl/rc/clk?jk=c7c0fd6fafd53f40&fccid=388f8a475db8a3ca&vjs=3,Ausnutria B.V.,employer,2022-10-06 01:01:30,auditor,indeed.nl,True
c7f8875cf12291da,RAQA Manager,2022-11-05,Eerbeek,,,,"Internal and Lead auditor certification.
RA/QA Manager oversees all activities reacted to regulatory affairs and quality assurance for the Procornea site to…",,https://www.indeed.nl/rc/clk?jk=c7f8875cf12291da&fccid=1a7983518cdfa50d&vjs=3,CooperVision,employer,2022-10-06 01:01:30,auditor,indeed.nl,False
c84a396bcb4c9239,Planner,2022-02-06,Thuiswerken in Postcode 4462 in Goes+1 plaats,Goes,3.8833,51.5,"Beheren van de agenda’s van de auditoren;
Als planner ben jij het eerste aanspreekpunt, beheer jij de agenda’s van onze inspecteurs / auditors en ben je…",,https://www.indeed.nl/rc/clk?jk=c84a396bcb4c9239&fccid=39807a905ef077f7&vjs=3,Kiwa,employer,2022-10-06 01:01:30,auditor,indeed.nl,True
c879d26eb3b79291,Security Auditor | Schipholrijk,2022-11-05,Noord-Holland,,,,"Het is een kleine organisatie met full-time professionale auditoren, die samen bijdragen aan het success van de klant.
Salaris tot 60K per jaar;",['60.000'],https://www.indeed.nl/rc/clk?jk=c879d26eb3b79291&fccid=dec865029797a382&vjs=3,Layer,employer,2022-10-06 01:01:30,auditor,indeed.nl,True
c8a29173cfc0a7e2,Senior Technical Accountant,2022-10-06,Bergen op Zoom,Bergen op Zoom,4.3,51.5,"Assisting in preparing audit paperwork and interface with external auditors;
Do you have at least 5 years of relevant experience in accounting and do you have a…","['75.000', '90.000']",https://www.indeed.nl/company/Kasparov-Finance-&-BI/jobs/Senior-Technical-Accountant-c8a29173cfc0a7e2?fccid=9c489f0b36800c56&vjs=3,Kasparov Finance & BI,recruiter,2022-10-06 01:02:30,auditor,indeed.nl,True
c8b857952458a77e,Testconsultant,2022-11-05,Postcode 8011 in Zwolle,Zwolle,6.0944,52.5125,"Het programma RijksZaak (DICTU) is op zoek naar een Test consultant om het projectteam te versterken.
Aantoonbare relevante PEGA test-ervaring.",,https://www.indeed.nl/rc/clk?jk=c8b857952458a77e&fccid=29ab7f61305e33aa&vjs=3,sQout,recruiter,2022-10-06 01:02:30,auditor,indeed.nl,True
c8e19bda64b47b1f,Specialist Horizontaal Toezicht,2022-08-06,Hybride werken in Postcode 6881 in Velp,Velp,5.9758,51.9947,"Die kosten besparen en waardoor processen efficiënter worden.
In deze functie bij Zilveren Kruis ga je mooie dingen doen.",,https://www.indeed.nl/rc/clk?jk=c8e19bda64b47b1f&fccid=a8a68a6af6128187&vjs=3,Gezond Know How,employer,2022-10-06 01:01:30,auditor,indeed.nl,True
c90e76a267a2ba89,Quality Assurance Analyst (1 year contract),2022-05-25,Hilversum,Hilversum,5.18,52.23,"Support the processes related to the internal controls with the compliance team, corporate Audit and external auditors.
Experience in SAP is preferred.",,https://www.indeed.nl/rc/clk?jk=c90e76a267a2ba89&fccid=2c62e4de04b8f952&vjs=3,Nike,employer,2022-10-06 01:01:30,auditor,indeed.nl,True
c90e91bac8a45fb1,VOLMACHTAUDITOR,2022-11-05,Amersfoort,Amersfoort,5.3875,52.155,"Bij voorkeur heb je gewerkt als volmachtbeheerder of auditor bij een gevolmachtigd agent of verzekeraar.
Denk hierbij aan de volgende taken:",,https://www.indeed.nl/rc/clk?jk=c90e91bac8a45fb1&fccid=d955ffd1ce1b409a&vjs=3,SVC Groep,employer,2022-10-06 01:01:30,auditor,indeed.nl,True
c995101ecf6ef673,Kwaliteitsmedewerker Chocoladeproducten,2022-05-25,Postcode 1462 in Middenbeemster,Middenbeemster,4.9197,52.5483,"Chocoladefabriek ""De Beemster"" B.V. in Middenbeemster is een echt familiebedrijf, die de lekkerste Belgische chocolade samen met noten, pinda’s, crispy's,…","['2.498', '3.665']",https://www.indeed.nl/company/Chocoladefabriek-De-Beemster-BV/jobs/Kwaliteitsmedewerker-Chocoladeproducten-c995101ecf6ef673?fccid=9e91c28f0e6b24f2&vjs=3,Chocoladefabriek De Beemster BV,employer,2022-10-06 01:01:30,auditor,indeed.nl,True
c9acab9ffd36715e,Financial Accounting Analyst,2022-11-05,Amsterdam,Amsterdam,4.8833,52.3667,"Co-ordinate and liaising with external auditors.
Deliver requested audit backup support documents and liaise with auditor to complete audit.",,https://www.indeed.nl/rc/clk?jk=c9acab9ffd36715e&fccid=64d182c6fc449d3a&vjs=3,OMERS,employer,2022-10-06 01:01:30,auditor,indeed.nl,True
c9ee854200941e63,Operations Middle Office,2022-04-06,Den Haag,Den Haag,4.2986,52.0767,"Able to act as the key point of contact for internal clients (Portfolio Managers, Sales and Trading, Compliance Officer and other functional areas within the…",,https://www.indeed.nl/rc/clk?jk=c9ee854200941e63&fccid=4983b5e32f963a34&vjs=3,Neuberger Berman,employer,2022-10-06 01:01:30,auditor,indeed.nl,True
ca6de96da88209eb,IT- Auditor,2022-12-05,Postcode 5653 in Eindhoven,Eindhoven,5.4778,51.4408,"Bereid om een post-master in IT-auditing te volgen.
In het bezit van 0-5 jaar werkervaring.
Met een varierend klantenbestand zal geen dag hetzelfde zijn!",['3.400'],https://www.indeed.nl/rc/clk?jk=ca6de96da88209eb&fccid=766625bc6522eb8c&vjs=3,Tempo-Team,recruiter,2022-10-06 01:02:30,auditor,indeed.nl,True
caab5201472d2a8c,Sustainability Consultant,2022-11-05,Rotterdam,Rotterdam,4.4792,51.9225,"Ideally completed training as an auditor in one of the certification systems (BREEAM, DGNB, WELL, HQE, etc.).
Project management of C2C Projects as part of EPEA…",,https://www.indeed.nl/rc/clk?jk=caab5201472d2a8c&fccid=87b4be415e8a88ae&vjs=3,Drees & Sommer,employer,2022-10-06 01:01:30,auditor,indeed.nl,True
cac6d2562a046bc8,Financial Auditor,2022-05-31,Hybride werken in Postcode 9700 in Groningen,Groningen,6.5667,53.2167,"Wij zoeken een ervaren financial auditor, bij voorkeur met RA titel.
Als financial auditor voer je in teamverband financial audits uit, begeleid je andere…",['5.483'],https://www.indeed.nl/rc/clk?jk=cac6d2562a046bc8&fccid=905807a1f53ae0e9&vjs=3,UMCG,employer,2022-10-06 01:01:30,auditor,indeed.nl,True
cb6cff1e69b8cff7,Consultant Publieke Sector – Utrecht,2022-11-05,Utrecht+1 plaats,Utrecht,5.1222,52.0908,"Dit houdt het werk uitdagend, leerzaam en leuk.
Door een voortdurende groei van onze praktijk zijn wij op zoek naar consultants met affiniteit met het publieke…",,https://www.indeed.nl/rc/clk?jk=cb6cff1e69b8cff7&fccid=3639654bd4055c70&vjs=3,BDO,employer,2022-10-06 01:01:30,auditor,indeed.nl,True
cbaf196f27f8e156,Auditor,2022-05-25,Utrecht,Utrecht,5.1222,52.0908,"Ga aan de slag als Auditor bij a.s.r. in Utrecht.
Als Auditor maak jij deel uit het Internal Audit team en vervul jij samen met je collega’s een belangrijke rol…","['3.800', '5.500']",https://www.indeed.nl/rc/clk?jk=cbaf196f27f8e156&fccid=b4fc7aca620bb6e9&vjs=3,a.s.r.,employer,2022-10-06 01:01:30,auditor,indeed.nl,True
cbc985dcfefb224f,QHSE manager,2022-11-05,Postcode 1045 in Amsterdam Westpoort,Amsterdam,4.8833,52.3667,In jouw functie als QHSE manager ben jij onze gespreks- en sparringpartner op het gebied van veiligheid en regelgeving.,,https://www.indeed.nl/company/GMP-groep/jobs/Qhse-Manager-cbc985dcfefb224f?fccid=c7607267cff8b528&vjs=3,Paro BV,employer,2022-10-06 01:01:30,auditor,indeed.nl,True
cbf3daaee75898a2,Expert interne beheersing ICT / IT auditor,2022-11-05,Den Haag,Den Haag,4.2986,52.0767,"Ben je op zoek naar een mooie uitdaging op het gebied van interne beheersing van onze ICT-omgeving?
Maak dan kennis met P-Direkt; dé HR-dienstverlener van de…",,https://www.indeed.nl/rc/clk?jk=cbf3daaee75898a2&fccid=24881089d0402781&vjs=3,P-Direkt,employer,2022-10-06 01:01:30,auditor,indeed.nl,True
cc3913be019ea2b0,Chief Financial Officer Netherlands M/F (CFOAMSI-7067),2022-05-25,Amsterdam,Amsterdam,4.8833,52.3667," Manage relationship with internal & external auditors.
 Ensure financial information issued to external auditors for the local financial statements are…",,https://www.indeed.nl/rc/clk?jk=cc3913be019ea2b0&fccid=63ae94444c0cbe32&vjs=3,Bolloré Group,employer,2022-10-06 01:01:30,auditor,indeed.nl,True
cc39b85534efb4d6,Senior Internal Auditor - (MAT Cover) - NL,2022-11-05,Amsterdam,Amsterdam,4.8833,52.3667,"Collaborate with corporate internal audit team to perform joint audits or assist with audits when corporate auditors visit EMEAR: planning, interviews and…",,https://www.indeed.nl/rc/clk?jk=cc39b85534efb4d6&fccid=731e8782b6bf7657&vjs=3,Epson Europe,employer,2022-10-06 01:01:30,auditor,indeed.nl,True
ccf10494f425b46e,International Country Accountant,2022-05-20,Hoofddorp,Hoofddorp,4.6667,52.3,Responsible for managing the local audits by assisting external consultants or auditors with annual FS preparation and CIT computation.,,https://www.indeed.nl/rc/clk?jk=ccf10494f425b46e&fccid=dd7de5cf522ca5fc&vjs=3,Nutanix,employer,2022-10-06 01:01:30,auditor,indeed.nl,True
cd3e7bfbd5e28e06,Financial Acountant – Rotterdam,2022-05-21,Rotterdam,Rotterdam,4.4792,51.9225,"Je bent onderdeel van de maandelijkse reporting cycle;
Je maakt onderdeel uit van verschillende projecten;","['48.000', '56.000']",https://www.indeed.nl/rc/clk?jk=cd3e7bfbd5e28e06&fccid=5d1cd7991a8d6b8c&vjs=3,Greenberg Nielsen,recruiter,2022-10-06 01:02:30,auditor,indeed.nl,True
cd9de9cb503e1203,Internal Auditor,2022-11-05,Nederland,,,,"A good knowledge of IT environments and experience with IT Audits (EDP auditor and/ or JD Edwards is a plus);
You will report to the Director Internal Audit.",,https://www.indeed.nl/rc/clk?jk=cd9de9cb503e1203&fccid=8d26a4e4e9d7624b&vjs=3,IMCD,employer,2022-10-06 01:01:30,auditor,indeed.nl,True
cde9e9523b744943,Senior Internal Auditor,2022-11-05,Postcode 1077 in Amsterdam Zuid,Amsterdam,4.8833,52.3667,The Senior Internal Auditor will be part of an international team of Auditors that is responsible for conducting 7-8 audits in Europe per year.,,https://www.indeed.nl/rc/clk?jk=cde9e9523b744943&fccid=dae59249f7edc321&vjs=3,DENSO International Europe B.V.,employer,2022-10-06 01:01:30,auditor,indeed.nl,True
ce6ea0eb2529bfe3,IT Analyst,2022-11-05,Amstelveen,Amstelveen,4.8639,52.3008,"Reports To : MS AISE Applications Manager.
MS Amlin is part of the MS&AD insurance group and is made up of number of speciality insurance and reinsurance…",,https://www.indeed.nl/rc/clk?jk=ce6ea0eb2529bfe3&fccid=fd16eab711fd6d32&vjs=3,MS Amlin,employer,2022-10-06 01:01:30,auditor,indeed.nl,True
cebf5dfe2baf0479,Internal Auditor (parttime of fulltime),2022-11-05,Postcode 5623 in Eindhoven,Eindhoven,5.4778,51.4408,"Wij bieden je een uitdagende en adviserende audit functie in een complexe en dynamische zorgomgeving waar het uitvoeren van diverse audits, reviews en het…",['5.801'],https://www.indeed.nl/rc/clk?jk=cebf5dfe2baf0479&fccid=a2fc85fc06f453cf&vjs=3,Catharinamatch,employer,2022-10-06 01:01:30,auditor,indeed.nl,True
cedb17983b012439,Werkstudent Flex Auditor,2022-11-05,Tijdelijk thuiswerken in Utrecht,Utrecht,5.1222,52.0908,"Al snel voer je werkzaamheden uit van een junior auditor.
Op basis van onze vooruitstrevende visie helpen onze Flex Auditors organisaties verder te groeien en…",[],https://www.indeed.nl/rc/clk?jk=cedb17983b012439&fccid=547586fe72c11c85&vjs=3,KnappeKoppen,recruiter,2022-10-06 01:02:30,auditor,indeed.nl,True
cf3b0f4697e0cc4d,Businessgerichte IT-Auditor,2022-11-05,Apeldoorn+1 plaats,Apeldoorn,5.97,52.21,"Wij ondersteunen het clustermanagement door de onderwerpen HR, financiën, planning en control, productieregie en audit te bundelen.","['4.367', '6.547']",https://www.indeed.nl/pagead/clk?mo=r&ad=-6NYlbfkN0BP4go0ig0pZwWajoZJbvxsmm1JF4vOTiD3exOKsqp1XCaW8XNPFElFj3glsl-rmBlg6ENbc-TwEhJwKIqvyNAgZ0-wBxd9rcozKQlKFheuS3EhlOE8C-UxrdlR2H3wvnn5hIw9ECWJb3hbrBIH7ivY17wdOe4-YQJmsWs6ZNwsXdkjYZjZU1g5ZjxzzyIhxnZVmx38ee-Sbvk4g3amZC-q7asPF5E4ze9WZyvyOMu4rcrrRlceL7I0Y3fgcyXH3Js3F7yFUv2YK43YsskLCJ-9XtP-MYb4vCel1LCbvRNGuOp4WlNDlcDO4hsLl-sODbOulZEiCt8i3RtFnhQMqalheUk2s4Ey9N5cT6EysawCdmy8n4QaKsskjr_eQqM39gwblOzMCzM22dXo_t--OzBgklmfXGfM53eBJFVy70v6amKy_ux17TQUXGlfAkLffqQp2orbXIApZZEgHeHGf79_oIzPko8a7zI7PFXs0dwX-jeQiH1NCdQH-gyhogmKeoXUFBDR4_o1Ej7fafdkQA1EAk0Evsg7vDv7qzCoVfZnqdRlbRqOeo-uMFHkFRfcg8kIAFVEZpe2AFhOVmfqsFFr&p=2&fvj=0&vjs=3,belastingdienst,employer,2022-10-06 01:01:30,auditor,indeed.nl,True
cf77b69055c35169,Senior Belastingadviseur Public,2022-11-05,Den Bosch,,,,"10 mensen werkzaam op fiscaal terrein en op het gebied van data-analyse.
Fiscaal management omvat het beheersen van fiscale risico’s.",,https://www.indeed.nl/rc/clk?jk=cf77b69055c35169&fccid=0f3abe8c101a5c3d&vjs=3,"du ROI Accountants, belastingadviseurs &...",employer,2022-10-06 01:01:30,auditor,indeed.nl,True
cfd430f205094a68,divisieleider voor audits,2022-11-05,Postcode 2676 in Maasdijk,,,,"Jij bent scherp, volhardend en effectief.
Consultative selling, acquisitie, business development, strategisch accountmanagement, kwaliteitsmanagement,…",,https://www.indeed.nl/rc/clk?jk=cfd430f205094a68&fccid=b9c42f49f08db2fe&vjs=3,vibber,employer,2022-10-06 01:01:30,auditor,indeed.nl,True
cfe869992b0aa491,Junior) Adviseur Internal Audit – Utrecht,2022-11-05,Utrecht,Utrecht,5.1222,52.0908,"Binnen Risk Services, onderdeel van BDO Digital, zijn wij op zoek naar een Internal Auditor om onze praktijk te komen versterken.",,https://www.indeed.nl/rc/clk?jk=cfe869992b0aa491&fccid=3639654bd4055c70&vjs=3,BDO,employer,2022-10-06 01:01:30,auditor,indeed.nl,True
d02e3ecd040539f8,Process Quality Manager,2022-05-06,Thuiswerken in Driebergen-Rijsenburg,Rijsenburg,5.2531,52.0436,"Coordination, planning and monitoring of the (external ISAE3402) auditors on approach, progress of activities and delivery of evidence.",,https://www.indeed.nl/rc/clk?jk=d02e3ecd040539f8&fccid=c9c7c2712f672abc&vjs=3,Triodos Bank N.V.,employer,2022-10-06 01:01:30,auditor,indeed.nl,True
d06af4f0a89a69c0,Interim Directeur CFA,2022-11-05,Enschede,Enschede,6.8958,52.2183,"Het team Internal Audit bestaat uit twee auditors, die onderdeel van CFA zijn, maar een eigen lijn hebben met het CvB.
Zeer bedreven in subtiele interventies;",,https://www.indeed.nl/company/Anjumo/jobs/Interim-Directeur-CFA-d06af4f0a89a69c0?fccid=16787bbc242c310e&vjs=3,Anjumo,recruiter,2022-10-06 01:02:30,auditor,indeed.nl,True
d09a24033a240480,Freelance Inspecteur speel- en watertoestellen,2022-01-06,Zoetermeer,Zoetermeer,4.4931,52.0575,"Beoordeling van technische constructiedossiers en technische tekeningen.
Één en ander zelfstandig als ook in teamverband.",,https://www.indeed.nl/company/Keurmerkinstituut/jobs/Freelance-Inspecteur-Speel-d09a24033a240480?fccid=9d2cfe7d235c1012&vjs=3,Keurmerkinstituut,employer,2022-10-06 01:01:30,auditor,indeed.nl,True
d1412cfcff7e81db,AUDIT COORDINATOR EMEA,2022-11-05,Heerlen,Heerlen,5.9833,50.8833,"You will get exposure throughout EMEA while business partnering with local finance, Corporate Audit, EMEA Controlling and our external auditors.",,https://www.indeed.nl/rc/clk?jk=d1412cfcff7e81db&fccid=f06a4d05bf5510ec&vjs=3,Medtronic,employer,2022-10-06 01:01:30,auditor,indeed.nl,True
d1e03384745c7e2c,"Asset Manager Greystar Netherlands, Den Haag",2022-11-05,Zuid-Holland,,,,"Je hebt hierbij uitstekende schriftelijke en verbale communicatievaardigheden om financiële gegevens voor te bereiden en uit te leggen aan managers, teamleden,…",,https://www.indeed.nl/rc/clk?jk=d1e03384745c7e2c&fccid=478ed51f915ec984&vjs=3,PropertyPeople,recruiter,2022-10-06 01:02:30,auditor,indeed.nl,True
d1f81e4f6ed18354,Information Security Analyst,2022-11-05,Leidschendam,Leidschendam,4.4,52.0833,You have experience working with internal and external auditors and demonstrated experience in application security practices and IT Risk & Security governance.,,https://www.indeed.nl/rc/clk?jk=d1f81e4f6ed18354&fccid=10ed9e123e978078&vjs=3,Fugro,employer,2022-10-06 01:01:30,auditor,indeed.nl,True
d28547af61e3d3ee,Senior auditor,2022-11-05,Utrecht,Utrecht,5.1222,52.0908,Vanuit Utrecht ondersteun je het management van de Belastingdienst bij een doelmatige en doeltreffende besturing van de organisatie.,"['3.919', '5.825']",https://www.indeed.nl/pagead/clk?mo=r&ad=-6NYlbfkN0BP4go0ig0pZwWajoZJbvxsmm1JF4vOTiD3exOKsqp1XCaW8XNPFElFj3glsl-rmBnOC5LJmVi6xW482t44NWIOeZn4V021g1UZbNg6JrG5Srq8LQrP4nXFKlDKVX19RQVSmbIPcXr685EaX1MhSbFKBBMh9luWHvDyTug_Tr5eXfFR4_G_ZXOAgZ2j6t1aWeP8Hs3hL1N4g_Qug1w1YDBpvOnyc-Xgr9cXfwtSGIgCFtH8tehY_nBsi30OhUJeRkOGagiR09Xbuhj3FpMZiswW-9PNHSwzIaHVG6YqS02q2d_XfI5wldZhPzMmFN9twXeVyqseMi-ianLupXpqXI6wJkaV5jvRw8O_0aWOVD8VfMch9CPMgS8xSOadEef2XCjMBvDeJXGx8KtR456Ux-tEXZDrSlfMUlTEkDF9xNPtxdL9IdDPgzr_-pvnMEDuAb8Z9kkgSunXwaEgZicFNGrwEMzbcrF92BcjhZWoRO3AV6SrlSTCuiR3WCvFTQzvjgCR77LpuI3o6H1mvtpFLCDq3_LSFSKigIJepc1qnCfH5orMCtaxYHtcXpEy2wn3G-2M5wJcWJYhdg==&p=1&fvj=0&vjs=3,belastingdienst,employer,2022-10-06 01:01:30,auditor,indeed.nl,True
d31b0d231bf309e7,Accounting Lead - EMEA,2022-05-27,Amsterdam,Amsterdam,4.8833,52.3667,"Liaise with external auditors on the preparation and audit of the statutory financial statements.
As the Accounting Lead for EMEA, you will reporting to the…",,https://www.indeed.nl/rc/clk?jk=d31b0d231bf309e7&fccid=a3bf7d3bdd7a8525&vjs=3,Altum Consulting,recruiter,2022-10-06 01:02:30,auditor,indeed.nl,True
d3e2fa6493268400,Concern controller,2022-11-05,Hybride werken in Postcode 2596 in Den Haag,Den Haag,4.2986,52.0767,"Op basis van bestuurlijke ontwikkelingen, signalen en uitkomsten uit eerdere audits coördineer je een provincie-breed auditplan, in afstemming met de…","['6.070', '8.650']",https://www.indeed.nl/rc/clk?jk=d3e2fa6493268400&fccid=503033d26d34029d&vjs=3,Provincie Zuid-Holland,employer,2022-10-06 01:01:30,auditor,indeed.nl,True
d402c6f40fbb7ac5,Auditor,2022-11-05,Utrecht,Utrecht,5.1222,52.0908,"De Rabobank is een coöperatieve bank met meer dan 8,5 miljoen klanten.
Het testen van R-IC W&R controls conform opzet 2021 testen controls vanuit quality review…",,https://www.indeed.nl/company/Anjumo/jobs/Auditor-d402c6f40fbb7ac5?fccid=16787bbc242c310e&vjs=3,Anjumo,recruiter,2022-10-06 01:02:30,auditor,indeed.nl,True
d41acd9dd87c6670,Beleidsmedewerker Informatiebeveiliging & kwaliteit,2022-11-05,Postcode 1817 in Alkmaar,Alkmaar,4.751,52.632,"Onze webbased applicatie is een volledig patiëntendossier, gebaseerd op een internationale standaard voor de opslag van medische data en wordt gebruikt door…",,https://www.indeed.nl/rc/clk?jk=d41acd9dd87c6670&fccid=787b0ceef480414e&vjs=3,Code24 BV,employer,2022-10-06 01:01:30,auditor,indeed.nl,True
d4fa1059edc302b9,International Auditor,2022-11-05,Den Haag+1 plaats,Den Haag,4.2986,52.0767,"The Operational Auditor will be part of an international and diverse team.
The objective of this role is to deliver added value to Asset Management audits to…",,https://www.indeed.nl/rc/clk?jk=d4fa1059edc302b9&fccid=817dbf75ac000d11&vjs=3,Aegon,employer,2022-10-06 01:01:30,auditor,indeed.nl,True
d57502af4368524b,Auditor Veiligheid en Kwaliteit,2022-11-05,Nederland+3 plaatsen,,,,"Jij gaat audits uitvoeren bij onze klanten in met name Nederland en wellicht in het buitenland.
Van nature heb jij een nieuwsgierig karakter en tijdens elke…",,https://www.indeed.nl/rc/clk?jk=d57502af4368524b&fccid=640d9d5762345796&vjs=3,Dekra,recruiter,2022-10-06 01:02:30,auditor,indeed.nl,True
d6daf7d530758191,associated tutor / samenwerkende trainer/docent,2022-05-26,Amsterdam,Amsterdam,4.8833,52.3667,"To conduct training courses and provide learning solutions to customers via classroom or online facilitation.
In-depth knowledge of management systems standards…",,https://www.indeed.nl/rc/clk?jk=d6daf7d530758191&fccid=a24e94603a47ac12&vjs=3,BSI,employer,2022-10-06 01:01:30,auditor,indeed.nl,True
d7c382d6b6a26611,Junior Auditor,2022-05-17,Leuvenheim,,,,"Je carrière beginnen als auditor bij InAudit heeft veel voordelen.
Als junior auditor word je opgeleid in het uitvoeren van audits.",,https://www.indeed.nl/pagead/clk?mo=r&ad=-6NYlbfkN0CPV2DcenltS1pkBl_pMyim6Xwkw0vnsRQ4HE8gG1BfLzr5xaBpb4oIBF-C1mGbB2lbp_ZXord1zAeYkrfggwDfjxgjOJDKstBlum54x_6-Go57M0zjar3YL1sXGlCF-DwT_yu0Uq2IGxlqujzVwHNNgibOtxFE1ilGE37nSEfNppgjj_OUKB7xsuIfJ5rMMujGI7CBTuYdpP9-nAFOCxax8D13x4n_4ew4BkRZ6Dj5Gg2Bl4AlvyG8NE4eUKDGy-OV53nVyHV8Vb9IOY2pEsYceqC4ULrLl0h90I47nVqrfz6QyicO1VtLDSOgW7od5VpF2rghXbfuPB42JWLCYsDXRxqVXkGZMtYSGLssd55rOlsR-cMlfxvBG-brLIJ0r4ttwK1TbEOwqCQDcRdslFRsuVjxqzi7YizIVFezsVmQ2NFL9q8jALnQaXGCAM9lND-z9huPogXW7Bnld9-_Bk3qkhwqT3zzN2EmsVxqV-bK6ijcPDdl-ePcA2nYj-H5T04eijVsKs9H1osSsQ-9FH8810JwjKJ10sRviUP-xNZQJdThHbhOjuzw6yrKmX-tbW5yo8r1C9wj-n9rylmYuoLGQ3xL8jXjePBv4d79OuUyYvG2lBc-LFI4iLYqQZ5pwHQpFSc0rBzffcjwIgcBok3fg3IckYhtrOXH1bAt_Idk5wTX2KX4r0mGdS6xA_x7BIP-YG4BkLS5FUslvtzXvtfr_mEpgRAn2TbyQVUtBmDuEW6KzciEHlh7jQye-tUzIMEqswHYRZg5w4I1ChWD4BfFtkxLCiQ9E0H3pPfQrnnxChFQ9tTGsZF3iocX7Tfs1E8=&p=10&fvj=0&vjs=3,InAudit,recruiter,2022-10-06 01:02:30,auditor,indeed.nl,True
