job_id,job_title,job_date,job_loc,job_city,job_lng,job_lat,job_summary,salary,job_url,company_name,company_type,search_time,search_position,source,search_qualified
3793835229607d74,IT Auditor,2022-11-05,Amsterdam,Amsterdam,4.8833,52.3667,"Minimum of two years progressive IT Audit experience in a recognized IT consulting or public accounting firm, or equivalent experience as an IT auditor within…",['60.000'],https://www.indeed.nl/rc/clk?jk=3793835229607d74&fccid=dd178aaa10bf39b7&vjs=3,Corbulo Executive Search,recruiter,2022-10-06 01:02:30,auditor,indeed.nl,True
37ebf6689722f3ad,Senior Specialist Compliance and Tax Reporting,2022-05-27,Oss,Oss,5.5181,51.765,"Intensive communication with internal and external auditors and coordination of audits;
Location: Oss, with possibility to work from home (preferably 2 days per…",,https://www.indeed.nl/rc/clk?jk=37ebf6689722f3ad&fccid=3b5522176c21a60c&vjs=3,Organon,employer,2022-10-06 01:01:30,auditor,indeed.nl,True
3818882ef104c808,"Auditor Kwaliteit, Veiligheid & Milieu",2022-11-05,Utrecht,Utrecht,5.1222,52.0908,"Dat maakt jouw baan als auditor kwaliteit en veiligheid niet alleen zeer gevarieerd, maar ook nog eens maatschappelijk relevant.",,https://www.indeed.nl/rc/clk?jk=3818882ef104c808&fccid=80156be90517a5bd&vjs=3,ISO-point,recruiter,2022-10-06 01:02:30,auditor,indeed.nl,True
383a30dd819ec7e5,Treasury Consultant,2022-11-05,Nieuw-Vennep,,,,"Liaises with external and internal auditors, provides inputs & explanations to auditor data requests.
Daily accounting: monitoring treasury bank transactions,…",,https://www.indeed.nl/rc/clk?jk=383a30dd819ec7e5&fccid=45760e614a6eb614&vjs=3,Frendz Finance,recruiter,2022-10-06 01:02:30,auditor,indeed.nl,True
3884793fb698f195,LEAD AUDITOR FOOD,2022-11-05,Amersfoort+2 plaatsen,Amersfoort,5.3875,52.155,"Wij zijn Bureau Veritas - een internationale leider in Testing, Inspection en Certification.
Om deze missie te voltooien zetten wij onze teams in op het gebied…",,https://www.indeed.nl/rc/clk?jk=3884793fb698f195&fccid=fdd8787d3dc18c3e&vjs=3,Bureau Veritas,employer,2022-10-06 01:01:30,auditor,indeed.nl,True
38c6284f01525dd7,Security Auditor - EMEA,2022-11-05,Thuiswerken in Haarlem,Haarlem,4.6406,52.3803,"ISMS Auditor (Security Audit Consultant).
Managing and delivering ISMS audit assignments.
Defining the scope for ISMS audit assignments.",,https://www.indeed.nl/rc/clk?jk=38c6284f01525dd7&fccid=f90702677a49de6f&vjs=3,Gaming Laboratories International,employer,2022-10-06 01:01:30,auditor,indeed.nl,True
38ed3d1c2f5e1824,Internal Audit Manager Europe,2022-11-05,Nederland,,,,"O Je onderhoudt contact met de externe auditors bij de kwartaal- en jaarafsluitingsbeoordelingen.
O A qualified public accountant or internal auditor (ACA /…",['90.000'],https://www.indeed.nl/rc/clk?jk=38ed3d1c2f5e1824&fccid=7fb3a97cd6e79b0f&vjs=3,Travelex,employer,2022-10-06 01:01:30,auditor,indeed.nl,True
393d8127419b1bc6,Senior security consultant,2022-11-05,Postcode 6511 in Nijmegen,Nijmegen,5.8528,51.8425,"Isatis Cyber Security is een kennis expert op het gebied van security, compliance én privacy.
De Security consultant is het aanspreekpunt en “gezicht” van…",,https://www.indeed.nl/rc/clk?jk=393d8127419b1bc6&fccid=48ba149f7abaa8ec&vjs=3,Isatis CyberSecurity,employer,2022-10-06 01:01:30,auditor,indeed.nl,True
3988872aef423fb7,Subcontactor,2022-11-05,Rotterdam,Rotterdam,4.4792,51.9225,"Position Type:Contractor On Demand.
Op basis van uw deskundigheid biedt U de opdrachtgever een meerwaarde in de ontwikkeling van onze dienstverlening.",,https://www.indeed.nl/rc/clk?jk=3988872aef423fb7&fccid=51e6d37e31a6306f&vjs=3,Lloyd's Register Group,employer,2022-10-06 01:01:30,auditor,indeed.nl,True
3a2ad4a3f323f088,Financial Auditor,2022-11-05,Amstelveen,Amstelveen,4.8639,52.3008,"Circa 3 jaar werkervaring als assistent accountant in de auditpraktijk, of als (internal) auditor.
Je hebt al enkele jaren ervaring opgedaan als assistent…",['5.229'],https://www.indeed.nl/rc/clk?jk=3a2ad4a3f323f088&fccid=259a62d86bb5b3a7&vjs=3,SVB,employer,2022-10-06 01:01:30,auditor,indeed.nl,True
3a2dc003fc153f7f,Global Senior Internal Auditor,2022-01-06,Leidschendam+2 plaatsen,Leidschendam,4.4,52.0833,"Manage and participate in (international) audit engagements, e.g. on business processes, organisations, projects, IT applications & processes and reporting…",,https://www.indeed.nl/rc/clk?jk=3a2dc003fc153f7f&fccid=831b1667b781d443&vjs=3,Tewes,recruiter,2022-10-06 01:02:30,auditor,indeed.nl,True
3a5892ff5a677021,Senior IT Security & Network Analyst - Amsterdam - Netherlands,2022-08-06,Amsterdam,Amsterdam,4.8833,52.3667,"Our engineers provide technical design assistance at every stage of a project, from initial planning to installation and beyond.",,https://www.indeed.nl/rc/clk?jk=3a5892ff5a677021&fccid=903f289610123238&vjs=3,Leviat,employer,2022-10-06 01:01:30,auditor,indeed.nl,True
3a821168960628ac,Internal Auditor – Innovation and Technology,2022-05-18,Alphen aan den Rijn,Alphen aan den Rijn,4.65,52.1333,"Interact with technical/infrastructure and application development/architecture teams to assess risks (including security, compliance and resiliency) arising…",,https://www.indeed.nl/rc/clk?jk=3a821168960628ac&fccid=f46e2fd6ab3f5a72&vjs=3,Wolters Kluwer,recruiter,2022-10-06 01:02:30,auditor,indeed.nl,True
3b6be14f6ab10a7e,Freelance Zorg & Welzijn Auditor,2022-05-28,Rotterdam,Rotterdam,4.4792,51.9225,"Position Type:Contractor On Demand.
Je onderzoekt de implementatie van deze managementsystemen en bepaalt of wordt voldaan aan (inter-)nationale eisen.",,https://www.indeed.nl/rc/clk?jk=3b6be14f6ab10a7e&fccid=51e6d37e31a6306f&vjs=3,Lloyd's Register Group,employer,2022-10-06 01:01:30,auditor,indeed.nl,True
3b883d3c46e1fd6b,Sr. Financial Analyst,2022-11-05,Thuiswerken in Postcode 5349 in Oss,Oss,5.5181,51.765,"Intercompany relations; provide auditors with input for the yearly financial statements;
The Financial Accountant Europe is responsible for the correctness,…",,https://www.indeed.nl/rc/clk?jk=3b883d3c46e1fd6b&fccid=f0ba227ba5c9c8b1&vjs=3,Certara,employer,2022-10-06 01:01:30,auditor,indeed.nl,True
3babdd2f60876890,Interne Auditor / Stafmedewerker Quality Assurance,2022-10-06,Postcode 9974 in Zoutkamp,,,,"In de rol van Interne Auditor / Stafmedewerker Quality Assurance houd je je voornamelijk bezig met met het voorbereiden, uitvoeren en rapporteren van interne…",,https://www.indeed.nl/company/Employability/jobs/Interne-Auditor-3babdd2f60876890?fccid=592ebb381d4e73f2&vjs=3,Employability,recruiter,2022-10-06 01:02:30,auditor,indeed.nl,False
3bc72737d04b2422,Compliance Manager,2022-11-05,Postcode 1175 in Lijnden,,,,"Ervaring als interne auditor is een pré.
Hierna neem je contact op met de eigenaar van een requirement uit het Wortell Control Framework en voert samen een…",,https://www.indeed.nl/company/Wortell/jobs/Compliance-Manager-3bc72737d04b2422?fccid=99faa90cc818e731&vjs=3,Wortell,employer,2022-10-06 01:01:30,auditor,indeed.nl,True
3c30235af299d959,Blockchain Developer,2022-11-05,Amsterdam,Amsterdam,4.8833,52.3667,"Implement fixes in collaboration with the community and smart contract auditors.
Under Reality is a digital media, entertainment, and technology company that…",,https://www.indeed.nl/rc/clk?jk=3c30235af299d959&fccid=ad5fe0adb0b8e862&vjs=3,Under Reality,employer,2022-10-06 01:01:30,auditor,indeed.nl,True
3d2fab240859e317,Stagiair HBO ICT,2022-11-05,Terneuzen,Terneuzen,3.8333,51.3333,Een ambitieus bedrijf met korte communicatielijnen;,,https://www.indeed.nl/rc/clk?jk=3d2fab240859e317&fccid=77c8d4709b1e2de8&vjs=3,Groep De Hoop,employer,2022-10-06 01:01:30,auditor,indeed.nl,True
3d787ce513634481,Models Senior Auditor,2022-11-05,Amsterdam,Amsterdam,4.8833,52.3667,"As a Models Senior Auditor you will be challenging the models and assessing the model design, development, validation, implementation, monitoring, together with…",,https://www.indeed.nl/rc/clk?jk=3d787ce513634481&fccid=5b16841c3468a10d&vjs=3,ING,employer,2022-10-06 01:01:30,auditor,indeed.nl,True
3dd0499331836604,Interim IT Auditor,2022-11-05,Amsterdam,Amsterdam,4.8833,52.3667,"Wij hebben regelmatig in samenwerking met onze partners interim IT Auditor opdrachten beschikbaar.
Neem contact op met ons voor de actuele stand van zaken.",,https://www.indeed.nl/rc/clk?jk=3dd0499331836604&fccid=72ae7ffe8d04db50&vjs=3,Sterksen,recruiter,2022-10-06 01:02:30,auditor,indeed.nl,True
3df6a7590fd527fc,Consultant Enterprise Technology,2022-05-24,Hybride werken in Amsterdam,Amsterdam,4.8833,52.3667,"Je werkt hierbij in teamverband en samen met andere specialisten, zoals data analisten, financiële auditors, cybersecurity experts en verandermanagement collega…",,https://www.indeed.nl/rc/clk?jk=3df6a7590fd527fc&fccid=5e964c4afc56b180&vjs=3,PwC,employer,2022-10-06 01:01:30,auditor,indeed.nl,True
3e7e08dd302883c9,Manager Cybersecurity - Technology Risk,2022-05-24,Postcode 1083 in Amsterdam Zuid,Amsterdam,4.8833,52.3667,"Je bent geregistreerd als Register EDP-auditor (RE) bij NOREA.
Als Manager Cybersecurity Technology Risk maak je onderdeel uit van een meer technisch team…",,https://www.indeed.nl/rc/clk?jk=3e7e08dd302883c9&fccid=1544766d4c2915b0&vjs=3,EY,employer,2022-10-06 01:01:30,auditor,indeed.nl,True
3e881291a4631fc7,Medewerker Kwaliteit & Veiligheid,2022-11-05,Postcode 5047 in Tilburg,Tilburg,5.0911,51.5572,"Onderhouden en begeleiden van externe contacten zoals (kwaliteitsfunctionarissen van) klanten, auditoren en inspectiediensten;",,https://www.indeed.nl/company/Gebr.-Versteijnen-Transport-&-Logistics-B.V./jobs/Medewerker-Kwaliteit-Veiligheid-3e881291a4631fc7?fccid=cd99202bc90af3fb&vjs=3,GVT Transport & Logistics,employer,2022-10-06 01:01:30,auditor,indeed.nl,True
3f0bcfc5f7e866ab,Audit Senior US Clients,2022-05-30,Postcode 5613 in Eindhoven+3 plaatsen,Eindhoven,5.4778,51.4408,"Minimum of 2 years of experience working as an auditor within the Big 4, with at least 1.5 years of experience working in the US on PCAOB audit engagements;",,https://www.indeed.nl/rc/clk?jk=3f0bcfc5f7e866ab&fccid=1544766d4c2915b0&vjs=3,EY,employer,2022-10-06 01:01:30,auditor,indeed.nl,True
3f3191a4e6518d90,Group IT Auditor,2022-11-05,Amsterdam,Amsterdam,4.8833,52.3667,"Great opportunity for candidates with 2-5 yrs of IT Audit.
Good salary + bonus 10% + car.
A bachelor’s/Master's degree in technology, computer science or a…",,https://www.indeed.nl/rc/clk?jk=3f3191a4e6518d90&fccid=831b1667b781d443&vjs=3,Tewes,recruiter,2022-10-06 01:02:30,auditor,indeed.nl,True
3f4ae95e95b977d1,Certificatie Expert Energie en Duurzaamheid,2022-05-19,Postcode 8011 in Zwolle,Zwolle,6.0944,52.5125,"Certificatie Expert Energie en Duurzaamheid*.
De Certificatie Expert Energie en Duurzaamheid (32-40 uur) bij Control Union is een analytisch, energiek en…","['2.360', '3.770']",https://www.indeed.nl/company/Control-Union-Certifications-B.V./jobs/Certificatie-Expert-Energie-Duurzaamheid-3f4ae95e95b977d1?fccid=0373e59e6d4bd25b&vjs=3,Control Union Certifications BV,employer,2022-10-06 01:01:30,auditor,indeed.nl,True
3f8c7b199d264f13,Senior HSES Manager,2022-11-05,Den Haag,Den Haag,4.2986,52.0767,"Take ownership of the HSES Management Systems and support project / operations to deliver HSES goals.
The role requires an individual that can drive a common…",,https://www.indeed.nl/rc/clk?jk=3f8c7b199d264f13&fccid=58d2ae3bd9faa0c5&vjs=3,McDermott,employer,2022-10-06 01:01:30,auditor,indeed.nl,True
3fc9c4f1eb890889,Quality Engineering Specialist,2022-11-05,Oss,Oss,5.5181,51.765,"Uitvoeren en reviewen van interne en externe audits, als (lead) auditor, om de naleving van geldende richtlijnen (zoals GMP, GLP, ISO, GDP, GCP, GVP) vast te…",,https://www.indeed.nl/company/Pharming-N.V./jobs/Quality-Engineering-Specialist-3fc9c4f1eb890889?fccid=50b1c03ec9c9506c&vjs=3,Pharming Group,employer,2022-10-06 01:01:30,auditor,indeed.nl,True
40fac42332f9a3b0,Security Engineering Manager,2022-11-05,Tijdelijk thuiswerken in Postcode 1012 in Amsterdam Centrum,Amsterdam,4.8833,52.3667,You will be responsible for the definition and delivery of our overall Security strategy across three core pillars of Security Operations; Governance/Risk…,,https://www.indeed.nl/rc/clk?jk=40fac42332f9a3b0&fccid=e8cf12a928a613d1&vjs=3,albelli,employer,2022-10-06 01:01:30,auditor,indeed.nl,True
413d999c44bbe5aa,Onderzoeker / financial auditor,2022-11-05,Den Haag,Den Haag,4.2986,52.0767,"Als onderzoeker / financial auditor voer je controlewerkzaamheden uit bij uiteenlopende onderdelen van de Rijksoverheid.
Maximaal aantal uren per week 36.",,https://www.indeed.nl/rc/clk?jk=413d999c44bbe5aa&fccid=c2edaba907ec3877&vjs=3,Algemene Rekenkamer,employer,2022-10-06 01:01:30,auditor,indeed.nl,True
4195f2b882ea1181,Financial Controller,2022-11-05,Amsterdam,Amsterdam,4.8833,52.3667,"5-6 years experience as a financial controller or as an auditor.
As Financial Controller you will be responsible for one or more legal entities/countries.",,https://www.indeed.nl/rc/clk?jk=4195f2b882ea1181&fccid=af136c4992d9560c&vjs=3,Impactsearch,recruiter,2022-10-06 01:02:30,auditor,indeed.nl,True
41c59952abed144d,Product Expert Kunststof Materialen,2022-11-05,Bennekom,Bennekom,5.6756,51.9994,"Bij QS in Bennekom werken circa 35 inspecteurs, auditoren en materiaalspecialisten samen aan het veiliger en duurzamer maken van onze leefomgeving.",,https://www.indeed.nl/rc/clk?jk=41c59952abed144d&fccid=c686c3d827925954&vjs=3,CLS Services,recruiter,2022-10-06 01:02:30,auditor,indeed.nl,True
41d0c8ab737d141d,Lead Auditor – Beverwijk,2022-11-05,Beverwijk,Beverwijk,4.6572,52.4864,"Voor onze opdrachtgever uit Beverwijk zijn wij op zoek naar een Lead Auditor.
Bestuderen van directie beoordeling, uitkomsten van de recente interne audits en…","['4.000', '4.500']",https://www.indeed.nl/rc/clk?jk=41d0c8ab737d141d&fccid=2a3bf5154a444eea&vjs=3,Loopbaan.nu,recruiter,2022-10-06 01:02:30,auditor,indeed.nl,True
4303a9f9f1ba1636,IT- Auditor,2022-11-05,Randstad+2 plaatsen,,,,"Een salaris dat oploopt tot €6,000, ingeschaald op basis van kennis en kunde;
Flexibele werktijden, jij plant je dag in;","['3.000', '6.000']",https://www.indeed.nl/pagead/clk?mo=r&ad=-6NYlbfkN0Dbl-ni-BlMHqJ_l-VMw5y_nHHvo3hHZpGW61s_iaK1PeDy_M8OMs4BWYPQzIdI7JXraHO0OjJF7XM-Kype0X0Zxc2O83q83ftGalCtgEW6PtDj7xiuBjmhzUe7iHQI2biSvR41L5hwRQONOgb_rxOsMYu9kA54G_FlBUzowxsvnZo3YA47csMnRnWsXKrK88VKC7Frsxw10LcL7NP1Km34baMD0EBnrzrdMLF_YeeWvDxC-Tib24RS4ADRYpCzWEZvEsCUTDvzD9H87-HWpy3xqPMZ8ywL701s2O4WXIo5tSxkiTe0dKJsH4JCeR0uE7eGd54KEArcdoXX1ZASv5p2uhhcseL_GsZkl7Yi533RBngpGbOjd8zgjSm6X5lEp_S6mjhQmTdmjvj-tQnTI8HHzb2ot2dZn559fDbQOzprGP4fg2frHw0riGiawV0Kg9t6ixBV68s8EgvGX4k50beGGbcNzSlliSY=&p=4&fvj=0&vjs=3,StackOps,recruiter,2022-10-06 01:02:30,auditor,indeed.nl,True
435ca234cce8cf03,Accounting Officer,2022-05-21,Amsterdam,Amsterdam,4.8833,52.3667,"Maintain contact with auditors, tax advisors, lawyers, notaries and other involved parties in order to obtain the required information for reporting purposes.",,https://www.indeed.nl/rc/clk?jk=435ca234cce8cf03&fccid=407208a60bfc4c49&vjs=3,TMF Group,employer,2022-10-06 01:01:30,auditor,indeed.nl,True
436a1ac78d8e7530,Manager QA,2022-05-19,Roosendaal,Roosendaal,4.4556,51.5314,"Verder ben je besluitvaardig, integer en ben je in staat om mensen te motiveren.
Afgeronde HBO of WO-opleiding in een gerelateerde richting.",,https://www.indeed.nl/rc/clk?jk=436a1ac78d8e7530&fccid=48f03bbaa3ccf7a9&vjs=3,ASK Romein,employer,2022-10-06 01:01:30,auditor,indeed.nl,True
43f12e7fc7d2a833,Compliance Model Validator (Freelance/ZZP),2022-08-06,Utrecht,Utrecht,5.1222,52.0908,"6 month project (with the possibility to extend).
As a gatekeeper to the financial system, the bank crucially relies on the quality of its models to prevent and…",[],https://www.indeed.nl/pagead/clk?mo=r&ad=-6NYlbfkN0CDloe_lQNlRWV8BKR31y3a0MYthPWEmP5E88ckPB8SmA4Qze--ln8yF2sFL5FCGNjoXoQxKLckQOqopIBQQeNpoRQsFQ4C2mrCESwbB1evx0Bh8wT5wp6TUxlldufkbVPfVmHCqO_xewFNVSOZTSwHtlriT6ksL34-YZAbZhartEjZYoQTgRnuZ6WHurX6WhmlulYBK3LsYri-Bj_6IpTIWYDrXLSoujO7bB7AgjAvs0Vmvye9zPLwhvXp6ViL1rwpq_nI5TzQn843DPSNdHv0bxQFgywNQeWQBSZoY8ms2-3d6sspeD4Af3Po-QuCfMzyj-T78MdiTPXMD9UP_XDMjoRab-Xat_T-LOY1ADcAmekjNtDMKA8QKFFo6pcsNBvipqemsNINlp9dHP1M7Ol4dMyjhzTZSvwd5Gm0UoBZ-i-aclnu8_0go3283H59qchn1gZ7_c4FEBizbwVVjf2QTNVyImQ4MwIyTXXLoDGVpr1Ve7d7r9J-DkIAUvOQg2cIslCt1bkT-toNHoLT4XWm8hcJpP5iANg40tQxrSKDCDr1y02Wic_S9ep7cv4PaJF6k3YPu5wnc93GjC68sgCV&p=10&fvj=0&vjs=3,itprojects,recruiter,2022-10-06 01:02:30,auditor,indeed.nl,True
445572f3b779c4fd,"Property Services Audit Program, Netherlands",2022-11-05,Amsterdam,Amsterdam,4.8833,52.3667,"You will be responsible for auditing and seeking refunds from Landlords across different countries in your region, liaising with colleagues as needed e.g. Real…",,https://www.indeed.nl/rc/clk?jk=445572f3b779c4fd&fccid=526dc61714868c28&vjs=3,IWG,employer,2022-10-06 01:01:30,auditor,indeed.nl,True
447ac8b4472a4068,Information Security Compliance Manager,2022-11-05,Postcode 3013 in Rotterdam,Rotterdam,4.4792,51.9225,"Participate in internal and external audits and guide/translate between auditor and personnel.
In the role of Information Security Compliance Manager, you will…",[],https://www.indeed.nl/rc/clk?jk=447ac8b4472a4068&fccid=2e9bbb37fdefc225&vjs=3,Signicat,employer,2022-10-06 01:01:30,auditor,indeed.nl,True
453c9a83b6890d04,Kwaliteitsmanager,2022-11-05,Gorinchem,Gorinchem,4.9742,51.8306,"Contacten onderhouden met surveyors en extern auditors.
Op het gebied van product kwaliteit zorg je dat de klant de beste kwaliteit ontvangt door het proces van…","['3.300', '4.500']",https://www.indeed.nl/rc/clk?jk=453c9a83b6890d04&fccid=78256299f3693a4c&vjs=3,Fideel Recruitment,recruiter,2022-10-06 01:02:30,auditor,indeed.nl,True
461ad93a85e8ee6d,IT Supportspecialist,2022-11-05,Hoenderloo,,,,"Onze partner ondersteunt controllers, accountants en auditors met softwareoplossingen en is een ambitieus en innovatief bedrijf van ± 70 man.",,https://www.indeed.nl/rc/clk?jk=461ad93a85e8ee6d&fccid=d109ac65bbf0c6fd&vjs=3,Kunneman & Vandenbroek Recruitment Solutions,recruiter,2022-10-06 01:02:30,auditor,indeed.nl,True
46a7e64844dc3d4f,Assurance Manager | Register Accountants (RA),2022-11-05,Utrecht,Utrecht,5.1222,52.0908,Heel belangrijk; je challenget en ontwikkelt consultants en supervisors in teams van drie tot vier performance experts (auditors) en zorgt voor een steile…,"['4.600', '6.000']",https://www.indeed.nl/company/Conclude-Accountants/jobs/Assurance-Manager-Register-Accountants-46a7e64844dc3d4f?fccid=fe2c1f6cb4118ce5&vjs=3,Risklane - Conclude Accountants,employer,2022-10-06 01:01:30,auditor,indeed.nl,True
4762b6539466c4f5,Contractbeheerder,2022-11-05,Nederland,,,,"Voor specifieke deskundigheid maak je gebruik van externe specialisten.
De gecontracteerde service niveaus dienen als uitgangspunt.",['3.738'],https://www.indeed.nl/rc/clk?jk=4762b6539466c4f5&fccid=f3eb76b3254d4583&vjs=3,Visio,employer,2022-10-06 01:01:30,auditor,indeed.nl,True
47e9e738ac43ac0d,Senior Internal Auditor,2022-05-13,Rotterdam,Rotterdam,4.4792,51.9225,You will work directly with the Internal Audit Manager to manage the entire audit process in line with both internal and external legislation.,"['60.000', '70.000']",https://www.indeed.nl/rc/clk?jk=47e9e738ac43ac0d&fccid=0b29387857fb8b9a&vjs=3,Apollo Solutions,recruiter,2022-10-06 01:02:30,auditor,indeed.nl,True
49ead6d0b13af431,Business Analyst Credit Risk,2022-11-05,Amsterdam,Amsterdam,4.8833,52.3667,"Prepares responses to ad-hoc requests from stakeholders (e.g. ECB, DNB, Internal and external auditors).
What makes Cognizant a unique place to work?",,https://www.indeed.nl/rc/clk?jk=49ead6d0b13af431&fccid=2df6a1e69a70a1e7&vjs=3,Cognizant,employer,2022-10-06 01:01:30,auditor,indeed.nl,True
49f333a7953bdbd9,Financial Controller – Suitsupply,2022-11-05,Amsterdam,Amsterdam,4.8833,52.3667,"Act as a sparring partner for the finance team, management team operational department and external auditors;
Contribute to the monthly/quarterly/annual closing…",,https://www.indeed.nl/rc/clk?jk=49f333a7953bdbd9&fccid=5d1cd7991a8d6b8c&vjs=3,Greenberg Nielsen,recruiter,2022-10-06 01:02:30,auditor,indeed.nl,True
4a220dc9500b37e4,Junior Manager IT Assurance – Landelijk,2022-11-05,Nederland,,,,Samen met andere collega’s mag je onze Junior IT Auditors begeleiden in hun ontwikkeling binnen het vakgebied en onze klanten voorzien van diverse audits binnen…,,https://www.indeed.nl/rc/clk?jk=4a220dc9500b37e4&fccid=3639654bd4055c70&vjs=3,BDO,employer,2022-10-06 01:01:30,auditor,indeed.nl,True
4a65c41193edd461,Auditor Horizontaal Toezicht,2022-01-06,Hybride werken in Postcode 6881 in Velp,Velp,5.9758,51.9947,"Die kosten besparen en waardoor processen efficiënter worden.
Dat stelt zorgaanbieders in staat goedkoper zorg te leveren die van een hogere kwaliteit is.",,https://www.indeed.nl/rc/clk?jk=4a65c41193edd461&fccid=a8a68a6af6128187&vjs=3,Gezond Know How,employer,2022-10-06 01:01:30,auditor,indeed.nl,True
4a9935fc8b0de630,"Assistant VP, Fund Accounting",2022-11-05,Willemstad Curaçao,Willemstad,4.4378,51.6919,"Assisting auditors and other fund participants and advisers;
Maintaining relationships with investors, investment advisors/managers, banks, brokers and auditors…",,https://www.indeed.nl/rc/clk?jk=4a9935fc8b0de630&fccid=58a0b6e7b7d51d7e&vjs=3,Citco,employer,2022-10-06 01:01:30,auditor,indeed.nl,True
4b4bdff950d43dfa,Night Auditor,2022-05-14,Postcode 7160 in Neede,Neede,6.6167,52.1333,"A Night Auditor maintains the professional financial standards of the hotel by managing end-of-day reports, ensuring accuracy, and reporting anomalies.",,https://www.indeed.nl/rc/clk?jk=4b4bdff950d43dfa&fccid=6f47211b0637a52d&vjs=3,Hilton,employer,2022-10-06 01:01:30,auditor,indeed.nl,False
4b4d5f6227427b7c,IT Auditor,2022-11-05,Thuiswerken in Gouda,Gouda,4.7056,52.0181,"Voor onze afdeling Audit, Risk & Compliance zijn wij op dit moment op zoek naar een IT Auditor.
Je houdt je bezig met het uitvoeren van interne audits op onze…",,https://www.indeed.nl/pagead/clk?mo=r&ad=-6NYlbfkN0AuKbZOEW-E7A2haJyAoyjjxWQehSfLgZhuNRC-akG-tE9xkKdU7Du6cwoGgfeT-WZSlJlY76naRkis83-0WDVdhGIl0U7gi8pNTz5QNs0U473U2zTRT-VvkCu9Dvi5TApZ9ZWYfl_rLiKgs4ei3t_dMpki7IaQp5S6FYDBHJ2afYBn36Ne-zVcmjuqXMbU7BcsNEM_NIt7veoOcbxscg2RpGvRFN3MrD6OH2blkbyYgXDnA0K4xqiKPFybqRVrCYb2-RmbVl7bUA_KENFOrX5kVvhvIJav3g0W0NHvCFzrqoLQDbT8ZfPC4HkQSY6uSjwle5lxRNsGvh1uMapTOf3HlTODdX1cvz-bykaR54gOM8FITtmiAN8ZHBN06VcK5WAPhOy_Lz_JWGiQ2UNppVogMD63HqTciJ5S27NH8XwL3R7sxe-oxrGA1vlESSVW3rzR0Rv8bcpvk60pS8LOIkq89zbcT-yqUk1e3EAO_02esI2mLpSc_1_TcP9WqCSBz_rs7IlBf_41DkFYcbik4uEcy3xlLFK16qRYts1pWj_-L8F6JbIEKooUaNU4up8lhjUcjTg0jAdgIphognvwf89see5HwXXzl_yumCjuyLr3TH-8tj-GyR9J7aL63ncsbLU6gsBRzHNRQZH2MwtAoRp1-aChJ3FdpVkiwnerRiJa2CjpAT8KNDnUjeaanyig7MyHA-PTsFujwcRU4MBA7QAiD4cocRri9TYbbAldNUbOuMzkmC6o15Um2Eb9D2EGETKG1as6JdEdc3UHDtHTAiMnYBVicm_dVqw=&p=8&fvj=0&vjs=3,Centric,recruiter,2022-10-06 01:02:30,auditor,indeed.nl,True
4b620735486ef900,International Accountant,2022-05-13,Amsterdam,Amsterdam,4.8833,52.3667,Be the main point of contact for the statutory audits and ensure smooth collaboration with the auditors for successful closing.,,https://www.indeed.nl/rc/clk?jk=4b620735486ef900&fccid=f3a36f726f745c17&vjs=3,Faire,employer,2022-10-06 01:01:30,auditor,indeed.nl,True
4bbff38c99424689,Security Analyst (Remote),2022-11-05,Thuiswerken in Amsterdam,Amsterdam,4.8833,52.3667,"Act as a point of contact for security related queries from internal staff and auditors.
We are looking for a talented Security Analyst to play a key role in…",,https://www.indeed.nl/rc/clk?jk=4bbff38c99424689&fccid=affdf1e411b75152&vjs=3,Currencycloud,employer,2022-10-06 01:01:30,auditor,indeed.nl,True
4bcd457d26054d05,Talent Acquisition Manager,2022-05-25,Postcode 1017 in Amsterdam Centrum+1 plaats,Amsterdam,4.8833,52.3667,"In this role, you will be responsible for creating the best recruitment and onboarding experience; Your days will be a combination of spotting the right talent,…",,https://www.indeed.nl/rc/clk?jk=4bcd457d26054d05&fccid=827d82146a6b8d9b&vjs=3,DataSnipper,employer,2022-10-06 01:01:30,auditor,indeed.nl,True
4c55801faf55be13,ZZP Receptionist / receptioniste (nacht) Amsterdam,2022-11-05,Amsterdam,Amsterdam,4.8833,52.3667,"Tijdens jouw werk als night auditor doe je waardevolle ervaring op en geef je een boost aan je cv.
Je bent in bezit van eigen vervoer en staat graag op…",,https://www.indeed.nl/rc/clk?jk=4c55801faf55be13&fccid=ab7ef510f8695154&vjs=3,Ivoren Wachters,recruiter,2022-10-06 01:02:30,auditor,indeed.nl,True
4c8005c59159d7e6,Junior volmacht auditor,2022-11-05,Amstelveen,Amstelveen,4.8639,52.3008,"Als dossier auditor Volmachten speel je, samen met jouw directe collega’s, een belangrijke rol in de risicobeheersing van deze uitbestede werkzaamheden.",,https://www.indeed.nl/rc/clk?jk=4c8005c59159d7e6&fccid=fd16eab711fd6d32&vjs=3,MS Amlin,employer,2022-10-06 01:01:30,auditor,indeed.nl,True
4d5f655f2c7945e6,Supervisor Audit Den Bosch,2022-11-05,Den Bosch+1 plaats,,,,Als Supervisor Audit verricht je in samenwerking met de (junior) manager en/of partner uiteenlopende accountancywerkzaamheden.,,https://www.indeed.nl/rc/clk?jk=4d5f655f2c7945e6&fccid=1bfec2a2f61dd5c2&vjs=3,Baker Tilly,employer,2022-10-06 01:01:30,auditor,indeed.nl,True
4de59c7db859b7c6,Auditor feed en food,2022-05-21,Giessen,Giessen,5.0328,51.7886,"Werken bij Schouten Certification brengt een hoge mate van vrijheid, eigen initiatief en verantwoordelijkheid met zich mee.
In het bezit van een rijbewijs;",,https://www.indeed.nl/rc/clk?jk=4de59c7db859b7c6&fccid=6b0bb000c61d4f98&vjs=3,Schouten Certification,employer,2022-10-06 01:01:30,auditor,indeed.nl,True
