job_id,job_title,job_date,job_loc,city_id,job_summary,job_salary,job_education,job_url,company_name,company_type,search_time,search_position,source,search_qualified
b7cb75c40977fdeb,IT Controller,2022-05-24,Boxtel+1 plaats,95.0,"Consolidating and explaining management the information on the results achieved, including the correct connections between the accounting and the actual…",[],master,https://www.indeed.nl/rc/clk?jk=b7cb75c40977fdeb&fccid=3e84f8a04f830ce6&vjs=3,Vion Food,employer,2022-06-23 00:43:37,accountancy,indeed.nl,True
b7cc02787a380afb,"Afstudeerstage Governance, Risk & Compliance Services",2022-06-15,Amstelveen,803.0,"Laatste fase WO master in (bedrijfs)economie, bedrijfskunde of accountancy.
Deze eisen geven een richting van het profiel dat wij zoeken voor deze functie.",[],master,https://www.indeed.nl/rc/clk?jk=b7cc02787a380afb&fccid=2dd390c3a48a7ed0&vjs=3,KPMG,employer,2022-06-23 00:43:37,accountancy,indeed.nl,True
b82d9975c840949f,Internal Audit Manager EMEA,2022-05-24,Oegstgeest,127.0,"5-7 years of auditing, accounting, financial reporting, and operational experience is required.
Bachelor's degree in accounting, business administration,…",[],master,https://www.indeed.nl/rc/clk?jk=b82d9975c840949f&fccid=c404ee662148c290&vjs=3,Avery Dennison,employer,2022-06-23 00:43:37,accountancy,indeed.nl,False
b873b8cd15e65d94,Scientific Internship: Radiation-hydrodynamics simulations of tin explosions,2022-05-24,Postcode 1098 in Amsterdam Oost+1 plaats,2.0,"Recommended articles for further reading on this subject:
Versolato, Power-law scaling of plasma pressure on laser-ablated tin microdroplets, Phys.",[],master,https://www.indeed.nl/rc/clk?jk=b873b8cd15e65d94&fccid=661464e6d9fb09b1&vjs=3,ARCNL,employer,2022-06-23 00:45:45,RA,indeed.nl,False
b88a02e47b359941,CFO Consulting - Manager - Transactions & Accounting,2022-06-16,Postcode 1083 in Amsterdam Zuid,2.0,"You have a minimum of 6 years of relevant accounting and finance professional experience;
Advising clients on accounting matters related to reporting and/or the…",[],master,https://www.indeed.nl/rc/clk?jk=b88a02e47b359941&fccid=1544766d4c2915b0&vjs=3,EY,employer,2022-06-23 00:43:37,accountancy,indeed.nl,True
b8dfdd6445531388,Partner Accountant MKB kantoor,2022-05-24,Katwijk aan den Rijn,34.0,Heeft ons verzocht discreet opzoek te gaan naar een Partner AA of RA die (mede) het gezicht gaat bepalen van dit MKB kantoor.,[],master,https://www.indeed.nl/rc/clk?jk=b8dfdd6445531388&fccid=a9d84f5618c1abb2&vjs=3,Adviesgroep 88,recruiter,2022-06-23 00:40:55,accountant,indeed.nl,True
b93a6c6367e73229,Senior Accountant - EMEA,2022-06-04,Thuiswerken,,The Accounting Team at Bird partners cross functionally with the business to deliver financial and accounting insights and guidance.,[],master,https://www.indeed.nl/rc/clk?jk=b93a6c6367e73229&fccid=ab1e7aafd1d9f6e4&vjs=3,Bird Rides Inc.,employer,2022-06-23 00:40:20,accountant,indeed.nl,True
b993d77dd3ebe757,Local Product Manager Benelux,2022-05-24,Utrecht,3.0,"You will manage the product(s) and business case portfolio targeting the Benelux market, and co-ordinate Product Management activities.",[],master,https://www.indeed.nl/rc/clk?jk=b993d77dd3ebe757&fccid=f43cd798aa8848d0&vjs=3,Unit4,employer,2022-06-23 00:43:37,accountancy,indeed.nl,True
ba2b5c63672e94a7,Information Security Officer,2022-05-24,Leidschendam,72.0,You have experience working with internal and external auditors and demonstrated experience in application security practices and IT Risk & Security governance.,[],master,https://www.indeed.nl/rc/clk?jk=ba2b5c63672e94a7&fccid=10ed9e123e978078&vjs=3,Fugro,employer,2022-06-23 00:39:13,auditor,indeed.nl,False
ba39c49ebcba0ac1,Audit-Manager tekenend accountant,2022-05-24,Dordrecht,812.0,"Jonge club, sterk automatiseringsgericht (BI-tooling), grote focus op eigen mensen, zoekt voor aansturing auditteam audit manager die tevens tekenend accountant…",[],master,https://www.indeed.nl/rc/clk?jk=ba39c49ebcba0ac1&fccid=c9fb654be213bbad&vjs=3,Capabla,recruiter,2022-06-23 00:46:12,RA,indeed.nl,True
bb3b459e11d5dc49,Procurement and Client Services Manager,2022-05-24,Woerden,46.0,"Position Category: * Local hire, paid in country.
We help governments, non-profit organizations, and humanitarian agencies to achieve their public health goals…",[],master,"https://www.indeed.nl/company/John-Snow,-Inc.-and-JSI-Research-&-Training-Institute,-Inc./jobs/Procurement-Client-Services-Manager-bb3b459e11d5dc49?fccid=1cc0bad63dadc919&vjs=3","John Snow, Inc. and JSI Research & Training...",employer,2022-06-23 00:43:37,accountancy,indeed.nl,False
bb5d079f7bc19220,"Avans - Manager Projectcontrol 0,9 – 1,0 fte",2022-06-22,Breda,8.0,Van onderzoek op het gebied van energietransitie tot onderzoek hoe patiëntenzorg in een ziekenhuis met behulp van techniek nog beter kan.,"[4543, 5832]",master,https://www.indeed.nl/pagead/clk?mo=r&ad=-6NYlbfkN0BUi5skEC2JacOuA5S-guKlBVqGkEVnSMmX3xEoRIYszl3Fq1VGX9VWW0EUgKwGTCp4tMMlPrcN3Kxxn4KjafbaUJUdiflwG8yNRZpnCgl8f9RsJ59nK_6R4bN9eAU3_Rp6LdCm3L6GM79eHTZRi2pM52Lf1ttso1bbOhlmia0mFet8dA9u07SD8vUGkoNfwJTa-MUY3oPceyPuof0uJAvAiC2sf3zCx8tmAdFBV-3aq3EcfXqfpi_UxchuXwQRlh8Ro3B5Qj_Hdp1JTwHagyKlPIMe2nP362uFBDYDR5tboGyU586j-uYnUMvx71NdQO4eLKvLT7eC0_vHafCRBImCPkT2rvfvOovMJJGildZflLAbc7uIPpwvVXA0pOA0b4YTj4bD1WZ1pkJEC2OotuaFmbPV97JcWdcnzbM2Vm7Z1DutMBCJxUG2-XWrdcoeP6xYBaJW6fzyuWKk3d9-01IWDOyx7Bt-MEwPJmNLbCOQFJLlr01rUyTfTAjtqYC8A5oU_qsRX1Fm5HIqijRT696j9UhCYQSvC_Wq7a0hp_NqPDzCy04rBIle0HQgkT_ImHYlO5EHByWNvs85Vrsa1JBJ0OxkjnIvtkO1RGPDL_y6JKGXJndnRZ1BO9UyXjY8ja2-x3DcWCDrVvCn95UEb2o1LHvW-cBAnPFCwdqIp15pu-3-tzjOPcqHUyTOODG-wtk=&xkcb=SoAY-_M3cG6T54B9Yz0LbzkdCdPP&p=8&fvj=0&vjs=3,Public Search,employer,2022-06-23 00:43:37,accountancy,indeed.nl,True
bbc241d15d16b2b2,Technical Program Manager,2022-05-24,Amsterdam,2.0,"Experience managing technical programs across cross functional teams, building processes and coordinating release schedules.",[],master,https://www.indeed.nl/rc/clk?jk=bbc241d15d16b2b2&fccid=fe2d21eef233e94a&vjs=3,Amzn Dev Ctr (Netherlands) B.V,employer,2022-06-23 00:43:37,accountancy,indeed.nl,True
bbe44fcd7381dceb,Medewerker Financial Accounting,2022-05-24,Reeuwijk,216.0,Als medewerker Financial Accouting ben jij een gedreven collega die binnen de afdeling Finance zelfstandig de volledige inkoop- verkoop en bankboekingen…,"[2500, 3300]",master,https://www.indeed.nl/pagead/clk?mo=r&ad=-6NYlbfkN0BbLrBtyB1hBWG6cncLua1owX_X2qogifHzQ6PSdeM7Vkvsux_xS51cnMU8mfqIygmA4BxYswWTUc72qZL35dGBw1fsRhP4LPnlKOU7Pj7o-XNMXsZZue22O2AN-_kFPq5tuHVJLZqyj8PYA4j_T-wtTbvzEHwlLTQffyfkGyZUelbqVzhVRkf_DEnnOxDkTD5EKPwFkN3QctoFfO0Ntvx8YKFu4lT7sMy_qPShssLdghiwsi1fxRkRscXQFeaMlU9rVzm_Xl6WOpajpo-phot-owi8UeISwY3oOVgBI963aJ6dUzGnZY50B1CPZa1LVJqBqmnsHQ6CIVp5rf4dIFNDhd8oIUUe_hUeeFeNC6PcipLCNlSa6fj-0-r3IkBj-dCp2cElOwu_ZNYsrZ7kaJ5WkCflNHB-nPu6QZmQvKXvCvRp_kSlvuW2C4FtnENCnt8EfSKR2Jk6ygXUPQbC9OB2H4PWIilLWXwgoPQ2TPsJd8wrSbdX1f3auxjyJfyud8s=&xkcb=SoCE-_M3cG6UEfepj50LbzkdCdPP&p=0&fvj=0&vjs=3,CAG Groep,employer,2022-06-23 00:43:37,accountancy,indeed.nl,True
bbea7ddd514b038c,Junior controleleider,2022-05-24,Nijkerk+1 plaats,836.0,"Je bent in het bezit van een afgeronde Master accountancy;
Je bent ambassadeur van onze opdrachtgever en draagt de visie en beleid uit naar collega’s en externe…","[3000, 3500]",master,https://www.indeed.nl/rc/clk?jk=bbea7ddd514b038c&fccid=79cd219281f38c26&vjs=3,WeCruite,recruiter,2022-06-23 00:44:40,accountancy,indeed.nl,False
bcc42fc9725e0e7a,Registeraccountant Audit & Vaktechniek,2022-05-24,Barneveld,39.0,Van Ree heeft een op kwaliteitsgerichte cultuur en onze professionals hechten grote waarde aan een kwalitatief hoogstaande dienstverlening.,[],master,https://www.indeed.nl/rc/clk?jk=bcc42fc9725e0e7a&fccid=4c3a31d1d3522754&vjs=3,Van Ree Accountants,employer,2022-06-23 00:43:37,accountancy,indeed.nl,True
bd06e4029502a4c2,Internal Control Specialist,2022-06-10,Eindhoven,5.0,"Master degree in accounting and/or business economics.
The Internal Control Specialist plays a central role in supporting internal control activities at DAF,…",[],master,https://www.indeed.nl/rc/clk?jk=bd06e4029502a4c2&fccid=1d8ccca292353db7&vjs=3,DAF,employer,2022-06-23 00:43:37,accountancy,indeed.nl,False
bd13164731a85a8d,Commercial Business Analyst,2022-05-24,Nieuw-Vennep,,"Business partnering with the stakeholders.
Responsible for month-end-closing Commercial (B2B / Programming & On Air / CEX / CMO / AVAD / Office / Mobile).",[],master,https://www.indeed.nl/rc/clk?jk=bd13164731a85a8d&fccid=45760e614a6eb614&vjs=3,Frendz Finance,recruiter,2022-06-23 00:44:40,accountancy,indeed.nl,False
bd3bfaeb76fee66d,Accounting Manager - Private Equity,2022-05-24,Postcode 1101 in Amsterdam-Zuidoost,2.0,"You will build strong customer relationships with existing and new clients, banks, auditors and other external parties, gaining insight into their needs and…",[],master,https://www.indeed.nl/rc/clk?jk=bd3bfaeb76fee66d&fccid=82cf767bda52e8f4&vjs=3,IQ-EQ,employer,2022-06-23 00:39:13,auditor,indeed.nl,True
bd95b3c8601c6d8e,Senior Assistent Accountant Audit & Assurance,2022-05-24,Apeldoorn+2 plaatsen,9.0,"Niet alleen op vaktechnisch gebied, maar ook met het coachen van de (junior) assistent accountants in hun dagelijkse werk.",[],master,https://www.indeed.nl/rc/clk?jk=bd95b3c8601c6d8e&fccid=3639654bd4055c70&vjs=3,BDO,employer,2022-06-23 00:40:20,accountant,indeed.nl,False
be071ee998cdad55,Assistant Professor (0.8 – 1.0 FTE) Financial Management / Management Accounting in Healthcare,2022-06-10,Rotterdam,4.0,"The candidate holds a PhD in financial management, management accounting, business economics, quantitative business research, or a comparable field.","[3821, 5943]",master,https://www.indeed.nl/rc/clk?jk=be071ee998cdad55&fccid=f0272675b0a44750&vjs=3,Erasmus Universiteit,employer,2022-06-23 00:43:37,accountancy,indeed.nl,False
c019e938134241eb,"Accounts and Finance Manager, Amsterdam",2022-06-04,Amsterdam,2.0,"Supporting Business and Non-Business Units with accounting, Corporation tax and VAT.
Monthly Management Accounting for Business and Non-Business units located…",[],master,https://www.indeed.nl/company/Miyajima/jobs/Accounts-Finance-Manager-c019e938134241eb?fccid=7270ef412fff0272&vjs=3,Miyajima Recruitment,recruiter,2022-06-23 00:44:40,accountancy,indeed.nl,False
c05457a74ae1eccf,Business Controller - Samskip,2022-06-23,Rotterdam,4.0,"The Business Controller reports directly to the Manager Business Control and will be working closely with three other Business Controllers, the accounting and…",[],master,https://www.indeed.nl/pagead/clk?mo=r&ad=-6NYlbfkN0BUi5skEC2JacOuA5S-guKlBVqGkEVnSMmX3xEoRIYszl3Fq1VGX9VWW0EUgKwGTCoDrValdmzs2KoBFdgkKDzoghJI2pVmz1SwXb1Lsm9aSq8gio6YI2Ee0RjQF9n8mkr0Uid6-fCvRtEkYHlyeJtbKTxV-p8ocfrAg8il-7KfpAI1Ci71j_JfkslSpHe6uSlQPTd-_1WLFIGUH4RkF9QeN90ybqnkGLCFjKVivLm682KoN5bYBfswdA8WkXuOkf2uwVVYnriVVS-HzrYDwwCFBAzxvoo8NVedRpweO29Ynzf-BZSpf59Gpy0OFy9uXeRl1uTFmYn1CST3iwTUBoHJIsIDtDKslzLD0ol3ky4s9ErY5WELflWgb9WLOEt1cB1yhG44ty0rOEZ-rqT2hgnICRLeZLLqfvyydVrZi7i7Z-zXtQI0enihz8TFWcu2UGdnI_VCTNtUy5esxY03tfv-aqk_mroVezOPbTr1_J8Ys61BYCboVLMC79g9HpI3Fk2RarGBv2I3dQjJiXjBfRwZCXL77_zG2Kv98aSSHicAu4TBPtsA3VjTRNhAk9vwdCpEfUVt_K3RRfpbREhEGCdZ9K3M1onaOshcVEltuTzzOTnBJpyN7s5uYDIwOAwEEJMTMMgEV_bgXRP7GaeDfyy7Vmxn3uJCgBaVGnkLrpp65YPWOn-_mLbfn8MtY9PEu5E=&xkcb=SoCh-_M3cG6kHVB9Yz0LbzkdCdPP&p=7&fvj=0&vjs=3,Greenberg Nielsen,employer,2022-06-23 00:43:37,accountancy,indeed.nl,True
c059c836adca5017,Accountant / adviseur in de publieke sector,2022-05-24,Postcode 1358 in Almere,6.0,"Bezig met een opleiding op het gebied van accountancy (of recent afgerond);
Je hebt de zekerheid van een vaste baan en de afwisseling en de dynamiek van interim…",[],master,https://www.indeed.nl/rc/clk?jk=c059c836adca5017&fccid=94618973a6165d07&vjs=3,BMC,recruiter,2022-06-23 00:44:40,accountancy,indeed.nl,True
c09051c02697aec1,"Accountant AA / Adviseur, Sliedrecht",2022-05-30,Sliedrecht,124.0,Vanuit Sliedrecht en bij cliënten op locatie zult u verantwoordelijk zijn voor het verstrekken van bedrijfseconomische adviezen.,"[3800, 6500]",master,https://www.indeed.nl/rc/clk?jk=c09051c02697aec1&fccid=c7baf76653087ef8&vjs=3,Confido finance,recruiter,2022-06-23 00:40:55,accountant,indeed.nl,True
c0f76f7f1ceafaab,Audit Trainee HBO/ WO Utrecht,2022-05-24,Utrecht+3 plaatsen,3.0,"Afgeronde HBO of WO Bachelor of Master in de richting van accountancy, bedrijfseconomie of bedrijfskunde (en/of een andere studieachtergrond maar de motivatie…",[],master,https://www.indeed.nl/rc/clk?jk=c0f76f7f1ceafaab&fccid=2dd390c3a48a7ed0&vjs=3,KPMG,employer,2022-06-23 00:43:37,accountancy,indeed.nl,True
c14febb3aa7c714a,Senior Accountant - International Scope,2022-05-24,Amsterdam,2.0,"Highly proficient user of Microsoft Excel and accounting systems.
Educated with a Master degree in business economics/ accountancy.","[50000, 55000]",master,https://www.indeed.nl/rc/clk?jk=c14febb3aa7c714a&fccid=a3bf7d3bdd7a8525&vjs=3,Altum Consulting,recruiter,2022-06-23 00:44:40,accountancy,indeed.nl,False
c16465ed230f3948,Ervaren financieel administratief medewerker,2022-05-24,Hoevelaken,292.0,"Een afgeronde financiële opleiding (MBA, Accountancy, VBA of gelijkwaardig).
Relevante werkervaring in een soortgelijke functie.","[2600, 3000]",master,https://www.indeed.nl/company/Het-PersoneelsHuys/jobs/Ervaren-Financieel-Administratief-Medewerker-c16465ed230f3948?fccid=101a1ae33f650ba5&vjs=3,Het PersoneelsHuys,recruiter,2022-06-23 00:40:55,accountant,indeed.nl,False
c221b30069f763ec,Finance Director Accounting & Tax Europe en Asia,2022-06-04,Zuid-Holland,,"You will have interfaces with tax and accounting authorities, suppliers.
10 years professional experience in one of the area’s accounting, tax, finance.",[],master,https://www.indeed.nl/rc/clk?jk=c221b30069f763ec&fccid=dd178aaa10bf39b7&vjs=3,Corbulo Executive Search,recruiter,2022-06-23 00:44:40,accountancy,indeed.nl,False
c2a7056a0b3a4dfb,Ervaren Assistent Accountant Audit Controle,2022-06-01,Postcode 5953 in Reuver,845.0,"Je voert in teamverband de controleopdrachten (of delen ervan) uit op basis van de werkprogramma’s.
Je verzorgt voor de betreffende werkzaamheden de opzet en…","[2500, 5000]",master,https://www.indeed.nl/rc/clk?jk=c2a7056a0b3a4dfb&fccid=f552646f77ac82a6&vjs=3,WR.nl Solliciteren,recruiter,2022-06-23 00:46:12,RA,indeed.nl,True
c2c64b714d854f0e,BELASTINGADVISEUR ACCOUNTANTS- EN BELASTINGADVIESKANTOOR,2022-05-24,Naarden+2 plaatsen,177.0,"Doorstuderen wordt verder absoluut aangemoedigd bij dit bedrijf en zij faciliteren dit dan ook graag.
Je bent verantwoordelijk voor het zelfstandig opstellen…","[60000, 70000]",master,https://www.indeed.nl/rc/clk?jk=c2c64b714d854f0e&fccid=186003b43c7c6add&vjs=3,James Woodman,recruiter,2022-06-23 00:44:40,accountancy,indeed.nl,False
c34ac087f5a03681,Financial Analyst,2022-05-24,Leiden,804.0,"General ledger accounting activity (accruals check, cost center accounting, clearing management accounts, revaluation, etc.).
Key partner in alignment projects.",[],master,https://www.indeed.nl/rc/clk?jk=c34ac087f5a03681&fccid=a4cdd50aa5b677cb&vjs=3,SIRE® Life Sciences,recruiter,2022-06-23 00:44:40,accountancy,indeed.nl,True
c378b91570f0acfe,"Product Controller FX, Rates & XVA (08)",2022-06-21,Utrecht,3.0,"You have a good understanding of financial products and financial accounting of a Wholesale bank;
You will gain experience in areas such as income analysis, as…",[],master,https://www.indeed.nl/rc/clk?jk=c378b91570f0acfe&fccid=2076819322388f4b&vjs=3,itprojects,recruiter,2022-06-23 00:44:40,accountancy,indeed.nl,True
c3cc2b21b711ace1,Ervaren RA Accountant Controlepraktijk,2022-05-28,Thuiswerken in Bilthoven,835.0,"Van controlerend accountants tot all-round fiscalisten en salarisexperts.
Je bent (bijna) klaar met je post-master.
Tot wel 30 vakantiedagen per jaar.","[6281, 8420]",master,https://www.indeed.nl/rc/clk?jk=c3cc2b21b711ace1&fccid=3f646f570bd24702&vjs=3,Brown & McCrow,recruiter,2022-06-23 00:46:12,RA,indeed.nl,False
c44157934f3666bf,Senior dossierbeheerder (M/V),2022-05-24,Postcode 3910 in Rhenen,153.0,Je beschikt over een diploma Bachelor Accountancy-Fiscaliteit of master economische wetenschappen (accountancy/fiscaliteit).,[],master,https://www.indeed.nl/rc/clk?jk=c44157934f3666bf&fccid=c3eb1dcbf7ca60fd&vjs=3,De Graef-Linsen & Co,employer,2022-06-23 00:43:37,accountancy,indeed.nl,True
c526d397bcca2863,Innovatie Partner,2022-05-24,Eindhoven,5.0,Dit data science platform is nu gereed om onze multidisciplinaire dienstverlening optimaal te laten ondersteunen met de kracht van business intelligence.,[],master,https://www.indeed.nl/rc/clk?jk=c526d397bcca2863&fccid=994b5c764776123e&vjs=3,Crowe Foederer,employer,2022-06-23 00:43:37,accountancy,indeed.nl,True
c539e1efa6c5a5be,Group Business Controller,2022-05-24,Rijswijk,630.0,"You are “data minded” and able to provide deep insights and fact-based analysis.
Furthermore, you will work on the data structure and its quality, supporting…",[],master,https://www.indeed.nl/rc/clk?jk=c539e1efa6c5a5be&fccid=39807a905ef077f7&vjs=3,"Kiwa N.V. Rijswijk, Zuid-Holland",employer,2022-06-23 00:43:37,accountancy,indeed.nl,True
c6452e50a977ab61,Gevorderd Assistent Accountant,2022-05-24,Hilversum,22.0,"MBO-BA niveau 4, MBA en in ver gevorderd stadium van SPD-studie houdt vakkennis bij.
De werkzaamheden van de Gevorderd Assistent richten zich voornamelijk op…",[],master,https://www.indeed.nl/rc/clk?jk=c6452e50a977ab61&fccid=81cf2abaecbb28aa&vjs=3,Libra recruitment,recruiter,2022-06-23 00:40:55,accountant,indeed.nl,True
c6519bc1b26290ed,Senior Auditor met subsidie kennis,2022-06-22,Zuid-Holland,,"Je hebt kennis van de planning- en controlcyclus bij de overheid;
Je hebt kennis van auditprincipes, onderzoeksmethoden en -technieken en vaardigheid in het…",[],master,https://www.indeed.nl/rc/clk?jk=c6519bc1b26290ed&fccid=49fc9e68705def8f&vjs=3,RA'Quel,employer,2022-06-23 00:39:13,auditor,indeed.nl,True
c6ecd64e7899dbe5,Junior Belastingadviseur,2022-05-24,Goes,75.0,Dit doe je door het verrichten van ondersteunende werkzaamheden ten behoeve van de Belastingadviseur of (Senior) Specialist.,[],master,https://www.indeed.nl/rc/clk?jk=c6ecd64e7899dbe5&fccid=6fee09563e2b86ed&vjs=3,Accon avm,recruiter,2022-06-23 00:44:40,accountancy,indeed.nl,False
c839b99a4b3f76e6,Financial Controller,2022-05-24,Hybride werken in Amsterdam+1 plaats,2.0,"You will prepare the Group Entities monthly report in the Netherlands under the Dutch GAAP & IFRS regulations.
Monitoring budget deviations on a monthly basis.",[],master,https://www.indeed.nl/pagead/clk?mo=r&ad=-6NYlbfkN0BQx9zSiyEqaPFd55WgSbrogcybLLMOvaJifgHohN9UOu-j8LwobT3yyBmzLVZK-56YuYRsmWuahlmUqmxnVmVEEa81yp_JBACjq7ClCWBC0b7X-y_DIlMtAr0DCZa_4NITrNCl0mIBVlRcxLN0CtE_ZuTCORT4laDlfnU_E60czWDwOr4E3h-6vHWT9qkHZoN1kVhBMeqYHZrvdaWk6z5svXxrJAyswrgIMmaXIXXRZq5VF9-e_WpVkGl0nslzwyMy2fAgbjfR5WwvjnCKPqqHHtLUJ350urzk0sVRLi7Pu_JQpHnH6f4K3mkq8MBCbnkcd0wFKTSWjgGgXXEH-YztLfd7JafF8hZGDBrEQ2Kk36NN8FIZlWVPid6I1iYWojcBIhEF15ArlVyVNezvWok7R2OE-lYst--xA0ZniM9kywStdQ5TTiLdGXNt0NAb9keairzCOI2ehvAMWzvVJE-fmCh8M0CiFhZoSIVZmwatitnZyT6KxTB5lfLWIaFr4DmU0QFsH2BIh2WEbQZNuZAiAHN_Vw036NsqvVp8UPVa2aYtRvDHU2VIGP0UCAlwNTATwsf_t9puWpQVU7TyaLYfBVUfIpWR1TMTyZOM0Uso03N3yqL15HlsWL7lXGKMK_9VBX4yv7C462qE7GGyLnz2&xkcb=SoBd-_M3cG65-lR9Bh0LbzkdCdPP&p=4&fvj=1&vjs=3,Michael Page,recruiter,2022-06-23 00:44:40,accountancy,indeed.nl,True
c879d26eb3b79291,Security Auditor | Schipholrijk,2022-05-24,Noord-Holland,,"De organisatie kenmerkt zich door het grote aantal ervaringsjaren van de medewerkers van minimaal 10 jaar en meer.
Salaris tot 60K per jaar;",[60000],master,https://www.indeed.nl/rc/clk?jk=c879d26eb3b79291&fccid=dec865029797a382&vjs=3,Layer,employer,2022-06-23 00:45:45,RA,indeed.nl,True
c8ad73163aee5e23,COSI Financial Analyst,2022-05-24,Haarlem,10.0,"Experience in an analytical role or cost accounting is a plus;
Analyze standard revision on a global level by branch and ensure appropriate accounting is…",[],master,https://www.indeed.nl/rc/clk?jk=c8ad73163aee5e23&fccid=3c0bf511b4a29309&vjs=3,MSD,employer,2022-06-23 00:43:37,accountancy,indeed.nl,True
c8dced7da38bcfd4,Accounting Specialist,2022-06-02,Amsterdam+1 plaats,2.0,"Ensure that all accounting entries are accurate, and maintain daily accounting documentation and data.
Follow internal accounting procedures and maintain…",[],master,https://www.indeed.nl/pagead/clk?mo=r&ad=-6NYlbfkN0AxPpcv3JQOt1tRKBsCSgebWM31D8MZZpcBuYyVtZ2j7Trog1g4q_hKbzGGI07M-4NbmZkhfYHFu_C_-VmOC0xCsf4rZx6O9pAm0nOqkKDWiYEBn9TX-hnnXXYM6RdtHksETBbBAKjL_1WIIdyPEL439whKP-HqPTtprI6c1QnFWEXNQKWhypWdZnSRu0IiEEM3zLAp22Y2e56TlNvuhqyhRuoUTkQEmdzh8a3O5awalaszyt3fQfp6tu-Br8vWTx7ir1DSZfMjECxgsEZS7JBDNtQuVYtTQeDzM0rx-2IESecsD-RToJEsU4PoKFYzTuug6gMPTVvjZsv3uJDsQkBGbpuu91_gQk8i9jPYdRTY0Oj4mA3erTQUgbrmSH4sARfjm0oiwym4zpzpYd94W6gNFFxP3OF7LFcgudLbir7jSY0PadWInRq7IjPug4Tbc8xnyA2wIiLFSOz8MpbP6OvxhQH_TSmo2xaMd7mTfgE8x3oJIE2BPOQ_Ao5cSmCTm3wOPB9wfscvNUbi6l0tI6zCBR_FJKogfbZxq-yRm7ZJFg==&xkcb=SoAv-_M3cG6gWHen6p0KbzkdCdPP&p=1&fvj=0&vjs=3,Robert Half,recruiter,2022-06-23 00:44:40,accountancy,indeed.nl,False
c944c0834acbd170,"Senior Consultant, VAT Consultancy and Recovery",2022-05-24,Amsterdam,2.0,"Master’s degree in Taxation, Finance, Economy, Law, Management, Accounting, or related field required with 3-year experience minimum in the VAT field or…",[],master,https://www.indeed.nl/rc/clk?jk=c944c0834acbd170&fccid=9e9202ec0ba64559&vjs=3,"Ryan, LLC",employer,2022-06-23 00:43:37,accountancy,indeed.nl,False
c95f60c72a87ef68,Belastingadviseur,2022-06-23,Thuiswerken in Postcode 1018 in Amsterdam Centrum,2.0,"*Je krijgt zelfs de unieke mogelijkheid om eigenaar van onze organisatie te worden.*.
*Je kunt rekenen op goede faciliteiten om thuiswerken mogelijk te maken.*.",[4500],master,https://www.indeed.nl/company/Practical-Accounting/jobs/Belastingadviseur-c95f60c72a87ef68?fccid=8486f9ac3ce64f01&vjs=3,Practical Accounting,employer,2022-06-23 00:43:37,accountancy,indeed.nl,True
c9f7329614c473ad,Senior Accountant,2022-05-24,Nieuw-Vennep,,"Lead a small accounting team in ensuring the complete and accurate accounting flow of our day to day operations.
Master’s degree in Accounting or Finance.",[],master,https://www.indeed.nl/rc/clk?jk=c9f7329614c473ad&fccid=45760e614a6eb614&vjs=3,Frendz Finance,recruiter,2022-06-23 00:44:40,accountancy,indeed.nl,True
ca1bae882ac0ac2c,Junior Business Controller,2022-06-15,Rotterdam,4.0,"Manage the ‘day to day’ accounting in line with the company’s accounting framework for designated area’s.
Implement and maintain applicable accounting, legal…",[],master,https://www.indeed.nl/rc/clk?jk=ca1bae882ac0ac2c&fccid=8d8b6a84b45b5326&vjs=3,Smit Lamnalco,employer,2022-06-23 00:43:37,accountancy,indeed.nl,False
ca6de96da88209eb,IT- Auditor,2022-05-24,Postcode 5653 in Eindhoven,5.0,"Bereid om een post-master in IT-auditing te volgen.
In het bezit van 0-5 jaar werkervaring.
Met een varierend klantenbestand zal geen dag hetzelfde zijn!",[3400],master,https://www.indeed.nl/rc/clk?jk=ca6de96da88209eb&fccid=766625bc6522eb8c&vjs=3,Tempo-Team,recruiter,2022-06-23 00:44:40,accountancy,indeed.nl,True
ca84a5238e8b89eb,Group Controller,2022-06-16,Beek en Donk,139.0,Vanwege de verdere internationale groeiambities zijn wij nu voor hen op zoek naar een kandidaat voor de functie van *Group Controller*.,[],master,https://www.indeed.nl/company/Kendem-Staffing/jobs/Group-Controller-ca84a5238e8b89eb?fccid=dceb6f5e264ec639&vjs=3,Kendem,recruiter,2022-06-23 00:46:12,RA,indeed.nl,False
ca9f9f2bda9ef30b,Controller FMCG,2022-06-10,Utrecht,3.0,"P&L and balance sheet analysis and reporting.
Preparation of monthly memo journal entries.
Assuring reconciliation of specific GL.
MBA or CPA (RA) a plus.",[],master,https://www.indeed.nl/pagead/clk?mo=r&ad=-6NYlbfkN0Bgwjl9sSaTAhvoInkKYHNrP-tt0Ma8h62cNgPWax2iSnVYSapmWLZslXFr8TcTgPNAtk8hw2nxjV70L9Nfz8iCGdrYIMWa5a4EXmm6c6SuHk0CEMuD1OgNZ4mJXMLjRx0ITA4tDDwgq2rH4gpOePFXEb5uDszwBffFgrosFgj0Bz47XDKgl2gwrievTl0-fEr8BlcyoNvupuO7R65oobgczky67XKDzvgHANqzGh2ATzTKo9xy6EVU1F8sV4GQY_vVqiF-QERh4osEg4dghh-XsWedhol81DzY8Pyn6rGhXdXOjJWThEe03u_kyuJHy2trMiYc37yi5MmOJ59ve_jJaJSkUjuAGOQAG4RgEKCpe0AGAeb3Bf75z5W0tUC9NKTHHL0CdEJObr379w9T5SlIkk_QTMu7rTLDhMVLqYhuqsrFV2QYAVzkxJOM7ywVV0STvOI4wvhYZJfpwqDIFMx9XYPL9ajLbUtF7Yh9054xpeXQym1SJDaBWkEhQUA2xkrMAmseK6bGVPMl-sPvBSSf6jA4s4vPrN1zQed0oBtxvdI7W3E-rw7j2l9qIiw9bCUxWSM7UbrI6u5G_ey_npkN3gae84_B2E35oPQDIE_yYX8NyQJCr-8VBan8c0sUxN66PRxouhkpygqX-IGes0yWPrFOVYYldqs=&xkcb=SoBO-_M3cG6468fTaZ0IbzkdCdPP&p=14&fvj=0&vjs=3,Career Control,employer,2022-06-23 00:44:59,CPA,indeed.nl,True
cac78d28e44eccb3,Product Manager TA Data Processing,2022-05-24,Thuiswerken in Hoevelaken,292.0,"Basecone is a Wolters Kluwer Tax & Accounting Europe product, setup to automate manual accounting tasks like data collection and data entry.",[],master,https://www.indeed.nl/rc/clk?jk=cac78d28e44eccb3&fccid=f46e2fd6ab3f5a72&vjs=3,Wolters Kluwer,recruiter,2022-06-23 00:44:40,accountancy,indeed.nl,False
cb1ef6b75373cfd8,Relatiebeheerder Administratiekantoor,2022-05-24,Wassenaar,118.0,Hierbij kan je denken aan het automatiseren van verschillende administratieve processen tot het inrichten van live digitale cockpits.,"[39000, 58500]",master,https://www.indeed.nl/rc/clk?jk=cb1ef6b75373cfd8&fccid=3f646f570bd24702&vjs=3,Brown & McCrow,recruiter,2022-06-23 00:44:40,accountancy,indeed.nl,True
cb43da7dc398850b,Finance Director,2022-05-24,Hengelo OV,293.0,Als Finance Director bij OPRA Turbines in Hengelo vergroot jij OPRA’s impact op de wereldwijde energietransitie door de internationale financiën optimaal te…,[],master,https://www.indeed.nl/rc/clk?jk=cb43da7dc398850b&fccid=9c95a5f2e38bc563&vjs=3,Siebert & Wassink,recruiter,2022-06-23 00:44:40,accountancy,indeed.nl,False
