job_id,job_title,job_date,job_loc,job_city,job_lng,job_lat,job_summary,salary,job_url,company_name,company_type,search_time,search_position,source,search_qualified
763ed7806c50f0a3,Communicatieadviseur,2022-04-06,Thuiswerken in Postcode 3527 in Utrecht Zuidwest,Utrecht,5.1222,52.0908,"Jij bent hét aanspreekpunt voor communicatie, zowel intern als extern.
Jij ontwikkelt (marketing)communicatieplannen en voert deze ook uit.",['4.391'],https://www.indeed.nl/company/NIAZ/jobs/Communicatieadviseur-763ed7806c50f0a3?fccid=2d2e3b2100465146&vjs=3,Qualicor Europe,employer,2022-10-06 01:01:30,auditor,indeed.nl,True
7695f6dc42b29d6c,Auditor,2022-11-05,Hoofddorp,Hoofddorp,4.6667,52.3,"Als gedreven auditor voer je operational- lT audits uit.
Werken als auditor bij Holland Casino biedt je net dat extra’s.","['3.125', '5.725']",https://www.indeed.nl/rc/clk?jk=7695f6dc42b29d6c&fccid=76e88ca76caa9b7c&vjs=3,Holland Casino,employer,2022-10-06 01:01:30,auditor,indeed.nl,True
773ab1e51d0fe43c,Finance Supervisor,2022-11-05,Schiedam,Schiedam,4.3889,51.9192,"+ Provide audit package and liaise with external auditors.
+ Actively manages a multi-disciplinary team with a particular focus on training, coaching / guiding,…",,https://www.indeed.nl/rc/clk?jk=773ab1e51d0fe43c&fccid=a9a5024d4b747148&vjs=3,SBM Offshore,employer,2022-10-06 01:01:30,auditor,indeed.nl,True
777d31b7699eb4f1,Assistent Accountant Audit,2022-11-05,Amsterdam,Amsterdam,4.8833,52.3667,"Je kan op verschillende niveaus instappen van Trainee tot Manager.
Opleiding: RA, BA of Bachelor/Master Accountancy.",,https://www.indeed.nl/pagead/clk?mo=r&ad=-6NYlbfkN0D8arYy_jSNWf1a2GtUvhh50zguO0ADH0iOKSv03bf1mL5-up5v9NkzwgSkdJz2V35qVTMFyw_jzuFp5AJ1BPQLhl-U5BzpzKRoameomLVurnbo0yxaDQUuullIkM0VFA9tcYs6_Dq9DxHoyMCK7PTFFHvySzviMMW3KxaRsdIGt7TLyVasqJ6QKyQNiBY1JK53KAvJrXiia5bf-yT5A-k97mbCfmN_VNE4xTP88bJD8NDa12aXsSRddDlgB0uQV9b0z41zC4P7Nl6kbcwQ4rfZGUHwR82Zz0_50nOew6XY9fkRwcXj_mquyOyWKhdqSUrk5F6I-1J6svbJQmx2Hj3DMt_lgEFL-rUCQyHlQleQKF3b--P4VwISGqY4zmXHbFcNh5LAQbC-QIhbjqvDZuDq5_HjHtTK37DwsC-5m5vPXso_t_KVpBmevxtUsR6RVRG4iJubZFam0Sanpgwb4Z6y51uhYZ9U40SCK4iG7VwIvOcjjlg4J0h4T2_COPgcR3IRTBuO_MoKqfhOVBEi5CIqZS6k53LLT1tMDLH4pp8dCPqCbebgFsQDdyI_q0gW7ROHCTWGEi5OgG0-CGqogIhRmmn4Nxgib8JqV2MqJIQiBpg7OrR6uq_g3J786zkxEwLPQZXmx1F5tgN1WTWtZo6io81DKnZ7BURQqfrG0GC-86ALvKiBccxzKeEACgCqknRFr6P9wS19lOr7y2kiJRlv&p=12&fvj=0&vjs=3,Five Finance Recruitment,recruiter,2022-10-06 01:02:30,auditor,indeed.nl,True
780d7a36262918e0,Junior financieel adviseur/junior controller,2022-11-05,Hoofddorp+1 plaats,Hoofddorp,4.6667,52.3,"Je beschikt over minimaal 2 jaar werkervaring in het financiële vak, bijvoorbeeld als controller of intern auditor.
Past je profiel bij deze functie?","['2.500', '3.300']",https://www.indeed.nl/rc/clk?jk=780d7a36262918e0&fccid=41a31edcec2bc740&vjs=3,Haute Equipe,employer,2022-10-06 01:01:30,auditor,indeed.nl,True
7964699564055e83,Test Lead Engineer,2022-11-05,Amersfoort,Amersfoort,5.3875,52.155,"Onze eigen productsuite alleen al bestaat uit zo’n 30 producten.
Voor onze software gelden uitgebreide certificeringsvereisten.",,https://www.indeed.nl/rc/clk?jk=7964699564055e83&fccid=c995ff9fe3bcd3d1&vjs=3,RVC BV,employer,2022-10-06 01:01:30,auditor,indeed.nl,True
79a9e98baddcc346,Supervisor Audit,2022-11-05,Zwolle,Zwolle,6.0944,52.5125,Als Supervisor Audit verricht je in samenwerking met de (junior) manager en/of partner uiteenlopende accountancywerkzaamheden.,,https://www.indeed.nl/rc/clk?jk=79a9e98baddcc346&fccid=2ee7f25022cf110d&vjs=3,Storm in Recruitment,recruiter,2022-10-06 01:02:30,auditor,indeed.nl,True
79aa661cb6c9bfc9,Product Assurance Engineer,2022-04-06,Hoogeveen,Hoogeveen,6.4667,52.7167,Act as business partner to the site/entity manufacturing process managers and leadership in assuring and improving the manufacturing processes and product…,,https://www.indeed.nl/rc/clk?jk=79aa661cb6c9bfc9&fccid=341f4eb8f06e8716&vjs=3,GKN Aerospace,employer,2022-10-06 01:01:30,auditor,indeed.nl,True
79b127538ed46336,QHSE Auditor,2022-01-06,Nederland,,,,"HBO / (Professionele) Bachelor's degree.
Als QHSE Auditor ben je verantwoordelijk voor de kwaliteit, veiligheid en milieu van de projecten van Strukton Power en…",,https://www.indeed.nl/rc/clk?jk=79b127538ed46336&fccid=3bd7ecf486b94c7b&vjs=3,Strukton,employer,2022-10-06 01:01:30,auditor,indeed.nl,True
79b6bec86a615da7,Lead Auditor - Toets Coördinator,2022-11-05,Postcode 6812 in Arnhem,Arnhem,5.9167,51.9833,Als Lead Auditor ben je verantwoordelijk voor het onafhankelijk en objectief uitvoeren van audits op het (project) kwaliteitsmanagementsysteem van…,['5.127'],https://www.indeed.nl/rc/clk?jk=79b6bec86a615da7&fccid=b80a004993258bdc&vjs=3,Alliander,employer,2022-10-06 01:01:30,auditor,indeed.nl,True
79cdf9e1d0b6339c,Financial Accountant EU,2022-11-05,Postcode 3433 in Nieuwegein,Nieuwegein,5.0919,52.0314,"As our Financial Accountant EU you are responsible for one or more legal entities in the Netherlands & Belgium.
Control of monthly payslips and payroll entries;",,https://www.indeed.nl/rc/clk?jk=79cdf9e1d0b6339c&fccid=788a7fd79eec1d60&vjs=3,Domino's Pizza Netherlands,employer,2022-10-06 01:01:30,auditor,indeed.nl,True
7ac5d81d5c214d9d,Internal Audit,2022-11-05,Postcode 7901 in Hoogeveen,Hoogeveen,6.4667,52.7167,"In deze uitdagende rol word je breed ingezet en krijg je veel ruimte om jezelf te ontplooien.
Als Internal Auditor voer je verschillende typen audits uit,…",,https://www.indeed.nl/rc/clk?jk=7ac5d81d5c214d9d&fccid=2c9f12b0a44bb9b7&vjs=3,TVM Verzekeringen,employer,2022-10-06 01:01:30,auditor,indeed.nl,True
7aeab3aba352be4f,Project Manager Domain Corporate Real Estate,2022-11-05,Veldhoven,Veldhoven,5.3992,51.4197,"Others e.g. safety boards, (local) legislations bodies, independent quality auditors, procurement and finance.",,https://www.indeed.nl/rc/clk?jk=7aeab3aba352be4f&fccid=57ed5f0210b0681a&vjs=3,ASML,employer,2022-10-06 01:01:30,auditor,indeed.nl,True
7bb35fa0512640fd,Senior Internal Auditor - Darling Ingredients,2022-05-27,Son,,,,"The Senior Internal Auditor will carry out audits through all phases of the audit process to include risk assessment, planning, fieldwork and reporting with the…",,https://www.indeed.nl/rc/clk?jk=7bb35fa0512640fd&fccid=eb19e66bb05cdcfc&vjs=3,Fellowfield,recruiter,2022-10-06 01:02:30,auditor,indeed.nl,True
7c55412065778161,Quality Engineer,2022-05-24,Venlo,Venlo,6.1681,51.37," Begeleiden en/of uitvoeren van metingen voor auditoren bij inspecties ( third party, approbaties, klanten ), met behulp van meetinstrumenten zoals diameter…",,https://www.indeed.nl/rc/clk?jk=7c55412065778161&fccid=f5ac2b279fb19ed7&vjs=3,Avance,recruiter,2022-10-06 01:02:30,auditor,indeed.nl,True
7c6d44d7bba930e7,Senior Financial Accountant with Ambition,2022-11-05,Amsterdam,Amsterdam,4.8833,52.3667,Manage and providing support during the yearly audit process; building a professional working relationship with the external auditors;,,https://www.indeed.nl/rc/clk?jk=7c6d44d7bba930e7&fccid=994b5c764776123e&vjs=3,Crowe Foederer,employer,2022-10-06 01:01:30,auditor,indeed.nl,True
7ce38c4d0039fc40,Senior Group Controller – DEPT Agency,2022-11-05,Rotterdam,Rotterdam,4.4792,51.9225,"In addition, you cooperate with their financial auditors/ advisors, monitor compliance reporting and perform consolidation software maintenance activities.",[],https://www.indeed.nl/rc/clk?jk=7ce38c4d0039fc40&fccid=5d1cd7991a8d6b8c&vjs=3,Greenberg Nielsen,recruiter,2022-10-06 01:02:30,auditor,indeed.nl,True
7d352e302afe2985,Accounting Supervisor,2022-11-05,Roermond,Roermond,5.9872,51.1933,"Assist in preparing audit work papers for year-end audits with external auditors;
Oversee all financial accounts (General Accounting, AP, AR and Fixed Assets),…",,https://www.indeed.nl/company/UPS/jobs/Accounting-Supervisor-7d352e302afe2985?fccid=fcf465e707df52fb&vjs=3,UPS Netherlands,employer,2022-10-06 01:01:30,auditor,indeed.nl,True
7db70a79bbd8d03b,Riskmanager,2022-11-05,Utrecht,Utrecht,5.1222,52.0908,De Riskmanager signaleert en analyseert de bedrijfsmatige risico’s voor het Openbaar Ministerie op het gebied van ICT en informatiesecurity.,,https://www.indeed.nl/rc/clk?jk=7db70a79bbd8d03b&fccid=013c610198b6bd84&vjs=3,"Ministerie van Justitie en Veiligheid, Openbaar...",employer,2022-10-06 01:01:30,auditor,indeed.nl,True
7dc9e2661f266f01,Quality Consultant,2022-11-05,Postcode 5667 in Geldrop,Geldrop,5.5578,51.4222,"Jij bent opgeleid tot intern auditor of bent bereid om deze opleiding te volgen.
Als kwaliteitsadviseur ben jij verantwoordelijk voor het verder ontwikkelen en…","['2.400', '4.500']",https://www.indeed.nl/rc/clk?jk=7dc9e2661f266f01&fccid=842ec1ced0fea1d5&vjs=3,Securitas,employer,2022-10-06 01:01:30,auditor,indeed.nl,True
7e3018acbc11fb23,Auditor,2022-11-05,Utrecht,Utrecht,5.1222,52.0908,"Voorbeelden van belangrijke processen waarbij het belangrijk is dat risico’s goed worden beheerst.
De verbeterpunten houd je bij en monitor je.","['2.811', '4.519']",https://www.indeed.nl/pagead/clk?mo=r&ad=-6NYlbfkN0BP4go0ig0pZwWajoZJbvxsmm1JF4vOTiD3exOKsqp1XCaW8XNPFElFj3glsl-rmBmyAgD9IkudS_kPOKU20l-i9XNDt8ju-MflojiG6oi_j29hlJ7CJ-BzvY8E0Kux6s3k-D8ZKKvG0x1-Tiu11wnVduhVY6SqjzvzCNjEv2OgP-JhPHfQK5wU_m9KBoRCSiFneZbilupSibtE8ge7sVs5EoyTVYN5c4IBGJ_vEy0-1kwuBGZJ2VLJ2WRjitS4YY2IAU2murXTibEFXe_Nf5jpEH9XeHc2v2VOQBCvGUlrY0r3YeXdKB5nXHnC_IV6_8MPCLkSkX5sjcx_OZbIOo04ircmRF_3qn4J5oPXAq4HoNVs-OOJ5Zu9wv286OMhRbYEC9hYFDXzGOCQfkkZroMc5lgtp-ST0Mihgb3XCqzA68ndfZgM1aYmw1pqVU4i3Gnd1IBtbvmbCH6vhQSVRIhK3EpfIkIKxiCWRmiwaUdMktLe8bPABNh4Pd0C7Q6yZj-XfVzY2vjGjnMNsgrLLUhIbL-lgIQF6V6_WdAMtJwo4RGhlI-sRUXx1wB9vlSH3Wk=&p=0&fvj=0&vjs=3,belastingdienst,employer,2022-10-06 01:01:30,auditor,indeed.nl,True
7ec197d10df66f96,Vacature Lead Auditor ISO9001,2022-11-05,Amersfoort,Amersfoort,5.3875,52.155,"Lead auditor ISO9001 / 27001 certificaat en ervaring als Leadauditor of als contractadviseur;
Wij zijn specialist in het implementeren van ons 3D Model in…",,https://www.indeed.nl/rc/clk?jk=7ec197d10df66f96&fccid=2e729eda87972526&vjs=3,PROMA CONSULTING,employer,2022-10-06 01:01:30,auditor,indeed.nl,True
7f0ac463de1dcd0d,Controleleider,2022-11-05,Amersfoort+1 plaats,Amersfoort,5.3875,52.155,"Zelfstandig en vrijheid vindt je prettig ;
In het bezit van een RA-titel of bezig met de afronding van het RA-traject.",,https://www.indeed.nl/rc/clk?jk=7f0ac463de1dcd0d&fccid=5a5975b9a2989351&vjs=3,We Matter,recruiter,2022-10-06 01:02:30,auditor,indeed.nl,True
80342f5ff1d43e80,Financial Controller,2022-11-05,Thuiswerken,,,,"Prepare supporting information for the annual audit and liaise with the Board's Audit Committee and external auditors.
Run all Debtor and Creditor management.",,https://www.indeed.nl/rc/clk?jk=80342f5ff1d43e80&fccid=cf6004f73ebbb362&vjs=3,Omnia Retail,employer,2022-10-06 01:01:30,auditor,indeed.nl,True
804ff3b7c6904d06,Data Analyst / IT Auditor,2022-11-05,Amersfoort,Amersfoort,5.3875,52.155,"2 to 5 years of experience as IT Auditor at BIG-4 or Internal Audit experience, with affinity for Data Analytics;",,https://www.indeed.nl/rc/clk?jk=804ff3b7c6904d06&fccid=bb9c97a740367a36&vjs=3,FrieslandCampina,employer,2022-10-06 01:01:30,auditor,indeed.nl,True
80b96f7d3aca6110,Finance Manager,2022-01-06,Thuiswerken in Amsterdam,Amsterdam,4.8833,52.3667,"Manage relationships with external auditors.
A charging point at every parking spot, an Electric Vehicle for every driver.",,https://www.indeed.nl/rc/clk?jk=80b96f7d3aca6110&fccid=6b656c4246c72ed9&vjs=3,EVBox,employer,2022-10-06 01:01:30,auditor,indeed.nl,True
80fe5ea06b3c6d13,Group Controller,2022-11-05,Rotterdam,Rotterdam,4.4792,51.9225,"In addition, you provide support in performing IFRS reviews and cooperate with our financial auditors/ advisors.
A laptop and a mobile phone;",,https://www.indeed.nl/rc/clk?jk=80fe5ea06b3c6d13&fccid=8b05e8367ae5814d&vjs=3,DEPT®,employer,2022-10-06 01:01:30,auditor,indeed.nl,True
81f4b3a96732a36a,Security Analyst (Remote),2022-11-05,Thuiswerken in Amsterdam,Amsterdam,4.8833,52.3667,"Act as a point of contact for security related queries from internal staff and auditors.
We are looking for a talented Security Analyst to play a key role in…",,https://www.indeed.nl/company/Currency/jobs/Security-Analyst-81f4b3a96732a36a?fccid=954a58734d9630f0&vjs=3,Currencycloud,employer,2022-10-06 01:01:30,auditor,indeed.nl,True
82056432dd5354ca,Sr Consultant IT Advisory Breda/Goes,2022-11-05,Breda+2 plaatsen,Breda,4.775,51.5875,"Bij een volledig dienstverband van 40 uur heb je recht op 32 verlofdagen per jaar.
Je kunt deelnemen aan onze leaseregeling of kunt kiezen voor een…",,https://www.indeed.nl/rc/clk?jk=82056432dd5354ca&fccid=1bfec2a2f61dd5c2&vjs=3,Baker Tilly,employer,2022-10-06 01:01:30,auditor,indeed.nl,True
8254a1483ababf4d,HSEQ-Engineer,2022-11-05,Postcode 2595 in Den Haag,Den Haag,4.2986,52.0767,"Participate in the audit schedule as a lead auditor with internal and external audits.
Developing, implementing and managing the integrated corporate management…",,https://www.indeed.nl/rc/clk?jk=8254a1483ababf4d&fccid=df4a7f98e9ea4172&vjs=3,van storm recruitment,recruiter,2022-10-06 01:02:30,auditor,indeed.nl,True
82eecd34474e50f1,Treasury Accountant,2022-11-05,Nieuw-Vennep,,,,"Liaises with external and internal auditors, provides inputs & explanations to auditor data requests.
Daily accounting: monitoring treasury bank transactions,…",[],https://www.indeed.nl/rc/clk?jk=82eecd34474e50f1&fccid=45760e614a6eb614&vjs=3,Frendz Finance,recruiter,2022-10-06 01:02:30,auditor,indeed.nl,True
835ded0f75e379d6,Supplier Quality Assurance Team Leader,2022-11-05,Postcode 6041 in Roermond,Roermond,5.9872,51.1933,"Certified IATF and / or VDA 6.3 and/or AIAG auditor.
Plant Supplier Quality is responsible for the external supplier (BOP - Bought out Part) management from…",,https://www.indeed.nl/rc/clk?jk=835ded0f75e379d6&fccid=be6df1e15053629d&vjs=3,Faurecia,employer,2022-10-06 01:01:30,auditor,indeed.nl,True
83ae635e8d491e16,Director of Finance,2022-11-05,Willemstad Curaçao,Willemstad,4.4378,51.6919,"Successful completion of all internal and external financial audits, including coordination of work with CPA firms and delivering information requested by…",,https://www.indeed.nl/rc/clk?jk=83ae635e8d491e16&fccid=8a2065d7355c3eb9&vjs=3,Courtyard by Marriott - Willemstad,employer,2022-10-06 01:01:30,auditor,indeed.nl,True
83b16dfab30f1af9,Gevorderd assistent accountant AUDIT,2022-11-05,Thuiswerken in Postcode 3241 in Middelharnis,Middelharnis,4.1647,51.7535,"Onder begeleiding van ervaren collega’s neem je enerzijds verantwoordelijkheid voor controleopdrachten (uitvoering, evaluatie en rapportage), maar ben je ook…",,https://www.indeed.nl/company/WEA-Deltaland/jobs/Gevorderd-Assistent-Accountant-Audit-83b16dfab30f1af9?fccid=48b1189818ea6336&vjs=3,WEA Deltaland,employer,2022-10-06 01:01:30,auditor,indeed.nl,True
84275ce2fda01150,IT General Controls SOx Specialist / IT Auditor,2022-05-25,Amsterdam,Amsterdam,4.8833,52.3667,"Red Carpet IT Services is voor een van haar eindklanten opzoek naar een IT General Controls Sox Specialist.
De afdeling bestaat uit 11 FTE welke ingevuld worden…",,https://www.indeed.nl/rc/clk?jk=84275ce2fda01150&fccid=3830be141e6a6124&vjs=3,Red Carpet IT Services,employer,2022-10-06 01:01:30,auditor,indeed.nl,True
84c3095b848d5b20,Senior Auditor,2022-11-05,Randstad,,,,"Onze klant is een gepassioneerde, deskundige dienstverlener op het gebied van interne audit, finance, risk management en reporting voor kleine en middelgrote…","['3.500', '4.000']",https://www.indeed.nl/rc/clk?jk=84c3095b848d5b20&fccid=86a55298a6d106a2&vjs=3,One Arrow,recruiter,2022-10-06 01:02:30,auditor,indeed.nl,True
84fd8422d618870a,Financieel Administratief Medewerker,2022-11-05,Nederland,,,,Het (geautomatiseerd) verwerken en controleren van door relaties van ons kantoor aangeleverde boekingsbescheiden.,,https://www.indeed.nl/rc/clk?jk=84fd8422d618870a&fccid=0f3abe8c101a5c3d&vjs=3,"du ROI Accountants, belastingadviseurs &...",employer,2022-10-06 01:01:30,auditor,indeed.nl,True
85146172212c1f7c,Senior Financial Risk Specialist - Asset Based Finance,2022-05-28,Amsterdam,Amsterdam,4.8833,52.3667,Wij zijn op zoek naar een senior financial risk specialist om ons Asset Based Finance (ABF) team te versterken.,,https://www.indeed.nl/rc/clk?jk=85146172212c1f7c&fccid=5b16841c3468a10d&vjs=3,ING,employer,2022-10-06 01:01:30,auditor,indeed.nl,True
8551e1d8fff44aff,(Senior) Accountant,2022-11-05,Amsterdam,Amsterdam,4.8833,52.3667,"You will be working in an international environment, collaborating with colleagues from various finance, tax & treasury departments as well as act as contact…",,https://www.indeed.nl/rc/clk?jk=8551e1d8fff44aff&fccid=a9a5024d4b747148&vjs=3,SBM Offshore,employer,2022-10-06 01:01:30,auditor,indeed.nl,True
86124c73579299ae,Financial Controller,2022-11-05,Oss,Oss,5.5181,51.765,"Je organiseert en communiceert, in samenspraak met de financiële afdeling en externe auditor van deadlines voor het opleveren van financiële en overige…",,https://www.indeed.nl/rc/clk?jk=86124c73579299ae&fccid=dc2a9f8c2c1b9b91&vjs=3,ScopeFinance,recruiter,2022-10-06 01:02:30,auditor,indeed.nl,True
865f93759400d4e4,Operational Due Diligence Analyst,2022-05-17,Rijswijk,Rijswijk,5.0236,51.7975,"Extensive experience within the financial industry gained in a previous operational due diligence role or as e.g., external/internal auditor, senior back/mid…",,https://www.indeed.nl/rc/clk?jk=865f93759400d4e4&fccid=167aa4ca2fe7d8e6&vjs=3,Shell,employer,2022-10-06 01:01:30,auditor,indeed.nl,True
866a2641d4f99ab6,Internal Auditor,2022-11-05,Delft,Delft,4.3594,52.0119,"As a member of a small team, you will prepare and execute financial and operational audits on processes, departments, entities and vessels on various topics…",,https://www.indeed.nl/rc/clk?jk=866a2641d4f99ab6&fccid=4752914412f4994a&vjs=3,Allseas,employer,2022-10-06 01:01:30,auditor,indeed.nl,True
873e8b368ac065f5,Senior Auditor,2022-11-05,Zeist,Zeist,5.2333,52.0833,"Ruime auditervaring als internal auditor of extern accountant bij een complexe organisatie.
Wat wij doen staat niet op zichzelf.","['4.528', '6.305']",https://www.indeed.nl/rc/clk?jk=873e8b368ac065f5&fccid=5669a89b3a19b7fa&vjs=3,Achmea,employer,2022-10-06 01:01:30,auditor,indeed.nl,True
877fff7ef5570ead,Internal Controls Analyst,2022-09-06,Amsterdam,Amsterdam,4.8833,52.3667,"Qualified accountant or internal auditor.
Work with the Internal Controls Manager to support the Group Internal Controls team on specific control projects as…",,https://www.indeed.nl/rc/clk?jk=877fff7ef5570ead&fccid=a3b91a176dda1eed&vjs=3,Astrum Search,employer,2022-10-06 01:01:30,auditor,indeed.nl,True
886f3502b614720f,Business Systems Developer,2022-11-05,Hoogeveen,Hoogeveen,6.4667,52.7167,"Liaising with external parties (e.g. consultants, software vendors, auditors etc.) where required.
You will be a trusted partner to the business in providing…",,https://www.indeed.nl/rc/clk?jk=886f3502b614720f&fccid=341f4eb8f06e8716&vjs=3,GKN Aerospace,employer,2022-10-06 01:01:30,auditor,indeed.nl,True
887cea0d931574ae,IT Auditor,2022-11-05,Boxmeer+1 plaats,Boxmeer,5.9444,51.6483,"Je hebt oog voor kwaliteit, efficiency en risico’s.
Je beoordeelt processen, verbetert deze en toetst, aan de frameworks.",,https://www.indeed.nl/rc/clk?jk=887cea0d931574ae&fccid=92847f2214ab6146&vjs=3,Bol,employer,2022-10-06 01:01:30,auditor,indeed.nl,True
892d4b2d79fc7d08,Compliance Manager - EMEA (License/Subscription Verification/Software/Asset),2022-05-18,Amsterdam,Amsterdam,4.8833,52.3667,"This experience can be demonstrated in many ways, for example practice of law as an attorney, or comparable experience as a professional auditor, or other…",,https://www.indeed.nl/rc/clk?jk=892d4b2d79fc7d08&fccid=efbcd81edb5391a5&vjs=3,SUSE,employer,2022-10-06 01:01:30,auditor,indeed.nl,True
8935d60e71780e50,Principal Planner,2022-11-05,Den Haag,Den Haag,4.2986,52.0767,"Support auditors during Internal and External audits.
The Senior Planner will abide and perform planning responsibilities in line with organizational procedures…",,https://www.indeed.nl/rc/clk?jk=8935d60e71780e50&fccid=58d2ae3bd9faa0c5&vjs=3,McDermott,employer,2022-10-06 01:01:30,auditor,indeed.nl,True
89563e381f08c74b,Compliance Model Validator,2022-11-05,Postcode 3521 in Utrecht,Utrecht,5.1222,52.0908,As a Compliance Model Validator you perform oversight on the models that Rabobank uses to protect itself and society against compliance risks such as money…,,https://www.indeed.nl/rc/clk?jk=89563e381f08c74b&fccid=db0b8cca1616eafb&vjs=3,Rabobank,employer,2022-10-06 01:01:30,auditor,indeed.nl,True
89c213a47cc45d3c,Accounting Officer,2022-11-05,Postcode 1043 in Amsterdam Westpoort,Amsterdam,4.8833,52.3667,"You will assist auditors in case of audits performed on client companies.
Working with our Governance Services, you will work with multinationals, corporates…",,https://www.indeed.nl/rc/clk?jk=89c213a47cc45d3c&fccid=58a0b6e7b7d51d7e&vjs=3,Citco,employer,2022-10-06 01:01:30,auditor,indeed.nl,True
89dbac1854f3f9ca,Internal Controls Specialist,2022-11-05,Zwolle,Zwolle,6.0944,52.5125,"In this position, you are responsible for be supporting process owners within Finance to maintain and in some cases (re)design the internal control framework…",,https://www.indeed.nl/rc/clk?jk=89dbac1854f3f9ca&fccid=a3b51ece17c02aae&vjs=3,Abbvie,employer,2022-10-06 01:01:30,auditor,indeed.nl,True
8a097c899d064572,Interim controleleider,2022-11-05,Alphen aan den Rijn,Alphen aan den Rijn,4.65,52.1333,"Signaleren van risico’s én kansen met betrekking tot IT en het sparren daarover met de IT-auditor;
Het van A tot Z leiden van financial statement audits in het …",[],https://www.indeed.nl/rc/clk?jk=8a097c899d064572&fccid=79cd219281f38c26&vjs=3,WeCruite,recruiter,2022-10-06 01:02:30,auditor,indeed.nl,True
8a14b4fa71df29f2,Manager Controller,2022-11-05,Rotterdam+2 plaatsen,Rotterdam,4.4792,51.9225,"Vaktechnische bagage en ervaring in de rol van Financial Controller of als auditor.
De klant opdrachten waar wij Financial Controlling leveren zien toe op het…",,https://www.indeed.nl/rc/clk?jk=8a14b4fa71df29f2&fccid=cf80abde47d3bd81&vjs=3,Mazars,employer,2022-10-06 01:01:30,auditor,indeed.nl,True
8a31913fcf4cb2e4,MPS-ECAS Manager Auditing,2022-11-05,Postcode 2678 in De Lier,,,,"Tevens ondersteun je teamleden bij het vaststellen van hun doelen en bij de aanpak om ze te behalen.
Coachen van je teamleden op hun technische en soft skills…",,https://www.indeed.nl/rc/clk?jk=8a31913fcf4cb2e4&fccid=af836096b4edf459&vjs=3,Stichting MPS,employer,2022-10-06 01:01:30,auditor,indeed.nl,True
8a349b4cafa5d650,Operationeel auditor,2022-10-06,Postcode 5281 in Boxtel,Boxtel,5.3275,51.5911,"Vion’s Internal Audit department (5 FTE’s) provides integrated assurances for the business.
By performing audits and business reviews, internal audit…",,https://www.indeed.nl/rc/clk?jk=8a349b4cafa5d650&fccid=80532d4656a5ccab&vjs=3,Vion Foodgroup,employer,2022-10-06 01:01:30,auditor,indeed.nl,True
8a6d1ee6aeeaafe8,Financial Auditor,2022-05-30,Limburg+1 plaats,,,,"Van best practices, templates, standaard adviesrapportages e.d.
De geconstateerde bevindingen en aanbevelingen uit interne controles;",,https://www.indeed.nl/rc/clk?jk=8a6d1ee6aeeaafe8&fccid=49fc9e68705def8f&vjs=3,RA'Quel,employer,2022-10-06 01:01:30,auditor,indeed.nl,True
8a9c3fcbfdf70125,Global Compliance Monitoring Officer,2022-11-05,Postcode 3521 in Utrecht,Utrecht,5.1222,52.0908,"Een buitenkans voor een ambitieuze Compliance Officer die gelooft in de kracht van data.
Je verdient een goed salaris vanaf €4750,- bruto per maand (o.b.v 36…",['4.750'],https://www.indeed.nl/rc/clk?jk=8a9c3fcbfdf70125&fccid=156a45cd64fe6790&vjs=3,Carrierecafe,recruiter,2022-10-06 01:02:30,auditor,indeed.nl,True
8aa55faf24e7a432,Software Developer,2022-11-05,Postcode 6717 in Ede,Ede,5.6667,52.0436,"Je stempel drukken op een jonge, groeiende organisatie.
Informatiebeveiliging, certificering en compliancy worden vaak gezien als tijdrovend en complex.",,https://www.indeed.nl/rc/clk?jk=8aa55faf24e7a432&fccid=b094d1570d130219&vjs=3,Meridion,employer,2022-10-06 01:01:30,auditor,indeed.nl,True
8c14524e826470f2,Night Auditor,2022-09-06,Postcode 6221 in Maastricht,Maastricht,5.6889,50.8483,In deze functie ben je verantwoordelijk voor het uitvoeren van de night audit werkzaamheden en receptietaken gedurende de nacht.,,https://www.indeed.nl/company/Crowne-plaza-Maastricht/jobs/Night-Auditor-8c14524e826470f2?fccid=e3ba385a6d917a2e&vjs=3,Crowne Plaza Maastricht,employer,2022-10-06 01:01:30,auditor,indeed.nl,True
8c5a2f679786f7a7,Internship Income Auditor,2022-11-05,Postcode 1017 in Amsterdam Centrum,Amsterdam,4.8833,52.3667,"Communicate discrepancies with income auditor and the responsible employees;
You will check the reports of internal departments and employees regarding the…",,https://www.indeed.nl/rc/clk?jk=8c5a2f679786f7a7&fccid=63ecbb60dd50c636&vjs=3,Hard Rock Hotel Amsterdam American,employer,2022-10-06 01:01:30,auditor,indeed.nl,True
8ca5d8ce66467293,Toetscoördinator / Projectleider SCB,2022-11-05,Amersfoort,Amersfoort,5.3875,52.155,"Opstellen van een toetsplan, het coördineren van de toetsen en het evalueren van de toetsresultaten;
Met de contractmanager afstemmen van de toetsresultaten en…",,https://www.indeed.nl/rc/clk?jk=8ca5d8ce66467293&fccid=260f71831c1bd09f&vjs=3,Royal HaskoningDHV,employer,2022-10-06 01:01:30,auditor,indeed.nl,True
8cafb1abccfe06bc,Business Controller,2022-05-18,Rotterdam,Rotterdam,4.4792,51.9225,"Manage statutory accounts (with support of internal/external auditors) and all related tax-filings.
Manage the ‘day to day’ accounting in line with the company…",,https://www.indeed.nl/rc/clk?jk=8cafb1abccfe06bc&fccid=8d8b6a84b45b5326&vjs=3,Smit Lamnalco,employer,2022-10-06 01:01:30,auditor,indeed.nl,True
