job_id,job_title,job_date,job_loc,city_id,job_summary,job_salary,job_education,job_url,company_name,company_type,search_time,search_position,source,search_qualified
0031e33b6d7d2877,Business Controller,2022-05-24,Postcode 5211 in Den Bosch,14.0,"As Business Controller in this position, you focus on our sourcing department, however you will develop a broad view of the business.",[],master,https://www.indeed.nl/rc/clk?jk=0031e33b6d7d2877&fccid=a125e42080372f4c&vjs=3,BrandLoyalty,employer,2022-06-23 00:43:37,accountancy,indeed.nl,True
0050aa937f8a35f3,Subcontractor Verifier,2022-05-24,Rotterdam,4.0,"Position Type:Contractor On Demand.
U bent verantwoordelijk voor de planning en uitvoering van verificaties van de broeikasgasemissies bij onze klanten, evenals…",[],master,https://www.indeed.nl/rc/clk?jk=0050aa937f8a35f3&fccid=51e6d37e31a6306f&vjs=3,Lloyd's Register Group,employer,2022-06-23 00:39:13,auditor,indeed.nl,False
00dbfe0d00c8a097,Business Controller,2022-05-24,Postcode 2964 in Groot-Ammers,650.0,"Je bent verantwoordelijk voor de regio’s midden en noord.
Je draagt bij aan de transitie van administratie naar regio control.",[],master,https://www.indeed.nl/rc/clk?jk=00dbfe0d00c8a097&fccid=b276dfdf5b2d0aae&vjs=3,Mourik Industry,employer,2022-06-23 00:45:45,RA,indeed.nl,True
013ac2bf6f7f6fb4,Credit Model Strategist,2022-06-22,Thuiswerken in Postcode 3521 in Utrecht,3.0,"Manage stakeholders like regulators and auditors.
Help coordinate the bank’s efforts surrounding the credit models, reporting to auditor and regulators.",[],master,https://www.indeed.nl/rc/clk?jk=013ac2bf6f7f6fb4&fccid=db0b8cca1616eafb&vjs=3,Rabobank,employer,2022-06-23 00:39:13,auditor,indeed.nl,True
01418fd11e2ab279,"Intern Farmakunde, Science Business & Management - Quality Management System",2022-05-24,Boxmeer,102.0,"Providing supporting materials regarding PV activities.
The improvement of the existing QMS.
High level knowledge on veterinary Good Distribution Practices (GDP…",[],master,https://www.indeed.nl/rc/clk?jk=01418fd11e2ab279&fccid=3c0bf511b4a29309&vjs=3,MSD,employer,2022-06-23 00:45:45,RA,indeed.nl,False
017be7eea0ced61c,Assistent Accountant RA,2022-05-24,Thuiswerken in Amsterdam+3 plaatsen,2.0,"Bij onze klant draait het om mensen.
Onze klant biedt een professionele werkomgeving, waarin je kennis en vaardigheden verder ontwikkeld worden.","[2800, 3500]",master,https://www.indeed.nl/pagead/clk?mo=r&ad=-6NYlbfkN0B4z9ZEUK6GFTQMxINYuMRVcJcKjmC0L4dY-ryV_BXJSTkbORYn-frE4Hoi1I_GTmQAKAvB1KNN8Mrvga6wf0ujl7FN_0h0GAf1ZXnBRprZtE2QAuTOGsJv9oukI1jPoOhW9rBbERoB7wW_gz07yUQrDds97FxTm1FXXKXQCfk0l54GPPoo-YIimEoV1bDChJyHaYu0rV0PbeCIQ-dRmXmZStk9HEdJHvupJFehHBkxu5qhvnDQ1KAyxihCT6Kpxt-uIKF1upo6LqHOCwr_RsdPtSDHpn9yR-1Gi84BXcjHdz13aRFn7YZKHNKtUvXjFthUAFsjc3pyesk1d0r_1kuxzV-T6SLzPWWCKslyCGVryEoPVBZ0f9cY-i8DInaq5EIIDtvd2yGlSKsfMiGzWb3g4TxUXMzsgNf3wzUXya34V7f6ZfqIUMzmLnOLSrzkj-Zvj5246lfK-BW6oMgsi6W3UWWJAoE0VhE=&xkcb=SoC--_M3cG6w-fepip0LbzkdCdPP&p=0&fvj=1&vjs=3,Trig-R,recruiter,2022-06-23 00:46:12,RA,indeed.nl,True
022aa65b28ff04e4,Junior Consultant Corporate Finance,2022-05-24,Breda,8.0,"Als Junior Corporate Finance Adviseur houd je je bezig met strategische vraagstukken, waardebepalingen, overnamebegeleiding, financierings- en…","[2500, 3000]",master,https://www.indeed.nl/rc/clk?jk=022aa65b28ff04e4&fccid=4370fd483c9140b3&vjs=3,Rousch,recruiter,2022-06-23 00:44:40,accountancy,indeed.nl,False
026521cdf61887a7,Controleleider,2022-05-24,Amsterdam,2.0,"Mijn klant biedt een uitdagende werkomgeving met voldoende ruimte voor zelfontplooiing.
Als controleleider houd je je voornamelijk bezig met het verrichten van…","[4100, 6600]",master,https://www.indeed.nl/rc/clk?jk=026521cdf61887a7&fccid=86a55298a6d106a2&vjs=3,One Arrow,recruiter,2022-06-23 00:46:12,RA,indeed.nl,True
02b97913e14a5ab0,Consultant Executive Compensation and Board Advisory,2022-05-24,Amstelveen noord,803.0,"In-depth knowledge of tax, corporate finance, regulatory and accounting requirements in order to design executive compensation plans including: annual, equity,…",[],master,https://www.indeed.nl/rc/clk?jk=02b97913e14a5ab0&fccid=fcd059ccedda91fb&vjs=3,Willis Towers Watson,employer,2022-06-23 00:43:37,accountancy,indeed.nl,False
03141a25af085c56,Corporate Recruiter,2022-06-04,Postcode 2512 in Den Haag,1.0,"Wolters Kluwer is wereldwijd georganiseerd in vier divisies: Tax & Accounting, Legal & Regulatory, Health & Pharma Solutions, Financial & Compliance Services,…",[],master,https://www.indeed.nl/rc/clk?jk=03141a25af085c56&fccid=3f250a1aeb39a426&vjs=3,Yacht,recruiter,2022-06-23 00:44:40,accountancy,indeed.nl,False
0360f003bfa3316a,Medior Financial Controller,2022-06-09,Rotterdam,4.0,Cost accounting inclusief controle van inkomende facturen op basis van contracten en operationele informatie en het doorbelasten van kosten aan interne…,[],master,https://www.indeed.nl/rc/clk?jk=0360f003bfa3316a&fccid=f17e7b039f4d74c8&vjs=3,C. Steinweg Group,employer,2022-06-23 00:43:37,accountancy,indeed.nl,False
03b94197ceb29142,Financial Compliance and Reporting Spec.,2022-05-24,Postcode 6167 in Geleen,79.0,Within the Corporate Financial Compliance & Reporting department we are looking for a (senior) Financial Compliance and Reporting Specialist.,[],master,https://www.indeed.nl/rc/clk?jk=03b94197ceb29142&fccid=3fa6fb4572c25ccd&vjs=3,ARLANXEO,employer,2022-06-23 00:45:45,RA,indeed.nl,True
044252ae8452b999,Customer Service Representative,2022-06-09,Postcode 5928 in Venlo,76.0,"You are able to not get scared of taking responsibilities, working independently, define problems, collect data, establish facts and draw valid conclusions.",[],master,https://www.indeed.nl/rc/clk?jk=044252ae8452b999&fccid=927356efef1f3075&vjs=3,Michael Kors,employer,2022-06-23 00:43:37,accountancy,indeed.nl,True
0486e6c6d949de5b,Operational Risk Manager,2022-05-24,Schiphol,253.0,This department is responsible for coordinating risk management for both the corporate side and real estate investments.,[],master,https://www.indeed.nl/rc/clk?jk=0486e6c6d949de5b&fccid=c9b9e477b3c84b4d&vjs=3,CBRE,employer,2022-06-23 00:44:59,CPA,indeed.nl,True
048a80235a2fe830,Internal Auditor,2022-05-24,Zaandam,30.0,"Within several business processes (such as marketing, commerce, logistics, real estate, supply chain, IT) you will investigate if the operational processes…","[70000, 80000]",master,https://www.indeed.nl/rc/clk?jk=048a80235a2fe830&fccid=c3f215f3f2d5561b&vjs=3,ahold,employer,2022-06-23 00:39:13,auditor,indeed.nl,False
04afcd4430649625,Clinical Director for Oncology and Women's Health,2022-05-24,Weesp,824.0,"Provides clinical development expertise to study teams, project teams and to the overall assigned TA ( Oncology and womens health ) in order to deliver state of…",[],master,https://www.indeed.nl/rc/clk?jk=04afcd4430649625&fccid=77426fa86bb11d7c&vjs=3,Abbott Laboratories,employer,2022-06-23 00:45:45,RA,indeed.nl,False
04ec4f51d4f1e70a,Business Controller bij PDM Industrial Excellence B.V.,2022-05-24,Postcode 6049 in Herten,450.0,"Je hebt minimaal een afgeronde bachelor/ master bedrijfseconomie of accountancy.
PDM doet dit door middel van maatwerk, waar de behoefte van de klant de…",[],master,https://www.indeed.nl/rc/clk?jk=04ec4f51d4f1e70a&fccid=153b78c1a5c344ba&vjs=3,Koenen en Co,employer,2022-06-23 00:43:37,accountancy,indeed.nl,True
04f6f2fc69d392d8,Finance Manager,2022-05-24,Vlaardingen,797.0,To manage the annual audit process in conjunction with the appointed auditors to ensure statutory accounts are produced within the required deadlines.,[],master,https://www.indeed.nl/rc/clk?jk=04f6f2fc69d392d8&fccid=954e55536232ffe0&vjs=3,Catenon,recruiter,2022-06-23 00:39:30,auditor,indeed.nl,True
0507091b41ca2adb,Analyst - Accounting Policy and Reporting,2022-05-24,Amersfoort,799.0,"Provide input for training of technical accounting to individuals; and.
Knowledge of accounting for Real Estate funds, Holding Companies, SPVs etc.;",[],master,https://www.indeed.nl/rc/clk?jk=0507091b41ca2adb&fccid=c9b9e477b3c84b4d&vjs=3,CBRE,employer,2022-06-23 00:43:37,accountancy,indeed.nl,True
0540c75bda4f043e,"Specialist, Indirect Tax",2022-06-23,Postcode 4131 in Vianen,844.0,"You will work together with the EMEA Statutory teams, AP, AR, Legal, Treasury, regional accounting, and tax advisors to support regional compliance.",[],master,https://www.indeed.nl/rc/clk?jk=0540c75bda4f043e&fccid=5c616ca9b51e8497&vjs=3,Foot Locker,employer,2022-06-23 00:43:37,accountancy,indeed.nl,False
0556c8beb8235beb,EMEA Head of Group and Financial Control,2022-05-24,Hoofddorp,822.0,"A problem solver with a keen eye for detail, you’ll make sure our teams work accurately in a time-pressured environment.",[],master,https://www.indeed.nl/rc/clk?jk=0556c8beb8235beb&fccid=8e1b3eba64c2138d&vjs=3,ASICS,employer,2022-06-23 00:43:37,accountancy,indeed.nl,True
057de5933d18f72e,Financial Analyst,2022-05-24,Nieuw-Vennep,,"Minimum of 3 years accounting or audit experience.
A degree in Business administration (accounting concentration and master degree preferred).",[],master,https://www.indeed.nl/rc/clk?jk=057de5933d18f72e&fccid=45760e614a6eb614&vjs=3,Frendz Finance,recruiter,2022-06-23 00:44:40,accountancy,indeed.nl,True
0581e091f1879ab8,Manager Finance Operations,2022-05-31,Amsterdam,2.0,You will implement automation and robotization to enable the team to work efficiently and to process a high volume of transactions.,"[80000, 90000]",master,https://www.indeed.nl/rc/clk?jk=0581e091f1879ab8&fccid=59726437233e2325&vjs=3,Vroom Hekkema,recruiter,2022-06-23 00:44:40,accountancy,indeed.nl,True
05b44308237ea30b,(Senior) Consultant Direct Tax Technology,2022-05-24,Postcode 1081 in Amsterdam Zuid,2.0,"Minimaal 3 jaar relevante ervaring in tax compliance & tax accounting en/of het automatiseren van direct tax oplossingen;
Afgeronde Bachelor en of Masters;",[],master,https://www.indeed.nl/rc/clk?jk=05b44308237ea30b&fccid=9e215d88a6b33622&vjs=3,Deloitte,employer,2022-06-23 00:43:37,accountancy,indeed.nl,False
0620c24843a5f45b,Financial Controller - subsidie,2022-06-16,Thuiswerken in Zuid-Holland,,Als Finance Consultant Publieke Sector adviseer en ondersteun je onze publieke sector-klanten bij het optimaliseren van hun financiële bedrijfsvoering.,"[2750, 5200]",master,https://www.indeed.nl/pagead/clk?mo=r&ad=-6NYlbfkN0CeP7gm4_GH1AIb_Vr5ILkQcx_Vb-xmJzRPot3s8LhPvH1Ed_h9T75XpPFNabrhGqncffHdCN_nzy5o1Bd473mIxGeJhS7o1IG_3TauYbclRrIcU4JofpkV8UmdpKLDZVHC_OgmtqcqywJaTd708JMYY7rtgsC5d8For55JGf6xpc_YS4VzO_-8Xy1Yh9SoLIG7LG707e2Z1fGZ28nNCweOHWhXc5Fd3c4v-iLqYq7PNHx2FELy0Ox2VjpoZP4-vJoxKbkwCbKiuy7jXbatW7w6iRwD5QlIO9s1kdqAtB5sa7uGIRQE9L3TUerigw84oN41Yks9nAAvEFm0cDs-Nn3Gb9kpsThKFft_8CtxJaiqBQi_KVKLxY20ejgLPZe6DwN8A4C8ODseXkRe1_dkrsvp2sgHAnVAGVIzI00guRhsuZFNkcaM8rO1kOjFZTnTZchz-arAipGAG3qKAdsj7gXVMZ85pD78ui1NoRMmu2Twlg==&xkcb=SoBm-_M3cG6w-eepip0PbzkdCdPP&p=6&fvj=1&vjs=3,Bas Consultancy,recruiter,2022-06-23 00:46:12,RA,indeed.nl,False
0650ce034541d0af,Assistent Accountant Samenstelpraktijk,2022-05-24,Rotterdam+1 plaats,4.0,"Onze opdrachtgever is een middelgroot belastingadviseurs- en accountantskantoor.
Ze zijn gevestigd aan de rand van Rotterdam, vlakbij de havens.",[],master,https://www.indeed.nl/rc/clk?jk=0650ce034541d0af&fccid=d780a55033ec88b0&vjs=3,Carrièrekantoor,recruiter,2022-06-23 00:40:55,accountant,indeed.nl,True
06e3542929ee3c5b,(Junior) Assistant Controller,2022-06-17,Postcode 7903 in Hoogeveen,44.0,"Integrity, accuracy of our accounting, the closing process and timeliness of month-end accounts.
Team player with excellent accounting skills, advanced…","[2600, 4500]",master,https://www.indeed.nl/company/IG-Design-Group/jobs/Assistant-Controller-06e3542929ee3c5b?fccid=77ba6700d4aea60d&vjs=3,IG Design Group BV,employer,2022-06-23 00:43:37,accountancy,indeed.nl,False
075bdca4168859bc,Project Controller | Senior Position,2022-05-24,Nederland,,"Managing the accounting department through the Financial Shared Service Center.
In the role of Senior Project Controller, you will be part of Van Oord's…",[],master,https://www.indeed.nl/rc/clk?jk=075bdca4168859bc&fccid=9235931662016a2c&vjs=3,Van Oord,employer,2022-06-23 00:43:37,accountancy,indeed.nl,True
07a647ccf5951f66,FP&A Manager,2022-06-14,Hoevelaken,292.0,"Je voert de regie van het budgettering, forecasting en reporting proces.
Je hebt een belangrijke rol in de ontwikkeling en implementatie van het nieuwe Unica…",[],master,https://www.indeed.nl/rc/clk?jk=07a647ccf5951f66&fccid=157debf495e993fc&vjs=3,LIME Search&Connection,recruiter,2022-06-23 00:46:12,RA,indeed.nl,True
087175960256de7b,Financial Controller German Speaking,2022-05-24,Amsterdam,2.0,"You have a good technical accounting background, strong communication skills and a business minded approach.
This includes booking and archiving of purchase and…",[],master,https://www.indeed.nl/rc/clk?jk=087175960256de7b&fccid=f7b3dd8f617ec195&vjs=3,Undutchables,recruiter,2022-06-23 00:44:40,accountancy,indeed.nl,True
08770b58efcdc3b1,Security Risk & Control Manager,2022-06-23,Veldhoven,55.0,The Security Risk & Control Framework Manger will be responsible to collaborate with different sectors (Business) and with the RBA Internal Control team to…,[],master,https://www.indeed.nl/rc/clk?jk=08770b58efcdc3b1&fccid=57ed5f0210b0681a&vjs=3,ASML,employer,2022-06-23 00:39:13,auditor,indeed.nl,False
0884964d84f25cfc,Valuation Analyst,2022-05-24,Amsterdam,2.0,"Experience with fair value accounting (US GAAP and IFRS) and knowledge of valuation concepts regarding debt/equity financial instruments.
CPA/CA/RA a plus.",[],master,https://www.indeed.nl/rc/clk?jk=0884964d84f25cfc&fccid=1a620804436aa753&vjs=3,YER,recruiter,2022-06-23 00:44:40,accountancy,indeed.nl,True
08c54fd8b8085e33,Financial Analyst,2022-06-16,Willemstad Curaçao,454.0,"Master's degree in the field of business administration, accounting, economics or finance;
You give financial support to the strategy of the businesses and will…",[],master,https://www.indeed.nl/company/Global-Resourcing-Dutch-Caribbean/jobs/Financial-Analyst-08c54fd8b8085e33?fccid=b9c2f9d9c3ebf481&vjs=3,Global Resourcing Dutch Caribbean,recruiter,2022-06-23 00:44:40,accountancy,indeed.nl,True
08c7a16c108a88d8,Finance Assistant,2022-05-24,Valkenswaard,94.0,Waarbij te allen tijde wordt voldaan aan de door de organisatie aan de uitvoering van deze werkzaamheden gestelde eisen.,[],master,https://www.indeed.nl/rc/clk?jk=08c7a16c108a88d8&fccid=5f06f64269f00abb&vjs=3,Essentra PLC,employer,2022-06-23 00:43:37,accountancy,indeed.nl,True
08fad1a05dac56dd,Senior Financial Accountant Poland/Germany/Austria,2022-06-18,Zwaagdijk-Oost+1 plaats,,"(Full-time, 38 hours a week).
As part of our Financial Shared Service Centre, you will dive into executing and managing the monthly closures and reconciliation…",[],master,https://www.indeed.nl/rc/clk?jk=08fad1a05dac56dd&fccid=54efed5821b94cd4&vjs=3,Action,employer,2022-06-23 00:39:13,auditor,indeed.nl,True
0940b8fe9212404c,Procurement Finance International FP&A Analyst,2022-05-24,Amsterdam,2.0,"Department: 03 - 23 - Planning and Performance Management (PPM) - Support Functions.
Procurement Finance International FP&A Analyst is responsible of management…",[],master,https://www.indeed.nl/rc/clk?jk=0940b8fe9212404c&fccid=ef4be98af276034b&vjs=3,Kraft Heinz Company,employer,2022-06-23 00:43:37,accountancy,indeed.nl,False
0a1a9adee15771af,Data Science traineeship,2022-06-23,Tilburg+1 plaats,805.0,Een data analist verzamelt hieruit vervolgens inzichten en maakt organisaties bewust van de huidige stand van zaken door middel van rapportages / dashboards.,"[2500, 3000]",master,https://www.indeed.nl/company/Smart-Data-People/jobs/Data-Science-Traineeship-0a1a9adee15771af?fccid=7a2ea53d81384020&vjs=3,Smart Data People,recruiter,2022-06-23 00:44:40,accountancy,indeed.nl,True
0a295a096082fc22,Belastingadviseur,2022-05-24,Veenendaal+30 plaatsen,33.0,"Innovatie en tax data management wordt belangrijker.
Er heerst een informele en professionele cultuur waar kennisoverdracht, collegialiteit alsmede ook humor…",[60000],master,https://www.indeed.nl/rc/clk?jk=0a295a096082fc22&fccid=51c763c51a69c269&vjs=3,Ingenius,recruiter,2022-06-23 00:40:55,accountant,indeed.nl,False
0aa1213798550780,"Treasury Analyst, APAC",2022-05-24,Postcode 1097 in Amsterdam+2 plaatsen,2.0,"Develop, implement and maintain bank account structures and controls.
Be responsible for the daily cash and liquidity management for all onshore entities in…",[],master,https://www.indeed.nl/rc/clk?jk=0aa1213798550780&fccid=f766f8bfbc3effb7&vjs=3,Uber,employer,2022-06-23 00:43:37,accountancy,indeed.nl,True
0bf61d4d76b28fad,Reporting Analyst,2022-05-24,Thuiswerken in Postcode 1096 in Amsterdam Oost+1 plaats,2.0,"Assist team as needed on month-end accounting activities.
You manage the timely preparation of the monthly management reporting packs for a set of JV’s.",[],master,https://www.indeed.nl/rc/clk?jk=0bf61d4d76b28fad&fccid=e15d9e27876d9dc3&vjs=3,Equinix,employer,2022-06-23 00:43:37,accountancy,indeed.nl,True
0c34782009785a36,Subcontractor Food Safety Management Systems,2022-05-24,Rotterdam,4.0,Als auditor en specialist binnen jouw vakgebied toets je zelfstandig of in teamverband managementsystemen gericht op kwaliteit en voedselveiligheid (zoals ISO…,[],master,https://www.indeed.nl/rc/clk?jk=0c34782009785a36&fccid=51e6d37e31a6306f&vjs=3,Lloyd's Register Group,employer,2022-06-23 00:39:13,auditor,indeed.nl,False
0c473ce510ca0411,Deal Desk Manager,2022-06-14,Amsterdam,2.0,"Finally, you’ll develop relationships at all levels and across the entire company in support of your deal function.
MBA or related relevant area.",[],master,https://www.indeed.nl/rc/clk?jk=0c473ce510ca0411&fccid=fbedd6450a2f872c&vjs=3,Snowflake,employer,2022-06-23 00:43:37,accountancy,indeed.nl,True
0c4bd2caa02165bd,Senior Belastingadviseur,2022-05-24,Apeldoorn+23 plaatsen,9.0,"Innovatie en tax data management wordt belangrijker.
Er heerst een informele en professionele cultuur waar kennisoverdracht, collegialiteit alsmede ook humor…",[80000],master,https://www.indeed.nl/rc/clk?jk=0c4bd2caa02165bd&fccid=51c763c51a69c269&vjs=3,Ingenius,recruiter,2022-06-23 00:40:55,accountant,indeed.nl,False
0c5403c969012dad,Manager M&A,2022-05-25,Zaltbommel,110.0,"Je hebt een Bachelor of Master opleiding en een achtergrond in accounting of M & A.
Moving Intelligence helpt zowel particulieren als fleetowners grip te…",[],master,https://www.indeed.nl/rc/clk?jk=0c5403c969012dad&fccid=b89cce07c5b6c808&vjs=3,Moving Intelligence,recruiter,2022-06-23 00:44:40,accountancy,indeed.nl,True
0c90e3fd8ada1f9b,Controleleider/Accountant,2022-05-24,Leiden+1 plaats,804.0,"Dit unieke kantoor spreekt zich uit als de accountant van de toekomst met een vleugje lef.
Je weet hier snel en adequaat op in te spelen.",[54000],master,https://www.indeed.nl/rc/clk?jk=0c90e3fd8ada1f9b&fccid=e5ca1945be403bc4&vjs=3,HeadHuntersTeam,recruiter,2022-06-23 00:40:55,accountant,indeed.nl,True
0cb6161071c0e124,Finance Operations Intern,2022-05-24,Tijdelijk thuiswerken in Amsterdam,2.0,"Are you interested in joining an international Finance Operations Team and keen to learn more in a fast-paced, global environment? Then we're looking for you…",[],master,https://www.indeed.nl/rc/clk?jk=0cb6161071c0e124&fccid=b48442910bb69b13&vjs=3,Just eat Takeaway.com,employer,2022-06-23 00:43:37,accountancy,indeed.nl,False
0cb95c3b0aa0e897,AA/RA-Accountant met de mogelijkheid om toe te treden als Partner,2022-05-27,Postcode 5541 in Reusel,305.0,"Op basis van je actuele en parate kennis kun je vragen van klanten direct beantwoorden.
Je beschikt over een afgeronde accountancy-opleiding op bachelor/master…",[],master,https://www.indeed.nl/rc/clk?jk=0cb95c3b0aa0e897&fccid=3c0df081a1e0665f&vjs=3,Adriaans Accountants,employer,2022-06-23 00:40:20,accountant,indeed.nl,True
0cd3442ba2c1ef32,"Business Controller Real Estate, Amsterdam",2022-05-24,Noord-Holland,,"Bij deze aansprekende vastgoedonderneming is jouw rol van grote toegevoegde waarde.
De nodige besluiten worden genomen aan de hand van de door jou opgemaakte…",[],master,https://www.indeed.nl/rc/clk?jk=0cd3442ba2c1ef32&fccid=478ed51f915ec984&vjs=3,PropertyPeople,recruiter,2022-06-23 00:44:40,accountancy,indeed.nl,True
0ce427c43b60afb2,Bioinformatics Master Internship,2022-06-18,Leiden,804.0,Apply a Machine Learning (ML) model to automatically classify human kidney cell types while accounting for cell type relationships between studies.,[],master,https://www.indeed.nl/rc/clk?jk=0ce427c43b60afb2&fccid=fb17b9b99dc0668d&vjs=3,GenomeScan,employer,2022-06-23 00:43:37,accountancy,indeed.nl,False
0d1807fd731a9745,Assistent Accountant (24-32 uur),2022-05-24,Den Bosch+1 plaats,14.0,"Onze opdrachtgever is een kleinschalige dienstverlener en nu 6 jaar actief op het gebied van financiële administratie, salarisadministratie, fiscale…",[],master,https://www.indeed.nl/rc/clk?jk=0d1807fd731a9745&fccid=363df2a120d9e10a&vjs=3,Personeel Medium,recruiter,2022-06-23 00:40:55,accountant,indeed.nl,True
0d1a2dec857b5d36,Corporate Financial Controller,2022-05-24,Postcode 1119 in Schiphol,253.0,"Master’s degree in accounting/finance and qualified chartered accountant licensure.
Manage the roll-out of a group wide accounting and reporting manual…",[],master,https://www.indeed.nl/rc/clk?jk=0d1a2dec857b5d36&fccid=75be652db60c264c&vjs=3,Azerion,employer,2022-06-23 00:43:37,accountancy,indeed.nl,True
0d6cec21434af12a,General Ledger Accountant,2022-05-24,Amsterdam,2.0,"Dit komt ook door de complexiteit van de administratie.
Als je jezelf de materie eigen hebt gemaakt, en je hebt de organisatie een beetje leren kennen, kun je…",[50000],master,https://www.indeed.nl/rc/clk?jk=0d6cec21434af12a&fccid=d109ac65bbf0c6fd&vjs=3,Kunneman & Vandenbroek Recruitment Solutions,recruiter,2022-06-23 00:44:40,accountancy,indeed.nl,True
0d7d7eee7da53e95,Senior Finance Controller,2022-05-24,Den Bosch,14.0,"Build and maintain strong relationships with internal and external key stakeholders including, finance team, auditors, budget holders, bankers….",[],master,https://www.indeed.nl/rc/clk?jk=0d7d7eee7da53e95&fccid=34ef20d09a3b10f6&vjs=3,IFS,employer,2022-06-23 00:39:13,auditor,indeed.nl,False
0d7f60ff30a501d2,Business Controller,2022-05-24,Hilversum,22.0,"Je bent als Business Controller een belangrijke sparringpartner van het (zorg) management en de business.
Je vindt het leuk om nieuwe dingen te ontwikkelen/op…","[2700, 4286]",master,https://www.indeed.nl/rc/clk?jk=0d7f60ff30a501d2&fccid=0b484f9becee6525&vjs=3,HilverZorg,employer,2022-06-23 00:43:37,accountancy,indeed.nl,True
0d91a0a9f87feff7,Tax Advisor,2022-06-16,Postcode 7101 in Winterswijk+3 plaatsen,104.0,"Je kiest bewust voor een wereldwijde organisatie waar het leveren van topkwaliteit je uit zal dagen om jezelf te blijven ontwikkelen.
32 tot 40-urige werkweek.",[],master,https://www.indeed.nl/rc/clk?jk=0d91a0a9f87feff7&fccid=cf80abde47d3bd81&vjs=3,Mazars,employer,2022-06-23 00:40:20,accountant,indeed.nl,False
0db8a1f131187198,Lid RvC - Vastgoedontwikkeling en -beheer/volkshuisvesting - Woco Rotterdam (oud Vestia),2022-05-24,Rotterdam,4.0,Strategisch/beleidsmatig zal de dienst worden aangestuurd door een bestuursraad; iedere woningcorporatie vaardigt een lid van de Raad van Bestuur (hierna RvB)…,[],master,https://www.indeed.nl/pagead/clk?mo=r&ad=-6NYlbfkN0BUi5skEC2JacOuA5S-guKlBVqGkEVnSMmX3xEoRIYszl3Fq1VGX9VWu0q1DLf54RvH38ZKaM_lsQRPnGpXv6c6O9L3SOoy-_QqxepMSpnYXfNFBEoHc1wyjsdDDNTZlLt26rzNWfXHlx9AaWPDIknFSLBQTwo21ETiHSilDPuUMR0sB_yNG5FC5Iv9NlN6LfEfoda54f9p0VsYEBhT8DiEskAYPnuiEuhdORa8D5VHlbQwenSWLqSxNmxJZp6CjKZH-GIkKU6om_iTMaxTwB5eQzUKLsnJepyNMPPnvCQvZ8ae4hn3IIDi35X7KqhDR1sNaCFpAk-7QQJ2joB3HIo5dnpURGyJ8JbWoExtT_jW5HKQl0AihXFgtrbe14N-FvkcNA9T_H5n7vT0aC8bgWKhyt51JeKVWFNk6iNylRzeoPpkji-C_mZs96OgHQP8Lcg1D6IGV9sF8Wv-M3uY94CRNFdX5TnA90N2UsnYCnQoXzQ6mTiI8ZpivwHhKe8PAnscBBNEKbTig5ZEfoIKlpIZ5YdSjeZKZp1sUnCv-Ys2EEN_iLq9Y9zqGlbGvpGvljhfqafGDZSs89DbxByR_khW1jFt06wjY3894eJYQUsQN4Ek5tXpHRkzHTvqfZoVRKHIcYMyY8RjMOIACnyvNaG6_7nHnkmXFakK8lmapkXUwwkN4pmoimy72-BbBDkxLwzDXCHtvWG2EZl0RksusCxRzAAiEOzRlVS1IoT1p4chdShqpvNw7g2R&xkcb=SoDC-_M3cG6y7efTaZ0LbzkdCdPP&p=3&fvj=0&vjs=3,Diemen & Van Gestel Select,employer,2022-06-23 00:45:45,RA,indeed.nl,True
0dd907183125e593,Relatiebeheerder Audit,2022-05-25,Eindhoven,5.0,"Bij onze opdrachtgever krijg je alle ruimte om jezelf te blijven uitdagen.
Het menselijke aspect van die (internationale) relaties geeft je energie en je zet…",[],master,https://www.indeed.nl/rc/clk?jk=0dd907183125e593&fccid=5a5975b9a2989351&vjs=3,We Matter,recruiter,2022-06-23 00:46:12,RA,indeed.nl,False
0de59f8cbf8ee801,Senior Expert Regulatory Affairs Biologicals,2022-05-24,Thuiswerken in Amsterdam,2.0,They are now looking for a Regulatory Affairs expert who would like to contribute to the development and approval of new innovative biological products.,[],master,https://www.indeed.nl/rc/clk?jk=0de59f8cbf8ee801&fccid=fe09c791aaf03279&vjs=3,QTC recruitment,recruiter,2022-06-23 00:46:12,RA,indeed.nl,False
0e4dde225a805ca1,PhD in Biomedical Engineering,2022-05-31,Eindhoven,5.0,"In this project, we intend to overcome this limitation, thereby enabling the design of new strategies to control angiogenesis accounting for the mechanical…",[],master,https://www.indeed.nl/rc/clk?jk=0e4dde225a805ca1&fccid=b357aa510b1bb882&vjs=3,TU Eindhoven,employer,2022-06-23 00:43:37,accountancy,indeed.nl,False
0e7a5f5ab0836f43,Hyperion Finance Management (HFM) Specialist,2022-05-24,Rotterdam,4.0,The team of Group Reporting/ consolidation consists of 10 people and you report directly to the Co-Heads Group Reporting/ Consolidation.,[],master,https://www.indeed.nl/rc/clk?jk=0e7a5f5ab0836f43&fccid=c73b1587bdffc448&vjs=3,ABC Human Capital,recruiter,2022-06-23 00:44:40,accountancy,indeed.nl,True
