job_id,job_title,job_date,job_loc,job_city,job_lng,job_lat,job_summary,job_salary,job_url,company_name,company_type,search_time,search_position,source,search_qualified
ae762212a0079a16,Change Manager,2022-11-05,Veenendaal,Veenendaal,5.555,52.025,"Je stuurt engineers aan om een gepaste voorbereiding en een tijdige en kostefficiënte uitvoering te borgen.
Je overlegt met de release manager welke changes er…",[],https://www.indeed.nl/rc/clk?jk=ae762212a0079a16&fccid=e8ed6c5a15516b8b&vjs=3,Cegeka,employer,2022-10-06 15:45:48,auditor,indeed.nl,True
aeac2f59358ef249,Global Procurement Manager Media,2022-11-05,Utrecht,Utrecht,5.1222,52.0908,"Media auditing (with JDE media auditor) and global SLE evaluation process.
It’s amazing what can happen over a cup of coffee.
In this role, you will:",[],https://www.indeed.nl/rc/clk?jk=aeac2f59358ef249&fccid=1eccbfe457d7a721&vjs=3,JACOBS DOUWE EGBERTS,employer,2022-10-06 15:45:48,auditor,indeed.nl,True
aec4e2e820aa0951,Team Lead - General Ledger Accounting,2022-11-05,Thuiswerken in Postcode 3818 in Amersfoort,Amersfoort,5.3875,52.155,"Manage relationships with tax authorities, accountancy firms and auditors.
The position combines responsibility for day to day general ledger activities,…",[],https://www.indeed.nl/rc/clk?jk=aec4e2e820aa0951&fccid=0ae12e4c8b351c4c&vjs=3,Kao Corp.,employer,2022-10-06 15:45:48,auditor,indeed.nl,True
aeca3bf0fae15450,Subcontactor Food,2022-11-05,Rotterdam,Rotterdam,4.4792,51.9225,Als auditor en specialist binnen jouw vakgebied toets je zelfstandig of in teamverband managementsystemen gericht op kwaliteit en voedselveiligheid (zoals ISO…,[],https://www.indeed.nl/rc/clk?jk=aeca3bf0fae15450&fccid=51e6d37e31a6306f&vjs=3,Lloyd's Register Group,employer,2022-10-06 15:45:48,auditor,indeed.nl,True
aeee3c818f568f13,Night Auditor Hotel Plantage,2022-11-05,Postcode 1018 in Amsterdam Centrum+1 plaats,Amsterdam,4.8833,52.3667,"You will be handling all administration tasks and dealing with any potential guests’ requests or complaints.
Check-In and Check-Out processes.",[],https://www.indeed.nl/rc/clk?jk=aeee3c818f568f13&fccid=4a0d2228798a9197&vjs=3,We are key b.v.,employer,2022-10-06 15:45:48,auditor,indeed.nl,True
afbe2a2bd8c9717b,Quality Improvement Coordinator,2022-11-05,Postcode 4881 in Zundert,Zundert,4.66,51.4703,"Barry Callebaut Decorations B.V. is het hart van premium chocolade decoraties.
In deze functie word je verantwoordelijk voor het proactief ondersteunen van de…",[],https://www.indeed.nl/rc/clk?jk=afbe2a2bd8c9717b&fccid=d5dfcb1c31e0c244&vjs=3,Barry Callebaut,employer,2022-10-06 15:45:48,auditor,indeed.nl,True
afd7a1bf2b733465,DATA ANALYST/ENGINEER,2022-11-05,Utrecht,Utrecht,5.1222,52.0908,"With the team of experienced specialists, you will develop a modern, multifaceted, integrated, and modular platform for data management and analytics to enable…",[],https://www.indeed.nl/rc/clk?jk=afd7a1bf2b733465&fccid=e67f175cf1957cd2&vjs=3,Intellerts,employer,2022-10-06 15:45:48,auditor,indeed.nl,True
b028c2775e73d24f,QA Specialist,2022-08-06,Amsterdam Westpoort,Amsterdam,4.8833,52.3667,"Onderhouden van contacten met overheden, waterschap, auditors, brancheorganisaties, brandweer, ongediertebestrijding etc.
Kennis van ARBO, veiligheid en milieu.",[],https://www.indeed.nl/company/VOLLERS-HOLLAND-B.V./jobs/QA-Specialist-b028c2775e73d24f?fccid=311238a1e196f98d&vjs=3,Vollers Holland B.V.,employer,2022-10-06 15:45:48,auditor,indeed.nl,True
b03cc777f632d9e3,Accountant | IT auditor,2022-11-05,Eindhoven,Eindhoven,5.4778,51.4408,"Voor het grootste gedeelte zijn dat jonge MKB ondernemers.
Kantoor met meerdere vestigingen en totaal rond de 120 collega´s.",[],https://www.indeed.nl/rc/clk?jk=b03cc777f632d9e3&fccid=a9d84f5618c1abb2&vjs=3,Adviesgroep 88,recruiter,2022-10-06 15:46:48,auditor,indeed.nl,True
b0c17768636456f4,Sr. Assistant Audit Amsterdam,2022-01-06,Amsterdam+17 plaatsen,Amsterdam,4.8833,52.3667,"Als Senior Assistant Audit heb je altijd het juiste antwoord op de vragen van je klanten.
Je hebt een hbo- of wo-opleiding accountancy of bedrijfseconomie…",[],https://www.indeed.nl/rc/clk?jk=b0c17768636456f4&fccid=1bfec2a2f61dd5c2&vjs=3,Baker Tilly,employer,2022-10-06 15:45:48,auditor,indeed.nl,True
b15aab1418d96b3d,"Integrity Engineer (fulltime, 38,75 uur per week) - Heerhugowaard",2022-05-21,Heerhugowaard,Heerhugowaard,4.841,52.668,"In deze rol ben je verantwoordelijk voor de risicobeoordeling en -beperking van statische apparatuur, pijpleidingen en offshore structuren.",[],https://www.indeed.nl/rc/clk?jk=b15aab1418d96b3d&fccid=efcfda847f1e89fd&vjs=3,Prefound,recruiter,2022-10-06 15:46:48,auditor,indeed.nl,True
b16077d8733560c5,Administratief Medewerker Certificatie,2022-04-06,Postcode 4105 in Culemborg,Culemborg,5.2333,51.95,"SGS INTRON biedt duurzame praktische oplossingen bij alle bouw gerelateerde vragen.
Met ruim vijftig jaar ervaring op het gebied van materiaalkundig onderzoek,…",[],https://www.indeed.nl/pagead/clk?mo=r&ad=-6NYlbfkN0BE_JexViiDe2V7ZFGjfuR6ov3OYCrpI_lDcOYdKhtiEV_5ptbQbEzBpii2C421iZklGVgvHjZSY3qXO_eX7kObL2yDttBz7h7sWrgxS4oPsyQJZ7xcX1tJJvfDCakfBVbzh7HFpV9quijekJ_mepjNse0jbaKRa4nyPtLjETWOXqiFPXV69JFrnwTMY4biHBYmeqjGSEG6_drFSLugCSNQAGtD7R0NJdUHcTQDrdY4pdM8ENJ2KUwBNcXYRkM7zYsMjyfyHWaP5DzQfsu0cVt7_HQmT36xYU_cSY-9E44yr882PbiR6aijF3jw6MHeFzFksCZ9qYwgvCbIld8Ou_YpfCup8ipvFydCSwuZPZz5R90FgLdXjdjBPHCYKgTcgO7KyBMy7XQrQsRMCu4UhfLYpPT3s16TMrkl-4KriIIrm9nNhEq1qoU5jq9QMSjvQaLqix-HpVqtcN17Zn47NwaAzxM6feE7cYFRM54El0wm-r2O3Kst1yJa50vCGxR0l_3Emj1qSh93cqgDBr0U0sLQuRhgxuk8kFSLOehf_TgnliG-NON4e2LjSxu5fn6kvv_6-BYhH1gpDthZa6AuDP1RazgYVn9giVNzKKN1-gIiW_xWa6NwJ3GW6Ukwm6r6OG8xY8vwObgBaaA51DpETsonwXUpXuzi9q_tMTPra9lwmUT1pf3xoeYj&p=7&fvj=0&vjs=3,SGS,employer,2022-10-06 15:45:48,auditor,indeed.nl,True
b1a918cf97079c73,Accounting Assistant,2022-11-05,Amsterdam,Amsterdam,4.8833,52.3667,"Assisting auditors for completion of audit process.
Providing accounting and tax support our customer and its subsidiaries.
Strong Excel and Power Point skills.",[],https://www.indeed.nl/rc/clk?jk=b1a918cf97079c73&fccid=00e28b0787e8463a&vjs=3,Nippon Recruitment,recruiter,2022-10-06 15:46:48,auditor,indeed.nl,True
b1c359ea7d212d1b,privacy consultant,2022-05-13,Rotterdam,Rotterdam,4.4792,51.9225,"Inmiddels is DMCC in Nederland een begrip op het gebied van compliance.
Wij zijn op zoek naar een echte privacy ambassadeur.",[],https://www.indeed.nl/rc/clk?jk=b1c359ea7d212d1b&fccid=c4b5441b78a28611&vjs=3,DMCC Nederland,employer,2022-10-06 15:45:48,auditor,indeed.nl,True
b2663bff98c0f685,MPS-ECAS Auditor Substraten,2022-11-05,Postcode 2678 in De Lier+1 plaats,,,,"In de functie opereer je veel zelfstandig, maar je werkt ook samen om te harmoniseren en van elkaar te leren.
Voorbeelden van managementsystemen waar je mee aan…",[],https://www.indeed.nl/rc/clk?jk=b2663bff98c0f685&fccid=af836096b4edf459&vjs=3,Stichting MPS,employer,2022-10-06 15:45:48,auditor,indeed.nl,True
b2e8c4c5db8f2d48,Auditor,2022-07-06,Hybride werken in Utrecht,Utrecht,5.1222,52.0908,"Je maakt het verschil als strategisch sparringpartner voor senior management binnen deze domeinen door jouw uitgebreide kennis, competenties en ervaring in te…","['5.500', '6.300']",https://www.indeed.nl/pagead/clk?mo=r&ad=-6NYlbfkN0BUi5skEC2JacOuA5S-guKlBVqGkEVnSMmX3xEoRIYszl3Fq1VGX9VWW0EUgKwGTCrmEAZrTMQgKImQZ6uGKAhApwwk26WoKQcEVoS2Iu5oSSzah6UgVS3Me4jlPqKmvK4CJTTZaT_DSA6ZGvAaFUeJK5zGAxAy4_DtZJU0Z1ZZ1xr46Jl874xFgGXIyE3oFThkkoxxa7rZD1z9KKBghAHm20gt76b7wKFiKwLLQgmvM6HDWuKSwIc3ZM42p-rugn-pMogErdNLfz0zkHOzLdOMZuSCOkzElTOzE8_0_6Qw0nUHrZlOKtTpbqYnhk7hFMwIOr8X93RYHFUSDYXQofvdJycW8uf-P9FNkG4R0yfaX_sxA8nx_cFs_CtfdAVgvcUjA99rPUhLEl_DgRJ6D8P-MLnZbaGVWK1FV-g5puOAqyxJ2nONzjYs9FF90nImsGq0fjpAnUXP_WKzbY0B3V3yFtWpOK1E1d-hUxHzvzuARLVpJxo3PLcD7SXxv1hcvThT1gL_JySyEnideTZQlEBdt3fLOzL0hkBS1wF8RK7kXTLAAakK26KlnVVODXUYswwmWSPR-MVIteoyYB7062nSoMp8G5eNe-tEkcbdcj6SN5oaHzJmnj3i0M3CXZDr7uDfPoGinXoTLiOcqnmdJnm5soHI0cCpM5s=&p=4&fvj=0&vjs=3,Yacht,recruiter,2022-10-06 15:46:48,auditor,indeed.nl,True
b334c6a724f2c659,SENIOR GLOBAL INTERNAL AUDITOR - Permanent position,2022-11-05,Bleiswijk,Bleiswijk,4.54,52.01,"Further, we provide the board of directors, audit committee, and senior management reasonable assurance that the financial data used to make business decisions…",[],https://www.indeed.nl/rc/clk?jk=b334c6a724f2c659&fccid=ef600a216c72460f&vjs=3,Del Monte,employer,2022-10-06 15:45:48,auditor,indeed.nl,True
b403b66116da9894,Lead Auditor VCA en Kwaliteitmanagementsystemen,2022-11-05,Son+2 plaatsen,,,,"VCA staat voor Veiligheid, Gezondheid en Milieu (VGM) Checklist Aannemers.
Zelfstandig of in teamverband audit verrichten bij bedrijven die gecertificeerd…","['3.500', '5.000']",https://www.indeed.nl/rc/clk?jk=b403b66116da9894&fccid=bc866b9fd589642f&vjs=3,TÜV Nederland,employer,2022-10-06 15:45:48,auditor,indeed.nl,True
b432834210ca70c7,ISO 9001 Auditor managementsystemen kwaliteit,2022-11-05,Giessen+1 plaats,Giessen,5.0328,51.7886,Wij zijn op zoek naar praktische auditoren die op een integere manier de managementsystemen van onze klanten beoordeeld op conformiteit.,[],https://www.indeed.nl/rc/clk?jk=b432834210ca70c7&fccid=13ab666c9cfcb07b&vjs=3,SCI Netherlands,employer,2022-10-06 15:45:48,auditor,indeed.nl,True
b5c09d11d71bd984,Manager Audit,2022-11-05,Utrecht,Utrecht,5.1222,52.0908,"Onze opdrachtgever is onderdeel van een samenwerkingsverband van vijf onafhankelijke accountantskantoren, actief in heel Nederland.",[],https://www.indeed.nl/rc/clk?jk=b5c09d11d71bd984&fccid=88057ceee094d92c&vjs=3,New Monday,recruiter,2022-10-06 15:46:48,auditor,indeed.nl,True
b5d17fc78ac573b1,GL Team Coordinator / Financial Controller,2022-11-05,Nieuwegein,Nieuwegein,5.0919,52.0314,"Contacten onderhouden met financiële en niet-financiële functies en externe adviseurs, waaronder auditors;
Monitoren of onze programma's (Miles, Basware, MIF,…",[],https://www.indeed.nl/rc/clk?jk=b5d17fc78ac573b1&fccid=b25343f021fb51d7&vjs=3,Mercedes-Benz,employer,2022-10-06 15:45:48,auditor,indeed.nl,True
b5edde7b31f3ee5c,Senior Associate,2022-07-06,Nederweert,Nederweert,5.7486,51.2858,"Jezelf blijven ontwikkelen en uitdagen tot kennis verbreding op gebied van IT-audits, privacy en cybersecurity.
Affiniteit met cybersecurity en privacy;",[],https://www.indeed.nl/rc/clk?jk=b5edde7b31f3ee5c&fccid=594ad3748f01f3aa&vjs=3,New Day IT Risk & Assurance Service,employer,2022-10-06 15:45:48,auditor,indeed.nl,True
b63aefe21a459403,HSEQ Officer Maritime,2022-03-06,Rotterdam,Rotterdam,4.4792,51.9225,"Jaarlijks assisteren zij duizenden schepen op een veilige en efficiënte manier.
De complexiteit van het scheepvaartverkeer vraagt om optimale communicatie…",[],https://www.indeed.nl/rc/clk?jk=b63aefe21a459403&fccid=10475c1088044715&vjs=3,QHSE Professionals,recruiter,2022-10-06 15:46:48,auditor,indeed.nl,True
b64bb406e5ef8cf1,COMPLIANCE COÖRDINATOR (non-financial),2022-11-05,Postcode 3542 in Utrecht,Utrecht,5.1222,52.0908,"Tenminste 4 jaar werkervaring binnen het risk & compliance domein (o.a. als senior compliance officer, compliance manager, risk manager of internal auditor);",[],https://www.indeed.nl/rc/clk?jk=b64bb406e5ef8cf1&fccid=b490d762e4b10bed&vjs=3,IMPROVEN BV,employer,2022-10-06 15:45:48,auditor,indeed.nl,True
b6a18add810dcaf0,EDP Auditor,2022-11-05,Noord-Brabant,,,,"Diploma EDP/IT-auditor / Post-master EDP/IT auditor.
Inschrijving als Register EDP-auditor/IT-Auditor (RE).
Electronic Data Processing (EDP) Auditor.",[],https://www.indeed.nl/rc/clk?jk=b6a18add810dcaf0&fccid=119d05aa277fd811&vjs=3,Aexecutives,employer,2022-10-06 15:45:48,auditor,indeed.nl,True
b6b575daa32fd051,auditor,2022-11-05,Wageningen,Wageningen,5.6667,51.97,"Interesse in complexe processen, bij voorkeur van financiële instellingen.
Als Auditor bij Menzis ben je verantwoordelijk voor het uitvoeren van advies - en…",['4.726'],https://www.indeed.nl/rc/clk?jk=b6b575daa32fd051&fccid=884034486bfeb9c9&vjs=3,Menzis,employer,2022-10-06 15:45:48,auditor,indeed.nl,True
b6e32c2dd4d349f0,Kwaliteitsadviseur / Quality Assurance Officer,2022-09-06,Zaltbommel+1 plaats,Zaltbommel,5.25,51.8,In deze uitdagende functie kom je te werken op de vestiging van Kiwa Fire Safety & Security met als standplaats Zaltbommel.,[],https://www.indeed.nl/rc/clk?jk=b6e32c2dd4d349f0&fccid=39807a905ef077f7&vjs=3,"Kiwa Fire Safety & Security B.V. Zaltbommel,...",employer,2022-10-06 15:45:48,auditor,indeed.nl,True
b6e855cbf326bf88,Risk Manager,2022-11-05,Den Haag,Den Haag,4.2986,52.0767,"Je hebt minimaal 5 jaar relevante werkervaring als risk manager, business controller, financial controller of auditor;","['3.645', '5.797']",https://www.indeed.nl/rc/clk?jk=b6e855cbf326bf88&fccid=0dfca1c6d1c853c0&vjs=3,CAK,employer,2022-10-06 15:45:48,auditor,indeed.nl,True
b75dcffa9d2ff632,Interim Quality Food Safety Specialist - Food industry - Arnhem/Nijmegen region,2022-09-06,Thuiswerken in Gelderland,,,,"Experience with GFSI as an auditor or system setup.
Maintaining and drawing up the standard Food Safety procedures.
Own and guide the SOPs for the CCPs.",[],https://www.indeed.nl/rc/clk?jk=b75dcffa9d2ff632&fccid=3359d6dc0c56287f&vjs=3,Morgan Green Werving & Selectie B.V.,recruiter,2022-10-06 15:46:48,auditor,indeed.nl,False
b788aadaaed3fc18,Senior Operational IT Risk Manager,2022-11-05,Rotterdam,Rotterdam,4.4792,51.9225,You act as the IT risk specialist within Operational Risk Management (ORM) and educate your risk colleagues and liaise with first-line colleagues (e.g. CISO).,[],https://www.indeed.nl/rc/clk?jk=b788aadaaed3fc18&fccid=1a620804436aa753&vjs=3,YER,recruiter,2022-10-06 15:46:48,auditor,indeed.nl,True
b85c6c80b2f36331,Quality Manager,2022-05-13,Amersfoort,Amersfoort,5.3875,52.155,"Als Quality Manager ben je verantwoordelijk voor het uitvoeren, bewaken, controleren en verbeteren van het kwaliteitssysteem.
Afgeronde hbo- of wo-opleiding;",[],https://www.indeed.nl/rc/clk?jk=b85c6c80b2f36331&fccid=386d7ba33a30c69b&vjs=3,Derks & Derks B.V.,recruiter,2022-10-06 15:46:48,auditor,indeed.nl,True
b861bb38f15f5733,Medewerker zuivel-planning,2022-05-23,Zutphen,Zutphen,6.195,52.14,"Het beheer in te plannen bijwoningen t.b.v. kwalificaties van auditoren;
Het administratief verwerken van overzichten kwalificaties auditoren en tijdig invoeren…",[],https://www.indeed.nl/company/Qlip-B.V./jobs/Medewerker-Zuivel-Planning-b861bb38f15f5733?fccid=8fe1330b304f5d80&vjs=3,Qlip,employer,2022-10-06 15:45:48,auditor,indeed.nl,True
b8a0acc8cd137b0e,Head of Accounting,2022-05-24,Thuiswerken in Groningen,Groningen,6.5667,53.2167,"Lead and coordinate the annual audit process, liaise with auditors, shareholders, and Brandfield’s management board.
The working hours are partly flexible.",[],https://www.indeed.nl/company/Brandfield/jobs/Head-Accounting-b8a0acc8cd137b0e?fccid=2140b78b0fa1682b&vjs=3,Brandfield,employer,2022-10-06 15:45:48,auditor,indeed.nl,True
b8c8505e0085cafe,Financial Accountant (assistent-controller),2022-11-05,Amsterdam,Amsterdam,4.8833,52.3667,"Dit omvat financiële, management-, beleggers- en bedrijfsrapportage, in afstemming met externe partijen, zoals auditors of toezichthouders;",[],https://www.indeed.nl/rc/clk?jk=b8c8505e0085cafe&fccid=5a5975b9a2989351&vjs=3,We Matter,recruiter,2022-10-06 15:46:48,auditor,indeed.nl,True
b8ce5ce0f4f5ccec,Global Head of Finance,2022-11-05,Thuiswerken in Amersfoort,Amersfoort,5.3875,52.155,"You have minimum of 10 years of relevant experience (auditor experience is valued).
Are you an exceptional Head of Finance, looking for a challenging position…",[],https://www.indeed.nl/company/BiZZdesign/jobs/Global-Head-Finance-b8ce5ce0f4f5ccec?fccid=a98ef548ff8a451c&vjs=3,BiZZdesign,employer,2022-10-06 15:45:48,auditor,indeed.nl,True
b93a6c6367e73229,Senior Accountant - EMEA,2022-04-06,Thuiswerken,,,,"Liaise with external auditors and internal stakeholders to ensure that external audits are finalized on time.
5+ years of relevant work experience in accounting…",[],https://www.indeed.nl/rc/clk?jk=b93a6c6367e73229&fccid=ab1e7aafd1d9f6e4&vjs=3,Bird Rides Inc.,employer,2022-10-06 15:45:48,auditor,indeed.nl,True
b94a859314c24d49,Senior Internal Auditor,2022-08-06,Postcode 3012 in Rotterdam,Rotterdam,4.4792,51.9225,"The Senior Internal Auditor will report directly to the Internal Audit Senior Manager in the US.
The job expectations include performing and supervising several…",[],https://www.indeed.nl/rc/clk?jk=b94a859314c24d49&fccid=6ec0db31727064cc&vjs=3,Lindsay,employer,2022-10-06 15:45:48,auditor,indeed.nl,True
b976b75e5997a48e,Internal Auditor,2022-11-05,Leiden,Leiden,4.4931,52.1583,"Internal Auditor (0,8 - 1,0 FTE).
Als Internal Auditor zet jij in teamverband veelzijdige audits op en voer je deze mede uit.","['4.629', '5.943']",https://www.indeed.nl/rc/clk?jk=b976b75e5997a48e&fccid=ccde10b2ae0c4adb&vjs=3,Universiteit Leiden,employer,2022-10-06 15:45:48,auditor,indeed.nl,True
b98e01e7c081c704,Nacht Receptionist / Night Auditor (FT/PT),2022-11-05,Postcode 2131 in Hoofddorp,Hoofddorp,4.6667,52.3,"Een professioneel, 4-sterren superior hotel aan de rand van het Haarlemmermeerse Bos in Hoofddorp met 260 moderne hotelkamers en 10 vergaderruimtes.",[],https://www.indeed.nl/rc/clk?jk=b98e01e7c081c704&fccid=4ec755fc1adbab96&vjs=3,Claus Park Collection,employer,2022-10-06 15:45:48,auditor,indeed.nl,False
b9f5b21eb3276194,Global IT SAP Audit Manager,2022-11-05,Hoofddorp,Hoofddorp,4.6667,52.3,"Assessing our internal control systems to unearth deficiencies, you’ll make recommendations that help us raise standards while ensuring our teams remain…",[],https://www.indeed.nl/rc/clk?jk=b9f5b21eb3276194&fccid=8e1b3eba64c2138d&vjs=3,ASICS,employer,2022-10-06 15:45:48,auditor,indeed.nl,True
ba193fcd39fb8ed5,(Junior) Finance Accountant,2022-11-05,Breda,Breda,4.775,51.5875," Werkt samen met externe partijen als auditors en Payroll-en benefits gerelateerde dienstverleners;
Je bent verantwoordelijk voor het borgen van financiële…",[],https://www.indeed.nl/rc/clk?jk=ba193fcd39fb8ed5&fccid=c9b4032503335048&vjs=3,Deen,recruiter,2022-10-06 15:46:48,auditor,indeed.nl,True
ba2b5c63672e94a7,Information Security Officer,2022-11-05,Leidschendam,Leidschendam,4.4,52.0833,You have experience working with internal and external auditors and demonstrated experience in application security practices and IT Risk & Security governance.,[],https://www.indeed.nl/rc/clk?jk=ba2b5c63672e94a7&fccid=10ed9e123e978078&vjs=3,Fugro,employer,2022-10-06 15:45:48,auditor,indeed.nl,True
bbb1423e259c2b9f,Global Head of Competition & Consumer Law,2022-11-05,Amsterdam,Amsterdam,4.8833,52.3667,Experience with accounting matters and working with external auditors in taking provisions related to open investigations and/or litigation.,[],https://www.indeed.nl/rc/clk?jk=bbb1423e259c2b9f&fccid=62ee2fabbf8c93c5&vjs=3,Booking.Com,employer,2022-10-06 15:45:48,auditor,indeed.nl,True
bc18798ad7d38b83,Auditor Innovation & Technology (IT),2022-11-05,Thuiswerken in Postcode 3521 in Utrecht,Utrecht,5.1222,52.0908,Als Innovation & Technology auditor draag je bij aan het verbeteren van de kwaliteit en risicobewustheid van de bank door het uitvoeren van interne audits.,"['60.000', '120.000']",https://www.indeed.nl/rc/clk?jk=bc18798ad7d38b83&fccid=db0b8cca1616eafb&vjs=3,Rabobank,employer,2022-10-06 15:45:48,auditor,indeed.nl,True
bca3e0eec1122889,"Sr. Manager, Controller",2022-05-23,Amsterdam,Amsterdam,4.8833,52.3667,"Actively interact on the Special Purpose Financial Statements audit process, including interaction with external auditors;",[],https://www.indeed.nl/rc/clk?jk=bca3e0eec1122889&fccid=b5ac784a97a298dd&vjs=3,SABIC - Saudi Basic Industries Corp.,employer,2022-10-06 15:45:48,auditor,indeed.nl,True
bcddfc6689fe0f53,Internal Auditor,2022-11-05,Apeldoorn+1 plaats,Apeldoorn,5.97,52.21,"Auditervaring als internal auditor of extern accountant bij een complexe organisatie.
""Mijn werk trekt me omdat ik meedenk en advies geef dat ertoe doet.","['3.993', '5.557']",https://www.indeed.nl/rc/clk?jk=bcddfc6689fe0f53&fccid=5669a89b3a19b7fa&vjs=3,Achmea,employer,2022-10-06 15:45:48,auditor,indeed.nl,True
bd06e4029502a4c2,Internal Control Specialist,2022-09-06,Eindhoven,Eindhoven,5.4778,51.4408,"You maintain contact with the internal and external auditors, including coordination of activities and follow-up on internal control findings and improvements.",[],https://www.indeed.nl/rc/clk?jk=bd06e4029502a4c2&fccid=1d8ccca292353db7&vjs=3,DAF,employer,2022-10-06 15:45:48,auditor,indeed.nl,True
bd1eea2abfb4870b,Management Consultant,2022-11-05,Postcode 6662 in Elst,Elst,5.8378,51.9156,"Mooi! Wij zijn op zoek naar gemotiveerde collega’s.
Na implementatie moet het managementsysteem gecontroleerd worden, dit doen wij aan de hand van een interne…","['2.500', '3.000']",https://www.indeed.nl/company/KAM-Certificeringen/jobs/Management-Consultant-bd1eea2abfb4870b?fccid=dd50a3dc8dd574ae&vjs=3,KAM Certificeringen,employer,2022-10-06 15:45:48,auditor,indeed.nl,True
bd3bfaeb76fee66d,Accounting Manager - Private Equity,2022-11-05,Postcode 1101 in Amsterdam-Zuidoost,Amsterdam,4.8833,52.3667,"You will build strong customer relationships with existing and new clients, banks, auditors and other external parties, gaining insight into their needs and…",[],https://www.indeed.nl/rc/clk?jk=bd3bfaeb76fee66d&fccid=82cf767bda52e8f4&vjs=3,IQ-EQ,employer,2022-10-06 15:45:48,auditor,indeed.nl,True
bd8ee23b93039339,PROJECT COORDINATOR CUSTOMER SERVICE,2022-11-05,Thuiswerken in Postcode 3821 in Amersfoort,Amersfoort,5.3875,52.155,Als Customer Service Officer ben je de verbindende schakel tussen onze klanten en de auditoren die de audits uitvoeren bij onze klanten.,[],https://www.indeed.nl/company/Bureau-Veritas/jobs/Project-Coordinator-Customer-Service-bd8ee23b93039339?fccid=fdd8787d3dc18c3e&vjs=3,Bureau Veritas,employer,2022-10-06 15:45:48,auditor,indeed.nl,True
bdb63ce00b0f9269,Business Risk Specialist,2022-11-05,Utrecht,Utrecht,5.1222,52.0908,"Financieel Risico Management en Model Beheer (FRM MB).
Financieel Risico Management en Model Beheer (FRM MB).
In ieder geval een economisch wo-diploma.",[],https://www.indeed.nl/rc/clk?jk=bdb63ce00b0f9269&fccid=618626d7747c90e7&vjs=3,Tortus,recruiter,2022-10-06 15:46:48,auditor,indeed.nl,True
bf0428ed21820a72,Junior IT auditor,2022-11-05,Thuiswerken in Postcode 1334 in Almere+1 plaats,Almere,5.2256,52.3758,"Onze kernwaarden zijn no-nonsens, samenwerken, deskundigheid, plezier en betrokken.
Communicatief vaardig in zowel woord als geschrift.",[],https://www.indeed.nl/rc/clk?jk=bf0428ed21820a72&fccid=cd376fff3bd26e11&vjs=3,Avensus Nederland,employer,2022-10-06 15:45:48,auditor,indeed.nl,True
bf50569509829989,Director Risk & Compliance,2022-05-28,Schiphol,,,,"Trivium Packaging is a global leader in metal packaging with 60 locations worldwide, nearly 8,000 employees, and an annual revenue of approximately €3.0…",[],https://www.indeed.nl/rc/clk?jk=bf50569509829989&fccid=a380d9bcb991d4bf&vjs=3,Trivium Packaging,employer,2022-10-06 15:45:48,auditor,indeed.nl,True
bf5802abe5b38d52,Sr. Assistant Audit Den Haag,2022-02-06,Den Haag+1 plaats,Den Haag,4.2986,52.0767,"Als Senior Assistant Audit heb je altijd het juiste antwoord op de vragen van je klanten.
Je hebt een hbo- of wo-opleiding accountancy of bedrijfseconomie…",[],https://www.indeed.nl/rc/clk?jk=bf5802abe5b38d52&fccid=1bfec2a2f61dd5c2&vjs=3,Baker Tilly,employer,2022-10-06 15:45:48,auditor,indeed.nl,True
bf649a288cee54dc,Nachtreceptionist Luxe 5* hotel,2022-11-05,Amsterdam,Amsterdam,4.8833,52.3667,"Bij voorkeur werkervaring hebben in een functie als nachtreceptionist/night auditor of gelijkwaardig.
Voor een zeer luxe 5* hotel in het centrum van Amsterdam…",[],https://www.indeed.nl/pagead/clk?mo=r&ad=-6NYlbfkN0DayD-VsQstSDLYZLKnDsg23kG1Gv9L_yHqjePTwvzpgdJCQ-RSluLbCa6p-6yziqkseo7T3_sIKTPxXF-wXH2De_sNvXMtlNbm25EuESpUJx2sRvTxAGQdLbmqlhsZfm6c65KJTyjrPeJNCVuOOFX0IT2EhhO7Xtehhtv-I50OF9_8qWgD31mgUE0yBCN38jD98aiDE7el5EP43jGGATQ5oYiwDsNaLDpkQJvXfTWP4bMYd0hNoejLhaE9fY7lgZbNmdDAHzQkNhHJ2t2oEZNqLkIh5chNaQOvpjgTcnchF1nJmGpwqNYt7yKWk7kS76UntI5GHBrk7L0MLa50lkSsid1M1iYjRgI-fqUskAXPTNQ7uORMEmW_30dK2o6JgEA-TVSpv9LaChFceU3tC0rjXZ7fD0ivwFmPKH0EAZyiphzlO2ts4UO6Q32XdAZ5xEmk61xo2EToUQj7O_e0lKAWyTe7tVHHLr6-i3ryfYlfMm_MjM3y0-ck2E01WB-sfkgiU5Isx9tNfOBUpqeoxZJNDM9Z-82Q0S6NrI0o59d9L-wHc3-m8oBYplwAN7RDW9ee9ta7liaHxZgszsME6ZxDGUNEiDzL4Thlg_nheJpJf_IgnPNc_zrGhxKMF-8QV5B5jtBKrYOvfGdSXhyP9ZYNb3YBGMp9Vh1HRSLqxspb984h5kqID6wxuYVLbiIUk7Q=&p=4&fvj=0&vjs=3,TDC Groep,employer,2022-10-06 15:45:48,auditor,indeed.nl,False
c06105af8dd3a5ce,Associate Accountant (General Ledger),2022-11-05,Nieuw-Vennep,,,,"Liaises with external and internal auditors, provides inputs & explanations to auditor data requests.
This role focuses on performing accounting, financial…",[],https://www.indeed.nl/rc/clk?jk=c06105af8dd3a5ce&fccid=45760e614a6eb614&vjs=3,Frendz Finance,recruiter,2022-10-06 15:46:48,auditor,indeed.nl,True
c07cff0237063d6f,International career in Finance,2022-11-05,Amsterdam,Amsterdam,4.8833,52.3667,"Excellent opportunity for people working in accountancy with 4-8 yrs experience.
The Internal Audit department (IAD) is part of the corporate function and…",[],https://www.indeed.nl/rc/clk?jk=c07cff0237063d6f&fccid=831b1667b781d443&vjs=3,Tewes,recruiter,2022-10-06 15:46:48,auditor,indeed.nl,True
c0df02b49d1b3876,Senior Information Security Officer,2022-11-05,Rotterdam,Rotterdam,4.4792,51.9225,"Function as an internal auditor on the security framework within Mendix.
Mendix employees have the opportunity to work in a hyper-growth environment with the…",[],https://www.indeed.nl/rc/clk?jk=c0df02b49d1b3876&fccid=d906a35a8b5e576b&vjs=3,Mendix,employer,2022-10-06 15:45:48,auditor,indeed.nl,True
